,text,redditid,subreddit,metareddit,time,author,ups,downs,authorlinkkarma,authorkarma,authorisgold
202,gang rape            ,d01g34r,imgoingtohellforthis,humor,1455590903.0,MildlySuspiciousBlob,1.0,0.0,0,0,
203,cuz they dont speak english ,czz8a9y,imgoingtohellforthis,humor,1455423791.0,KKraKHeD,1.0,0.0,0,0,
204,it s hard being a conservative republican  but also liking reddit ,czzkgly,imgoingtohellforthis,humor,1455461367.0,dxlb,1.0,0.0,0,0,
205, ftfy   http  iimgurcommbkwn3qpng  1  you re welcome  ,d01l1rg,imgoingtohellforthis,humor,1455599298.0,iRub1Out,29.0,0.0,16034,4414,0.0
206,not to blow the party  see what i did there  yeah  i m proud of myself  but the skeletal configuration has plenty of variations from ethnicity to ethnicity  specially in those of neanderthal ascendance ,czy55w5,imgoingtohellforthis,humor,1455335559.0,juancarias,21.0,0.0,1,1792,0.0
207,iraqi divorce procedure was swift under saddam s rule on the bright side  the courts were not tied in proceedings for too long ,d002vgc,imgoingtohellforthis,humor,1455493990.0,whereismysafespace_,1.0,0.0,0,0,
208,,45st7r,imgoingtohellforthis,humor,1455482231.0,ntheg111,74.0,0.0,0,0,
209,that guys going to be talking the whole fucking movie,d02s76v,imgoingtohellforthis,humor,1455679663.0,Cycleboy675,2.0,0.0,0,0,
210,nothing but the best for our returned vets ,d01jpr3,imgoingtohellforthis,humor,1455596784.0,PM_Me_The_Surprise,27.0,0.0,2,136,0.0
211,is this real,d02l33j,imgoingtohellforthis,humor,1455668655.0,aworriedentity,1.0,0.0,0,0,
212,,465e3i,imgoingtohellforthis,humor,1455667120.0,drnick316,82.0,0.0,0,0,
213,so what  the black guy would bash that random guy because he dyed his hair ,d02s8mn,imgoingtohellforthis,humor,1455679729.0,Gurner,0.0,0.0,0,0,
214,kinda looks like kimbo slice,d02tpc5,imgoingtohellforthis,humor,1455682225.0,Dyslexicus,0.0,0.0,0,0,
215,yea if the black guy got up to quick i d punch him too since he probable grabbed my wallet or watch,d02kmc4,imgoingtohellforthis,humor,1455667930.0,Buttsex_and_Skittles,18.0,0.0,0,0,
216,good shit right here,czzwf8b,imgoingtohellforthis,humor,1455482811.0,squiggleman4,2.0,0.0,1052,509,0.0
217, i can fuck any girl i want ,d005li6,imgoingtohellforthis,humor,1455499129.0,sexaddict83,3.0,0.0,1,2466,0.0
218,,45hsad,imgoingtohellforthis,humor,1455323371.0,viggity,267.0,0.0,5806,390,0.0
219,need more jpg ,czz7gst,imgoingtohellforthis,humor,1455422165.0,Erzerker,3.0,0.0,1,465,0.0
220, the black beast  ,d02md1u,imgoingtohellforthis,humor,1455670584.0,fluffy_neck_beard,2.0,0.0,1,1237,0.0
221,for all those that dont keep up with ann  ape news network   it is a reference to a line in one of kanye s new songs,d027lsu,imgoingtohellforthis,humor,1455649716.0,crumcakes,14.0,0.0,0,0,
222,,463fk4,imgoingtohellforthis,humor,1455642725.0,LondonOnDaTrackk,717.0,0.0,0,0,
223,dear diary  my first date with der fuhrer  and it was a gas ,d02jtf8,imgoingtohellforthis,humor,1455666654.0,Newbosterone,2.0,0.0,0,0,
224,make sure she is kampfterable first ,d024reg,imgoingtohellforthis,humor,1455645867.0,BallisticMidgets,5.0,0.0,0,0,
225,blargh ,d024b6k,imgoingtohellforthis,humor,1455645255.0,PaulYall,1.0,0.0,1,5194,0.0
226,lol,czzf1bl,imgoingtohellforthis,humor,1455442134.0,KKraKHeD,-1.0,0.0,1,334,0.0
227,whats wrong never seen a ghoul before smoothskin,czyzbpc,imgoingtohellforthis,humor,1455407858.0,bigpat112,33.0,0.0,406,624,0.0
228,a real life ghoul,czz2jrg,imgoingtohellforthis,humor,1455413672.0,ASAPZackB69,3.0,0.0,2,2,0.0
229,i could not not read this in ghoulvoice fuckin  smoothskins ,czzidh8,imgoingtohellforthis,humor,1455455925.0,EarthwormJim94,3.0,0.0,480,6174,0.0
230,new enemy confirmed for outlast 2,czzqs4n,imgoingtohellforthis,humor,1455473162.0,skeletaltubaplayer,2.0,0.0,6,415,0.0
231,,45ljmz,imgoingtohellforthis,humor,1455384230.0,matthewhugh84,462.0,0.0,63606,7429,0.0
232,is that you  deadpool ,czyxygn,imgoingtohellforthis,humor,1455405424.0,Kordillionaire,6.0,0.0,51,523,0.0
233,this is the dumbest thing i ve read today but i laughed ,d00f5p4,imgoingtohellforthis,humor,1455518779.0,lasermancer,23.0,0.0,7116,11047,0.0
234,all joking aside  the news that this cunt died made my day,d02k51d,imgoingtohellforthis,humor,1455667181.0,ItsDominare,0.0,0.0,0,0,
235,looks like fallout was nt exaggerating too much,czypfz7,imgoingtohellforthis,humor,1455390223.0,OnFunAndDrugs,64.0,0.0,386,10468,0.0
236,felt like this for 12 fucking years  12     ,d00tr5l,imgoingtohellforthis,humor,1455557286.0,lolis_for_Trump,2.0,0.0,212,6939,0.0
237,https  enmwikipediaorgwikicomma,d01byai,imgoingtohellforthis,humor,1455584429.0,mingusdisciple,2.0,0.0,0,0,
238,,45ue8y,imgoingtohellforthis,humor,1455504140.0,Descyfer,90.0,0.0,0,0,
240,too soon ,d02syte,imgoingtohellforthis,humor,1455680945.0,mpmontero,1.0,0.0,37856,17960,0.0
241,what is the meaning of the first photo ,czy74fz,imgoingtohellforthis,humor,1455339914.0,LopsidedLolly,2.0,0.0,0,0,
242, i see this one at least once a week   https  iimgurcomdxuvualjpg ,czza03o,imgoingtohellforthis,humor,1455427386.0,4tchan,1.0,0.0,0,0,
243,add a picture of my greatest achievements because they re just too common ,czjh7zv,imgoingtohellforthis,humor,1454310042.0,MrGlorifiedCake,25.0,0.0,0,0,
244,gay,czjf1ij,imgoingtohellforthis,humor,1454304419.0,PompousDinoMan,15.0,0.0,0,0,
245,daddy ,czju4xm,imgoingtohellforthis,humor,1454345017.0,dalton121236,3.0,0.0,0,0,
246,ban this retard ,czkualt,imgoingtohellforthis,humor,1454406258.0,DubsChekm,15.0,0.0,0,0,
247,have nt gone through the whole list  but imma assume  it   http  imgurcomazzirb  was nt on there because someone just posted it ,czn4gqt,imgoingtohellforthis,humor,1454554849.0,TheMuffinguy,3.0,0.0,0,0,
248,rude,czoeal4,imgoingtohellforthis,humor,1454641654.0,whereisbreakfast,2.0,0.0,0,0,
249,,43mqo7,imgoingtohellforthis,humor,1454299364.0,ParisaXOXO,434.0,0.0,0,0,
250,21 was gold,czlpf2a,imgoingtohellforthis,humor,1454461154.0,mitchtheshark,4.0,0.0,0,0,
251,go to hell already ,czjjwhr,imgoingtohellforthis,humor,1454319849.0,strawman_chan,5.0,0.0,0,0,
252,why are they bannable  too offensive ,cztrtsn,imgoingtohellforthis,humor,1455045555.0,AHRIs_JUICY_ANUS,2.0,0.0,0,0,
253,i ve seen this comic 3 times already https  iimgurcomjtnnurajpg,cztz5ef,imgoingtohellforthis,humor,1455055306.0,xXplainawesomeXx,5.0,0.0,0,0,
254, i propose that this is added in it s older than a monkey s twat   http  iimgurcomcjwb0fgjpg ,d01sv6r,imgoingtohellforthis,humor,1455624263.0,box-art,1.0,0.0,0,0,
255,ikr,d00b48a,imgoingtohellforthis,humor,1455509340.0,Yoshi_IX,3.0,0.0,1346,9966,0.0
256,https  youtube6aeh4vb37l0,d00eqzy,imgoingtohellforthis,humor,1455517663.0,g21redman,5.0,0.0,1053,157,0.0
257,i do nt get the last one  inserting a candy bar into the pistol ,czmaoqh,imgoingtohellforthis,humor,1454512205.0,bingiton,9.0,0.0,132,6253,0.0
258,yep that s just fucking great i clicked this and now there is a black van sitting outside my home ,d029lmi,imgoingtohellforthis,humor,1455652389.0,KimJongUnNK,2.0,0.0,2236,5988,0.0
259,im in  lets go    ,d01tae5,imgoingtohellforthis,humor,1455625648.0,elkahira,0.0,0.0,226,1016,0.0
260,you son of a bitch ,d02ajzb,imgoingtohellforthis,humor,1455653676.0,forever1228,1.0,0.0,1,23811,0.0
261,wwwisisdatecom has had explosive growth of new members,d02uqsj,imgoingtohellforthis,humor,1455684092.0,Cycleboy675,1.0,0.0,206,15,0.0
262,you spelt baghdad wrong so i say you have to bomb it now ,d025g9e,imgoingtohellforthis,humor,1455646810.0,Peragon888,1.0,0.0,0,0,
263,aaaand it s down ,d029tbb,imgoingtohellforthis,humor,1455652673.0,samaxecampbell,2.0,0.0,0,0,
264,goddamnit  now i m on yet another list fuck you op ,d01x0it,imgoingtohellforthis,humor,1455634346.0,sinadoh,2.0,0.0,0,0,
265,stupid,d026e31,imgoingtohellforthis,humor,1455648081.0,BlackCreed92,1.0,0.0,0,0,
266,im on some list now thanks ,d01to3w,imgoingtohellforthis,humor,1455626802.0,A_Generic_Throw,121.0,0.0,0,0,
267,this link is nt helped by the fact that i was previously watching sjw s defend isis yay i m on another list now  d,d01udc4,imgoingtohellforthis,humor,1455628732.0,Blue_Est_Of_Pandas,12.0,0.0,0,0,
268,i ca nt believe i clicked that ,d0241q9,imgoingtohellforthis,humor,1455644898.0,Embryo557,2.0,0.0,0,0,
269,well fuck  thanks for getting me on a list ,d02dbr1,imgoingtohellforthis,humor,1455657328.0,PM_ME_UR_NETFLIX_,2.0,0.0,0,0,
270,,4624or,imgoingtohellforthis,humor,1455623706.0,krysvac,178.0,0.0,0,0,
271,joined this website computer exploded in fire please advise ,d02jy2c,imgoingtohellforthis,humor,1455666874.0,madd74,2.0,0.0,0,0,
272,you know i was looking for a place to get in shape without going to the gym ,d01sujs,imgoingtohellforthis,humor,1455624200.0,CrazyGlueUnderpants,11.0,0.0,0,0,
273,aaaand it s gone ,d0293ap,imgoingtohellforthis,humor,1455651712.0,iccookies100,2.0,0.0,0,0,
274,op  you pussy  you put a disclaimer at the bottom ,d02568t,imgoingtohellforthis,humor,1455646432.0,Vincentpersichetti,2.0,0.0,0,0,
275,you almost got mealmost ,d02fo3t,imgoingtohellforthis,humor,1455660454.0,Real_Cicero,1.0,0.0,0,0,
276,take a look outside your windows that van you see  you can thank op for that ,d020dy1,imgoingtohellforthis,humor,1455639757.0,waxvampire,20.0,0.0,0,0,
277,i did not mean to click that i was trying to scroll honest ,d02s04l,imgoingtohellforthis,humor,1455679344.0,Sir_Slurpsalot,1.0,0.0,0,0,
278,why is tel aviv not an option ,d02ovi9,imgoingtohellforthis,humor,1455674418.0,forsovngarde,1.0,0.0,0,0,
279,itt  people on some sort of list ,d02d9nm,imgoingtohellforthis,humor,1455657250.0,BallisticMidgets,1.0,0.0,0,0,
280,aaaaaaand now i m on a list,d02mvst,imgoingtohellforthis,humor,1455671407.0,Hardboiledgregg,1.0,0.0,0,0,
281,now  every day for the rest of my life  i will be living in consent fear of fbi abducting me  thanks op ,d02bl6k,imgoingtohellforthis,humor,1455655013.0,XXX_ON1-CH9N_XXX,1.0,0.0,0,0,
282,why two glorious swedish cities on the bomb list ,d02behw,imgoingtohellforthis,humor,1455654773.0,ludward,1.0,0.0,0,0,
283,just added a leaderboard on referralpoints that you can see if logged in thought you might like that  ,d02uvi7,imgoingtohellforthis,humor,1455684330.0,krysvac,1.0,0.0,0,0,
284,gt  where should our next bomb be sent  gt  no israel option smdh 2016,d02npc5,imgoingtohellforthis,humor,1455672643.0,GatherLogs,1.0,0.0,0,0,
285,use this referral link so i can go to syria to train with friendos http  joinisisorgindexphp  referral  3757b031a1e9702,d02rcn9,imgoingtohellforthis,humor,1455678274.0,huffpuff1337,1.0,0.0,0,0,
286,you re going to spend the rest of your life dreading the  knock on the door  where the cia helicopter you to gitmo  and you spend the next 20 years being reamed out by horny terrorists,d02k0ai,imgoingtohellforthis,humor,1455666971.0,battle-of-evermore,1.0,0.0,0,0,
287,aaaaaand its down,d029wkz,imgoingtohellforthis,humor,1455652793.0,STEINER420,2.0,0.0,4,89,0.0
288,we re all on the list together at least ,d02bfyv,imgoingtohellforthis,humor,1455654825.0,fignewtonsticker,1.0,0.0,0,0,
289,thanks for getting me on a list  asshole ,d01vq7n,imgoingtohellforthis,humor,1455631845.0,Plzhelpmeahh,5.0,0.0,1,2533,0.0
290,i voted for the next bomb to be in paris,d01y1hr,imgoingtohellforthis,humor,1455636129.0,Silez,5.0,0.0,1589,3043,0.0
291,i am not sure why i clicked that,d024nwj,imgoingtohellforthis,humor,1455645736.0,Chicken_Duck93,4.0,0.0,1,27,0.0
292,great  just got flagged by the nsa and cia for visiting a site with that kind of url ,d01ze9h,imgoingtohellforthis,humor,1455638279.0,variationx,1.0,0.0,1,442,0.0
293,,45uc2m,imgoingtohellforthis,humor,1455503241.0,peanutbutterscotch,89.0,0.0,0,0,
294,my verdict  hilarious,d00dfob,imgoingtohellforthis,humor,1455514375.0,TiredUnicorn,0.0,0.0,0,0,
298, hey  this kid wants a tattoo of two of the recent shooters  do you still have that needle set we used on the guy with hiv  ,d029n33,imgoingtohellforthis,humor,1455652445.0,PM_Me_The_Surprise,42.0,0.0,2,136,0.0
304,explain,d00c6cc,imgoingtohellforthis,humor,1455511548.0,Rawtothedawg,3.0,0.0,0,0,
307,n  r stockholm har mer procent  n g  teborg lt  3,d02mhfr,imgoingtohellforthis,humor,1455670777.0,emanuelklein,1.0,0.0,4094,2149,0.0
308,front page  here we come ,d020s1d,imgoingtohellforthis,humor,1455640325.0,SykoEsquire,1.0,0.0,1,2644,0.0
309,,45t4j5,imgoingtohellforthis,humor,1455485956.0,TheBigBarnOwl,0.0,0.0,0,0,
310,,45nhc2,imgoingtohellforthis,humor,1455407698.0,Dallben,16.0,0.0,0,0,
311,he was with me in a book depository taking in the sights and sounds of dallas ,czzenkw,imgoingtohellforthis,humor,1455440539.0,Murderous_Hobo,2.0,0.0,0,0,
312,i do nt understand this post ,czzcb0g,imgoingtohellforthis,humor,1455432710.0,WhatsThatSkaSong,4.0,0.0,0,0,
344,deltaechoalphadelta,czzgwpy,imgoingtohellforthis,humor,1455450536.0,KKraKHeD,1.0,0.0,0,0,
345,the only flaw i can see in this reasoning is that cheney would never do the world such a favor ,czywsk6,imgoingtohellforthis,humor,1455403377.0,Xendarq,-2.0,0.0,0,0,
346,antonin scalia is dee eee aye dee,czzd2t7,imgoingtohellforthis,humor,1455434991.0,Coker6303,2.0,0.0,1,20,0.0
347,lollipop ,czzeu27,imgoingtohellforthis,humor,1455441292.0,KKraKHeD,1.0,0.0,0,0,
348,induced vomiting ,czzoom0,imgoingtohellforthis,humor,1455469558.0,Almighty_Dew,1.0,0.0,0,0,
349, schools   http  iimgurcom5yvxxjpg ,czz0sp3,imgoingtohellforthis,humor,1455410485.0,CyanEve,2.0,0.0,18,1198,0.0
350,usually takes a few police officers and the kids parents ,czyzljv,imgoingtohellforthis,humor,1455408346.0,MikeWindsor,1.0,0.0,631,1571,0.0
353,,45rdt9,imgoingtohellforthis,humor,1455465780.0,Almighty_Dew,5085.0,0.0,4676,2647,0.0
354,reminds me of  this   http  staticfjcdncompicturesjesusishitlerhi_446985_4048862jpg  ,czzt947,imgoingtohellforthis,humor,1455477306.0,Haizenberg,508.0,0.0,2667,3225,0.0
355,you could also make whores,czzoly2,imgoingtohellforthis,humor,1455469431.0,Yoguls,195.0,0.0,1257,8754,0.0
356,http  imgurcomgg7hwit,czzt6j3,imgoingtohellforthis,humor,1455477182.0,Akesgeroth,36.0,0.0,21564,117636,0.0
357,is this a multiple choice test ,czzrdrv,imgoingtohellforthis,humor,1455474145.0,KKraKHeD,4.0,0.0,1,334,0.0
358,i liked your version more ,czzojtj,imgoingtohellforthis,humor,1455469329.0,popesnutsack,12.0,0.0,1,48090,0.0
359,do nazi s hate jews for the same reason that blacks hate whites   hate anything that s got more money  why nazi s  why ,d0049qv,imgoingtohellforthis,humor,1455496628.0,TheNightWind,3.0,0.0,1,18767,0.0
360,talk about your psalms  talk about john 3  16  austin 3  16 says i just whipped your ass    https  wwwyoutubecomwatch  v  m6jisefnqzk ,czzs8i6,imgoingtohellforthis,humor,1455475574.0,StoneGoldX,7.0,0.0,1148,141205,1.0
361,commas  how do they  work ,czzv6yg,imgoingtohellforthis,humor,1455480636.0,kalizar,3.0,0.0,379,4098,0.0
362,i m going to 4th period after posting this  ber subversive meme,czzruz5,imgoingtohellforthis,humor,1455474942.0,bathroomstalin,-1.0,0.0,37630,114566,1.0
363,top ratheism contributor and strong atheist here so you can save your ed hominoid attacks for your strawmens imaginary friend club  this fact that hitler is in the bible proves the bible has no morality and that my morality is superior do you even understand how important i am  dawkins is the one true prophet and now gay rights for some reason  as a meme once said in a crude web comic  neil degrasse tyson so i am right ,czzuwrb,imgoingtohellforthis,humor,1455480152.0,gilbes,-11.0,0.0,35,9332,0.0
364,well that went from one to dark real fast ,czzscrz,imgoingtohellforthis,humor,1455475777.0,wolfisbad,1.0,0.0,1,227,0.0
365,loved seems to have lost a d ,d004nhy,imgoingtohellforthis,humor,1455497356.0,tboyle6870,1.0,0.0,23,1237,0.0
366,so god gave us hitler ,czzxlfo,imgoingtohellforthis,humor,1455484762.0,Vonnegut9,3.0,0.0,9036,19533,0.0
367, hitler  valentine    https  smediacacheak0pinimgcom564x06695b06695bd9574d62277d90c708242c34d0jpg ,d004ivq,imgoingtohellforthis,humor,1455497111.0,kenabi,2.0,0.0,87,3245,0.0
368,u messed up,czzxl0o,imgoingtohellforthis,humor,1455484742.0,al3xwuzhere,0.0,0.0,20591,1570,0.0
369,hitler was the second coming of jesus christ  this is a wellknown fact at least he and some of his followers thought so ,d00irtv,imgoingtohellforthis,humor,1455531765.0,GatherLogs,1.0,0.0,1,34,0.0
370,hahahaha you are nt going to hell you just witnessed some religious rhetoric that you flipped on its ass ,czzwa0r,imgoingtohellforthis,humor,1455482565.0,TragicSociety,2.0,0.0,534,-100,1.0
371,thanks  that hit the spot in a good way for me tonight ,d0085s2,imgoingtohellforthis,humor,1455503847.0,lravve,1.0,0.0,52,1363,0.0
372,what s nsfw about this ,czzxs0a,imgoingtohellforthis,humor,1455485074.0,xana452,1.0,0.0,745,19653,0.0
373,op can use margins too by the looks of things is that first one not rmildlyinfuriating ,czzyvqb,imgoingtohellforthis,humor,1455486984.0,EsseElLoco,1.0,0.0,306,6332,0.0
374,i miss hitler make germany white again,czzwumg,imgoingtohellforthis,humor,1455483545.0,HannIIbal,9.0,0.0,421,5090,0.0
375,you do nt know you re beautiful  burka remix ,d0282xs,imgoingtohellforthis,humor,1455650361.0,Mistoku,366.0,0.0,253,2821,0.0
376,you can also make  rape butt   i would ve went with rape butt ,czzs84l,imgoingtohellforthis,humor,1455475556.0,Sideshowcomedy,93.0,0.0,37,25099,0.0
377,literally hitler ,d004jla,imgoingtohellforthis,humor,1455497147.0,chechenk,1.0,0.0,133,4375,0.0
378,very good thank you ,d002opm,imgoingtohellforthis,humor,1455493647.0,wgardenhire,1.0,0.0,190,5204,0.0
379,acting like hitler did something wrong give him a break he did more with his life than you ,czzqfkt,imgoingtohellforthis,humor,1455472576.0,urPenguinsRbelong2us,161.0,0.0,6776,5815,0.0
380,it s pronounced  two  you fucking faggot,d02ok52,imgoingtohellforthis,humor,1455673937.0,AjPjSay,6.0,0.0,5071,6243,0.0
381,totally sfw the name hitler is sfw ,czzuq6w,imgoingtohellforthis,humor,1455479845.0,YesMeans_MutualRape,2.0,0.0,1,419,0.0
382,he was much closer to 72 virgins in one direction,d02ma1z,imgoingtohellforthis,humor,1455670455.0,Smutparty,9.0,0.0,1,83,0.0
383,eli5 please,d02dhdd,imgoingtohellforthis,humor,1455657537.0,douchebag_investor,1.0,0.0,28919,23657,0.0
384,he still sexy af  wheeeo momma i m joining isis today bby,d02m2cy,imgoingtohellforthis,humor,1455670123.0,LetMeBeDumb,8.0,0.0,2307,968,0.0
385,since he left  the rest of the group should change their name i suggest  new direction  ,d02uodh,imgoingtohellforthis,humor,1455683968.0,sourwookie,1.0,0.0,470,3043,1.0
386,misdirection,d02b4na,imgoingtohellforthis,humor,1455654428.0,ThanklessTask,87.0,0.0,194,14016,0.0
387,apperantly zayn was inzayn  ,d02f33c,imgoingtohellforthis,humor,1455659649.0,StupidCreativity,1.0,0.0,367,953,0.0
388,with all the facial hair going around these days  how are we supposed to spot the terrorists ,d02rizc,imgoingtohellforthis,humor,1455678562.0,CheckmateAphids,1.0,0.0,28,2112,0.0
389,no i do nt remember ,d02syd7,imgoingtohellforthis,humor,1455680923.0,tenhotuisku,1.0,0.0,19832,106101,0.0
390,damn  i feel old,d02vhwz,imgoingtohellforthis,humor,1455685507.0,bernardotog,1.0,0.0,59,849,0.0
391,is everyone talking in this ebonics style now ,d02nqmz,imgoingtohellforthis,humor,1455672696.0,FreakNoMoSo,4.0,0.0,1,1150,0.0
392,damn  you ve got balls a picture of a pop singer and a picture of a guy with a gun straight to hell with you ,d02q9yx,imgoingtohellforthis,humor,1455676584.0,Bone_Dogg,2.0,0.0,557,9825,0.0
393,and a lot of teen girls would still love him too   thats what pisses me off,d02h5kn,imgoingtohellforthis,humor,1455662556.0,GlassBoddle,12.0,0.0,513,641,0.0
394,how is he gon na noscope n00bz if his ak is on safe  ,d02rslo,imgoingtohellforthis,humor,1455678999.0,wallieburger,1.0,0.0,402,4407,0.0
396,that obviously jared leto ,d02ovi4,imgoingtohellforthis,humor,1455674418.0,DammitDan,1.0,0.0,3147,84156,1.0
397,i ve always thought he looked kinda isisy,d02atu1,imgoingtohellforthis,humor,1455654034.0,Str8OuttaFlavortown,50.0,0.0,1054,10156,0.0
398, goin out tonight  changin into a bomb vest ,d02ekhn,imgoingtohellforthis,humor,1455658976.0,f_bastiat,2.0,0.0,15997,38661,0.0
399,he da bomb,d02ef34,imgoingtohellforthis,humor,1455658781.0,donteatgrains,-1.0,0.0,10133,6884,0.0
400,is this real ,d02ai3y,imgoingtohellforthis,humor,1455653601.0,landlubber12,-9.0,0.0,2354,9446,0.0
401,fuckin daesh ,d02mnpk,imgoingtohellforthis,humor,1455671056.0,flying_ducky,0.0,0.0,378,6184,0.0
402,have you heard pillow talk  isis would not approve,d02glyh,imgoingtohellforthis,humor,1455661770.0,chiefsfan71308,9.0,0.0,4103,42645,0.0
403,and id fuck both,d02plyc,imgoingtohellforthis,humor,1455675545.0,johnnytk0,2.0,0.0,168,162,0.0
404,i m calling shenanigans kanye already kicked all of them out of band last year some time because there s only direction  fam  and he says it s  53 million dollars of debt to the west ,d02ecqy,imgoingtohellforthis,humor,1455658696.0,mmp,-10.0,0.0,1371,2406,0.0
405,,463r9b,imgoingtohellforthis,humor,1455646592.0,Zulu-warrior1,3554.0,0.0,6337,315,0.0
406,he is actually making really shitty rnb hip hop or whatever and just sucking dick at it like someone who just puts their mouth on it and doesnt know what to do sucks it just annoying and frustrating ,d02t7dw,imgoingtohellforthis,humor,1455681349.0,HeteroFlexible_,1.0,0.0,1,231,0.0
407,,45zfsm,imgoingtohellforthis,humor,1455578265.0,mikeybthehuman,66.0,0.0,45635,2812,0.0
408,  jihadfor1d,d02642o,imgoingtohellforthis,humor,1455647700.0,please-dont-hurt-me,144.0,0.0,1136,10074,0.0
409,he is damn sexy  i might convert ,d02m4f8,imgoingtohellforthis,humor,1455670211.0,chris420medlin,1.0,0.0,22,158,0.0
410,dammit zayn hussein,d02n2wl,imgoingtohellforthis,humor,1455671712.0,GodMode_Activated,0.0,0.0,1,4254,1.0
411,when i looked this guy up whenever it was he left  the wikipedia page said he left to join isis i ve got a screencap  but just take my word for it ,d02ggpk,imgoingtohellforthis,humor,1455661566.0,PFGtv,-2.0,0.0,23,3641,0.0
412,at least you could have photoshopped his facelooks nothing like him,d02czeq,imgoingtohellforthis,humor,1455656870.0,throwitdontshowit,-9.0,0.0,0,0,
413,gt  this him now  who tweeted this  cookie monster ,d02satf,imgoingtohellforthis,humor,1455679829.0,electricmaster23,1.0,0.0,7586,21028,1.0
414,actually his new band is called alqaedirection,d02t5lo,imgoingtohellforthis,humor,1455681264.0,goonscape,1.0,0.0,38,1699,0.0
415,all jokes aside  is this real life ,d02ncbd,imgoingtohellforthis,humor,1455672105.0,just_a_little_girl,0.0,0.0,1,273,0.0
416,,45ytiu,imgoingtohellforthis,humor,1455571248.0,pizzapaycash,2771.0,0.0,2596,15,0.0
417,is that a ginger jew ,d014hwl,imgoingtohellforthis,humor,1455572755.0,98PercentOdium,493.0,0.0,694,31320,0.0
418, here s his nemesis   http  wwwbreitbartcomlondon20140909gingerjihadiswhyredheadsareattractedtoradicalislam ,d01d45y,imgoingtohellforthis,humor,1455586250.0,whereismysafespace_,12.0,0.0,131,8079,0.0
419,rated for everything up to a paintball ,d01dw9v,imgoingtohellforthis,humor,1455587482.0,Infinitopolis,2.0,0.0,15,35010,0.0
420,i fucking hate those cunts  how they are trying to take over the world  force their fucked up views on us bloody gingers ,d01dclz,imgoingtohellforthis,humor,1455586620.0,rabidnz,7.0,0.0,230,10432,0.0
421,what is up with that stupid hair,d01d720,imgoingtohellforthis,humor,1455586377.0,bryanrobh,5.0,0.0,2,44023,0.0
422,this must be common in isreal,d019lae,imgoingtohellforthis,humor,1455580603.0,clovernuts,2.0,0.0,857,1498,0.0
423,nah jews have the best body armor money can pay curtsey of us tax payers,d01jfid,imgoingtohellforthis,humor,1455596303.0,NickelBackThatAzzUp,1.0,0.0,1245,30412,1.0
424,ron weasley has fallen on hard times ,d01ncx9,imgoingtohellforthis,humor,1455604480.0,electricmaster23,1.0,0.0,7586,21028,1.0
425,the designers balanced the new bonus stats with the fact that it gives 2 kills upon death,d01xoqp,imgoingtohellforthis,humor,1455635533.0,Gemeye,1.0,0.0,486,51989,0.0
426,well that kid will be deaf,d02g0ee,imgoingtohellforthis,humor,1455660932.0,FruitierGnome,1.0,0.0,1,10838,0.0
427,missed the double kill opportunity,d015csy,imgoingtohellforthis,humor,1455574020.0,Foccsmolder,0.0,0.0,1,49,0.0
428,oh lord please tag this as  ginger  nobody should see this unprepared ,d01mwld,imgoingtohellforthis,humor,1455603363.0,Katerwurst,1.0,0.0,261,1254,0.0
429,it s jewish prince harry,d01d95b,imgoingtohellforthis,humor,1455586470.0,craggsy,15.0,0.0,3041,4594,0.0
430,it s ok it s a palestinian baby ,d01h2d7,imgoingtohellforthis,humor,1455592449.0,TheBeardedMarxist,5.0,0.0,32,30444,0.0
431,why is he warning that  honestly  kevlar cheap  but dang ,d01i1xn,imgoingtohellforthis,humor,1455594032.0,Primoris_Causa1,1.0,0.0,115,3063,0.0
432,everything up to a 44 magnum,d018ptd,imgoingtohellforthis,humor,1455579208.0,pastrie300,6.0,0.0,8040,10487,0.0
433,why s this thing breastfeeding that other thing ,d01a8ab,imgoingtohellforthis,humor,1455581636.0,JJonatron,5.0,0.0,1613,1732,0.0
434,what exactly did this guy set out to do today ,d01mslp,imgoingtohellforthis,humor,1455603099.0,Chef_Kevorkian,1.0,0.0,242,5086,0.0
435,everything about that picture is unsettling ,d01cj63,imgoingtohellforthis,humor,1455585336.0,Count_Frackula,9.0,0.0,11,7729,0.0
436,levelcap   ,d01of8s,imgoingtohellforthis,humor,1455607446.0,Lappelduvide046,1.0,0.0,1,130,0.0
437,is title is obviously misleading this ginger went into a village  and found his next soul to steal you can tell by the way he is holding the head  that  he is about to preform this maneuver   https  youtube7gdmmn6ydu  t  45s   one all gingers know super well ,d016wps,imgoingtohellforthis,humor,1455576379.0,madd74,88.0,0.0,25197,77587,1.0
438,the only time the jew will hold a palestinian,d027hgy,imgoingtohellforthis,humor,1455649549.0,Kingklang,1.0,0.0,2417,2962,0.0
439,when did ron convert  must have been for hermione  i knew mudblood had another meaning ,d01k5zx,imgoingtohellforthis,humor,1455597586.0,thatoneguywiththecat,2.0,0.0,1,457,0.0
