,text,redditid,subreddit,metareddit,time,author,ups,downs,authorlinkkarma,authorkarma,authorisgold
0,that s not even his final form,d02gjc0,imgoingtohellforthis,humor,1455661670.0,FruitierGnome,1.0,0.0,1,10838,0.0
1,reddit is not gon na like this ,d02vp59,imgoingtohellforthis,humor,1455685904.0,cashcow1,1.0,0.0,13,216544,1.0
2,does the box have holes so they can breath ,d0174xs,imgoingtohellforthis,humor,1455576728.0,Griz1777,2.0,0.0,1180,540,0.0
3,children sold separately or you can use that as bait,d01xi0x,imgoingtohellforthis,humor,1455635207.0,ch1584,2.0,0.0,319,16644,0.0
4,,45uo8h,imgoingtohellforthis,humor,1455508469.0,tttggg333,740.0,0.0,2792,210,0.0
5, removed comeback when you get the balls to post it  edit https  wwwredditcomrimgoingtohellforthiscomments45yzsydo_i_dare_get_banned_by_suburban_moms_thinking_imd015ymg op s not a fag ,d01cbll,imgoingtohellforthis,humor,1455585012.0,spacelemon,1.0,0.0,70029,98105,1.0
6, relevant   https  wwwyoutubecomwatch  v  gdxyzulv0s8 ,d02dhot,imgoingtohellforthis,humor,1455657548.0,Golden12345,1.0,0.0,10,10248,1.0
7,good muzzle   and   trigger discipline   never point the gun at anything you do nt intend to destroy   keep your finger off the trigger until you ve decided to destroy it ,d0081w4,imgoingtohellforthis,humor,1455503651.0,Golden12345,0.0,0.0,10,10248,1.0
8,and imma have the last laugh indian  cause im from a tribe called checkahoe,d02us58,imgoingtohellforthis,humor,1455684158.0,Habs4thewin,1.0,0.0,1,3300,0.0
9,dude  she s your daughter just because she ran off to amsterdamn to work prostitution at a jewish brothel does nt mean she will bang her own dad just send some of your strong arms to buy her and put her in rehab in germany  or better yet  some convent in switzerland ,d02dqwc,imgoingtohellforthis,humor,1455657890.0,WendyLRogers3,-2.0,0.0,428,85673,0.0
10,jihad me at hello,d01q4gd,imgoingtohellforthis,humor,1455613268.0,Foccsmolder,0.0,0.0,1,49,0.0
11, if you re so damn prolife  then why are you obstructing a health clinic  should nt you be picketing a cemetery somewhere   bill hicks,d00es13,imgoingtohellforthis,humor,1455517743.0,BillionTonsHyperbole,10.0,0.0,5,67924,0.0
12,even more evidence that courtney love had him offed,d010znt,imgoingtohellforthis,humor,1455567688.0,WillCookForSex,2.0,0.0,1,6238,0.0
13,people should not be using abortion as a method of birth control,d00ikgf,imgoingtohellforthis,humor,1455530862.0,sickVR6,-19.0,0.0,1,97,0.0
14,,45v24h,imgoingtohellforthis,humor,1455515119.0,Bloodmeister,394.0,0.0,1090,3390,0.0
15,those imgur comments are great,d010xdl,imgoingtohellforthis,humor,1455567598.0,Dooperer1,2.0,0.0,2368,6063,0.0
16,anyone get the  tits or gtfo  both  joke  i do nt ,czm076e,imgoingtohellforthis,humor,1454480829.0,DrWinters,13.0,0.0,12728,1641,0.0
17,,466etv,imgoingtohellforthis,humor,1455681303.0,035036503530,4.0,0.0,1176,12690,0.0
18,this is an underupvoted meme,d00h4uf,imgoingtohellforthis,humor,1455525075.0,Mike_Litorus22,1.0,0.0,5503,549,0.0
19,i really thought there would be some joke at the end but now i m in a mall with a bomb jacket and i m waiting for it but ,d025gsf,imgoingtohellforthis,humor,1455646829.0,mcsmith1003,4.0,0.0,22,1741,0.0
20,there s not nearly enough gay sex for me to be interested  i m going to link this to all my friends at work,d01xar7,imgoingtohellforthis,humor,1455634849.0,ch1584,1.0,0.0,319,16644,0.0
21,fuck me  why did i click that ,d025vep,imgoingtohellforthis,humor,1455647379.0,The_Brain_Fuckler,1.0,0.0,1990,28273,0.0
22,enjoy the no fly list hope you did nt have plans op,d02ejaz,imgoingtohellforthis,humor,1455658933.0,spacelemon,1.0,0.0,70029,98105,1.0
23, op  see you in prison,d01v9k1,imgoingtohellforthis,humor,1455630848.0,SeithElwin,3.0,0.0,1,9,0.0
24,where the fuck is the goat fucking  i do nt need religion  ideology  virgins  or friends i need fucking goats  edit  i might settle for sheep ,d02393m,imgoingtohellforthis,humor,1455643810.0,Nation_On_Fire,9.0,0.0,634,1453,0.0
25,i thought this would be a funny parody pagei too  am now on a list ,d02857h,imgoingtohellforthis,humor,1455650445.0,skazzbomb,2.0,0.0,3725,7151,0.0
26,i do nt think it would be that clean and jqueryish  though ,d02bxak,imgoingtohellforthis,humor,1455655452.0,knobbysideup,1.0,0.0,326,7364,0.0
27,i joined  and i am going to europe for spring break what type of bomb do you guys recommend ,d02tpct,imgoingtohellforthis,humor,1455682226.0,Notceltic,1.0,0.0,4,121,0.0
28,you re on a list now ,d01tekx,imgoingtohellforthis,humor,1455626008.0,MicroKayla,3.0,0.0,994,8445,1.0
29,you re an asshole  this is nowhere near funny  people are dying in iraq and syria and you re making jokes like this  fuck you isis sympathizer  i hope you get banned ,d02eb0w,imgoingtohellforthis,humor,1455658635.0,ScaryTheory,-4.0,0.0,10357,1487,0.0
30,awwww  no longer working  i wanted to go in the iss that s what this is for right ,d02a1j3,imgoingtohellforthis,humor,1455652976.0,Chikenofthecave,3.0,0.0,1,3300,0.0
31,signed up for the cool clothes ,d01sstm,imgoingtohellforthis,humor,1455624024.0,ChewyGums,16.0,0.0,69,10168,0.0
32,yeah thanks for the surveillance ,d02s4xx,imgoingtohellforthis,humor,1455679562.0,clovernuts,1.0,0.0,857,1498,0.0
33,fuck,d02autm,imgoingtohellforthis,humor,1455654072.0,sweatynready6969,1.0,0.0,1,263,0.0
34,how long do you guys think this will last before it gets reported on the news ,d020qwn,imgoingtohellforthis,humor,1455640279.0,Hamaro22,2.0,0.0,1205,2053,0.0
35,you fuck  now the feds are gon na steal my rare pepes,d02bpkl,imgoingtohellforthis,humor,1455655176.0,UW0TM80,2.0,0.0,1,151,0.0
36,he went hunting with bernie  circlejerk  sanders,czz2fku,imgoingtohellforthis,humor,1455413465.0,pyrogamerman,10.0,0.0,1,2124,0.0
37,they do nt want you to live,d01ims3,imgoingtohellforthis,humor,1455594961.0,TRUSTMEBABE,1.0,0.0,13,2552,0.0
38,these are fucking ecards anybody can write anything they want into these so why the fuck is this not a text post  oh  right karma ,czz20ui,imgoingtohellforthis,humor,1455412743.0,Cosmic_Bard,5.0,0.0,1986,39940,0.0
39, one down   ,czyx3e9,imgoingtohellforthis,humor,1455403911.0,Batousghost,1.0,0.0,12865,7841,1.0
40,did anyone check and see if lancel provided the wine ,czyya41,imgoingtohellforthis,humor,1455406018.0,The_ArtfulDodger,5.0,0.0,25,1409,0.0
41,he must have gone with dick cheney ,45n2ay,imgoingtohellforthis,humor,1455402141.0,Dr_Long_Schlong,25.0,0.0,1,584,0.0
42,thanks facebook,czyj71t,imgoingtohellforthis,humor,1455379271.0,Bananeurd,10.0,0.0,6734,9551,0.0
43,he did nt die in a hunting accident though ,czywtwc,imgoingtohellforthis,humor,1455403443.0,tlock8,11.0,0.0,22422,19520,0.0
44,,45jitn,imgoingtohellforthis,humor,1455354243.0,burritobattlefield,803.0,0.0,8691,16587,0.0
45,michael jackson with pushpop,czymx3w,imgoingtohellforthis,humor,1455385838.0,vonbraski,1.0,0.0,6783,408,0.0
46,vomiting my dinner ,czyl80y,imgoingtohellforthis,humor,1455382925.0,smookykins,3.0,0.0,136,17072,0.0
47,sex  drugs  and rocknroll ,czzcnt9,imgoingtohellforthis,humor,1455433685.0,Capitalist_Oppressor,2.0,0.0,1,64,0.0
48,ru486,czz9r7u,imgoingtohellforthis,humor,1455426850.0,SpottedPaws,1.0,0.0,546,28371,1.0
49,you know your on a list when your post gets stickied on this sub  d,d01xbjq,imgoingtohellforthis,humor,1455634889.0,khumps,1.0,0.0,4848,2173,0.0
50,what s sad is how easy to navigate this site it compared to many other sites out there ,d025l97,imgoingtohellforthis,humor,1455646998.0,Unicornabis,1.0,0.0,460,642,0.0
51,i have no idea what this post is about ,d02hsux,imgoingtohellforthis,humor,1455663493.0,CynicalSoup,223.0,0.0,2374,5139,1.0
52,meh,d02isrs,imgoingtohellforthis,humor,1455665009.0,Dick_Ripley,4.0,0.0,1,589,0.0
53,didnt care betore  dont care now,d02pbrk,imgoingtohellforthis,humor,1455675107.0,Tebasaki,2.0,0.0,38,20191,0.0
54,still hot as fuck 1010,d02tq4p,imgoingtohellforthis,humor,1455682263.0,vodkalesbian,2.0,0.0,19,940,0.0
55,i actually thought this was true then again  i have no idea who the people from one direction are is this post aimed at 12 yr olds ,d02pfh5,imgoingtohellforthis,humor,1455675266.0,Kurtronic,1.0,0.0,103,16426,0.0
56,all the goats flock to him ,d02sry6,imgoingtohellforthis,humor,1455680631.0,Th3rmal95,1.0,0.0,646,6873,0.0
57,zayn hussein did 911 na nana na ,d02fhug,imgoingtohellforthis,humor,1455660212.0,mormonDykes,1.0,0.0,48,906,0.0
58,bwahaha  good riddance,d02dp1g,imgoingtohellforthis,humor,1455657817.0,secretgspot,-6.0,0.0,4438,8450,0.0
59,one durkrection ,d02i8hx,imgoingtohellforthis,humor,1455664142.0,modun6111,9.0,0.0,32,30,0.0
60,i thought everyone already knew that  zayn did 911   https  wwwyoutubecomwatch  v  nxv5q_gl1r0  ,d02bgju,imgoingtohellforthis,humor,1455654846.0,sn0r,49.0,0.0,6796,19436,0.0
61,still would,d02quwa,imgoingtohellforthis,humor,1455677480.0,AlexOfSpades,1.0,0.0,2030,26171,0.0
62,ah its reddit racisim hour hosted by zuluwarrior1,d02piz4,imgoingtohellforthis,humor,1455675417.0,DrRedPill,5.0,0.0,1,7,0.0
63,br00tal post man  felt the flames of heck from here,d02fpui,imgoingtohellforthis,humor,1455660524.0,RzK,36.0,0.0,28478,125570,0.0
64, remember ,d02mro0,imgoingtohellforthis,humor,1455671229.0,Lexquire,1.0,0.0,41,1808,0.0
65,left onedirection for alqaedarection ,d02clhn,imgoingtohellforthis,humor,1455656344.0,CardboardJesusWoW,2.0,0.0,28,25433,0.0
66,feel old yet ,d02rfpa,imgoingtohellforthis,humor,1455678412.0,GetTold99,1.0,0.0,1,7,0.0
67,this him now ,d02pr0a,imgoingtohellforthis,humor,1455675761.0,MonkOfFunk,1.0,0.0,2387,160,0.0
68,,45un32,imgoingtohellforthis,humor,1455507974.0,conspiracy_thug,4808.0,0.0,58278,108349,0.0
69,anyone else click this hoping to see some awesome asian tits ,d00aytg,imgoingtohellforthis,humor,1455509054.0,WajorMeasel,270.0,0.0,18,54013,1.0
70,she also raises chickens  or were they ,d00gbhn,imgoingtohellforthis,humor,1455522329.0,manbubbles,13.0,0.0,16,669,0.0
71, zip ,d013j12,imgoingtohellforthis,humor,1455571332.0,CertainlyNotTheCIA,1.0,0.0,78,1288,0.0
72,you re a hot asian chick with no shame it s really nothing to be proud of ,d00l2b2,imgoingtohellforthis,humor,1455540836.0,roger_podakter,-6.0,0.0,16146,37717,0.0
73,weakselfpromotion10,d00avic,imgoingtohellforthis,humor,1455508874.0,NickelBackThatAzzUp,-17.0,0.0,1245,30412,1.0
74,god she s attractive,d00h275,imgoingtohellforthis,humor,1455524811.0,xXI_KiLLJoY_IXx,-36.0,0.0,70,3771,0.0
75,,d00ndlo,imgoingtohellforthis,humor,,,,,2,0,0.0
76,i recommend following her twitter she is hilarious,d00k8dx,imgoingtohellforthis,humor,1455537896.0,Shitpains,2.0,0.0,782,2090,0.0
77,what we have here is a smart woman showing the twitter and fb sheeps how they do it wrong ,d00kh35,imgoingtohellforthis,humor,1455538827.0,-DeadHead-,2.0,0.0,9,77,0.0
78,only thing wrong with this post is there is nt a quality tag ,d017meq,imgoingtohellforthis,humor,1455577475.0,Paint_Chip_Nachos,1.0,0.0,123,2602,0.0
79,check out http  wwwdvdasacom she hangs out with this artist david choe the but it s hilarious and they do some really often bizarre and violators and very nsfwvideo blogs  i m not even sure what to call them just enjoy ,d00p5ro,imgoingtohellforthis,humor,1455550095.0,CaptainKyloStark,1.0,0.0,1117,3855,0.0
80, removed ,d00f5zf,imgoingtohellforthis,humor,1455518803.0,[deleted],1.0,0.0,0,0,
81,,460cm1,imgoingtohellforthis,humor,1455590600.0,aukeba,4521.0,0.0,4206,162,0.0
82,you ca nt call them guys anymore when they re postop ,d01gpwo,imgoingtohellforthis,humor,1455591900.0,Smackvein,663.0,0.0,12824,3398,0.0
83,because they ll probably ask you if you re a christian and then will shoot you in the head,d01ht9z,imgoingtohellforthis,humor,1455593642.0,tiamdi,160.0,0.0,943,76938,0.0
84,emo s are suicidal am i right good post 1010 would feel nostalgic about 2007 again,d01r3oc,imgoingtohellforthis,humor,1455617219.0,ThundercuntIII,39.0,0.0,4665,121807,1.0
85,those people look like confused douche bags ,d01qj16,imgoingtohellforthis,humor,1455614854.0,Johnnyfiftyfive,4.0,0.0,15,19247,0.0
86,they do go to your school  you just do nt see them because they re fucking each other behind the bleachers ,d01rtrz,imgoingtohellforthis,humor,1455620255.0,icanhazlurk,2.0,0.0,635,23110,0.0
87,because this is a girl ,d01v6u8,imgoingtohellforthis,humor,1455630682.0,premium_grade,1.0,0.0,1196,1425,0.0
88,haha she said guys ,d01whj4,imgoingtohellforthis,humor,1455633368.0,MrRiggs,1.0,0.0,254,7665,0.0
89,oh come one  those guys are looking like that for that sweet emo pussy  no way they re hanging them selves ,d01wj4a,imgoingtohellforthis,humor,1455633452.0,WarKiel,1.0,0.0,14,14090,0.0
91,lol im slutty lol,d00tcjj,imgoingtohellforthis,humor,1455556690.0,cursed_deity,1.0,0.0,1024,52511,0.0
92,faggots ,d01ofc5,imgoingtohellforthis,humor,1455607454.0,liquidthc,6.0,0.0,8408,5039,0.0
93,iiiiiii want to swiiiing from the chandelier,d0280ba,imgoingtohellforthis,humor,1455650263.0,bluegeyser,2.0,0.0,3,2578,0.0
94,how much work does it take to get your hair to swirl counterclockwise around your face and head like that emobieber on the right  i have always thought that was the weirdest look   sup i got my bowl cut stuck in the dryer this morning something something snapchat ,d01zuly,imgoingtohellforthis,humor,1455638964.0,sosomething,2.0,0.0,3429,12291,0.0
95,took me 30 seconds to realize that this was a vampire joke  not a suicide joke ,d01phg7,imgoingtohellforthis,humor,1455610890.0,Savilo29,65.0,0.0,1,69,0.0
96,when your fake lip ring is too loose ,d01tjfo,imgoingtohellforthis,humor,1455626417.0,oubrew,2.0,0.0,4721,20384,1.0
97,well the emo era is over those who were eno are now hipsters and those still ate emos often grow out of the small window of age where the look actully works pretty quick  you re not a pretty emo at 20 anymore 1317 and no more ,d01r9s6,imgoingtohellforthis,humor,1455617937.0,Retarded_Swede,17.0,0.0,1,5881,0.0
98, low hanging fruit ,d01nu6g,imgoingtohellforthis,humor,1455605764.0,Sylnce,246.0,0.0,52,9491,0.0
99,i hope every person who ever wore their hair in that stupid blow out thing all go bald it would serve them all right ,d028hml,imgoingtohellforthis,humor,1455650909.0,Lord_ThunderCunt,2.0,0.0,1175,38858,0.0
100,they are all 23 year old man children ,d01o1d3,imgoingtohellforthis,humor,1455606324.0,qounqer,17.0,0.0,2014,20219,0.0
101,when you feel bad for laughing  that s when you know it s good just like everything on this subreddit  i suppose ,d01nyw6,imgoingtohellforthis,humor,1455606128.0,thejuvenator,16.0,0.0,3,41,0.0
102,i do nt like emo boys because they remind me of my repressed homosexual tendencies to combat this i just call them faggots and ignore them ,d01qb51,imgoingtohellforthis,humor,1455613984.0,sigh-lent-knight,82.0,0.0,230,124,1.0
103,i read this as  insert wittle tittie here ,d01xgm9,imgoingtohellforthis,humor,1455635139.0,shpadoinkle_,1.0,0.0,122,71,0.0
104,how do these pictures get so fucking pixelated,d01p0ay,imgoingtohellforthis,humor,1455609287.0,Planetkillah,3.0,0.0,101,3787,0.0
105,it s also not 2005 anymore ,d01p6kb,imgoingtohellforthis,humor,1455609863.0,Dramon,588.0,0.0,12513,30703,0.0
106,wait  so they  are nt  lesbians ,d02885g,imgoingtohellforthis,humor,1455650556.0,RustyRon,3.0,0.0,3469,7555,0.0
107,hahahahahahahahahahaha,d01q88m,imgoingtohellforthis,humor,1455613681.0,FraudMallu,2.0,0.0,8,141,0.0
108,https  youtube3iogswh38sa,d01yol2,imgoingtohellforthis,humor,1455637170.0,n00bkilling101,2.0,0.0,433,5338,0.0
109,and i still look like this i m 22 now i mean just the hair  maybe it s just because i m gay,d01sbww,imgoingtohellforthis,humor,1455622301.0,crazywileycoyote,9.0,0.0,3130,4051,0.0
110,please  think abortion,d01rekw,imgoingtohellforthis,humor,1455618501.0,MrDub72off,3.0,0.0,129,10818,0.0
111,did paul walker die ,d02681j,imgoingtohellforthis,humor,1455647854.0,n1ggerl1ps,1.0,0.0,86,-2,0.0
112,the mac in the last frame makes it very convincing,d005nqm,imgoingtohellforthis,humor,1455499240.0,quentim,48.0,0.0,1,2075,0.0
113,did anyone else think she kind of looked like big red ,d00zl2r,imgoingtohellforthis,humor,1455565641.0,JeanValjean197o,3.0,0.0,1,13936,0.0
114,,45t2ij,imgoingtohellforthis,humor,1455485292.0,lawlessnessjelly,77.0,0.0,182,1083,0.0
115,,45ndyd,imgoingtohellforthis,humor,1455406431.0,Chubbybrownbear,23.0,0.0,3008,7828,0.0
116,this is shit i d expect better from even rpolitics,czznwr9,imgoingtohellforthis,humor,1455468185.0,TheGuyAboveMeEatsPoo,4.0,0.0,765,5364,0.0
117,smashing onto your screens at 100mph,czzylbm,imgoingtohellforthis,humor,1455486501.0,Yoguls,3.0,0.0,1257,8754,0.0
118,it s funny cuz it s true,d011ut1,imgoingtohellforthis,humor,1455568929.0,Deadpoolgoesboop,1.0,0.0,1812,4223,0.0
119,more like 7 hours later ,d00zb6o,imgoingtohellforthis,humor,1455565249.0,Erzerker,5.0,0.0,1,465,0.0
120,i love the cat shitting on her nice detail ,d011kr6,imgoingtohellforthis,humor,1455568528.0,jerkreddituser17,1.0,0.0,103,-100,0.0
121,last frame needs a window with the cuck watching in,d00m2kd,imgoingtohellforthis,humor,1455543713.0,ajayisfour,3.0,0.0,266,29292,0.0
122,,45tutt,imgoingtohellforthis,humor,1455495714.0,iCeCoCaCoLa64,686.0,0.0,76973,19763,1.0
123,he was more traditionalist than christian  and other judges are activist  you homosexual imbecile,czziwam,imgoingtohellforthis,humor,1455457499.0,ViolentPhlegms,4.0,0.0,10683,2791,0.0
124,lol wtf isnt this a teeny tiny bit exxagurated ,d00q3yf,imgoingtohellforthis,humor,1455551687.0,fireflaai,-18.0,0.0,17699,3590,0.0
125,sorry but who is he ,czzbhb8,imgoingtohellforthis,humor,1455430662.0,Jesse0016,-2.0,0.0,1,932,0.0
126,,45n8tj,imgoingtohellforthis,humor,1455404480.0,mrwimarobot,22.0,0.0,2693,686,0.0
127,i just spit out chewed radishes on my laptop reading this trick  click here for how i used this simple trick to clean it off,d02qi4t,imgoingtohellforthis,humor,1455676933.0,jhenry922,1.0,0.0,3331,10062,0.0
128,,464ud4,imgoingtohellforthis,humor,1455659902.0,WTFmane,27.0,0.0,6885,8810,0.0
129,dank joke  bro ,czzy2zd,imgoingtohellforthis,humor,1455485606.0,cptn_titty_sprinkles,1.0,0.0,590,2697,0.0
130,i hate you reposter,d02ujrf,imgoingtohellforthis,humor,1455683722.0,daymanahaha,0.0,0.0,15128,14993,0.0
131,,466iw1,imgoingtohellforthis,humor,1455682967.0,monkey_n_pig,2.0,0.0,13600,42820,0.0
132,https  wwwyoutubecomwatch  v  w3h7lz5pxgc,czzq0hl,imgoingtohellforthis,humor,1455471867.0,clandestine801,7.0,0.0,1,539,0.0
133,,463s5r,imgoingtohellforthis,humor,1455646915.0,roartiz,299.0,0.0,3998,1170,0.0
134,    edgy ,d02ef8h,imgoingtohellforthis,humor,1455658786.0,spacelemon,6.0,0.0,70029,98105,1.0
135,why  and furthermore  why would an artist participate in that  aside from my confusion  i think it s nicely done ,d02r1qp,imgoingtohellforthis,humor,1455677787.0,Stephwash,1.0,0.0,1,11911,0.0
136,so fake,d02l6w4,imgoingtohellforthis,humor,1455668817.0,the_disco_pimp,-4.0,0.0,872,3047,0.0
137,looks like eric is pissing blood ,d02934w,imgoingtohellforthis,humor,1455651706.0,Jblonde002,-5.0,0.0,1,21619,0.0
138,ok that is nice and all  but why did they send a boxtruck to save the baby  not an ambulance ,d02s7qq,imgoingtohellforthis,humor,1455679689.0,cye604,1.0,0.0,1342,2897,1.0
139,i do nt understand how any doctor delivers that and does nt immediately throw it in a meat grinder ,d01l2nm,imgoingtohellforthis,humor,1455599346.0,Foccsmolder,28.0,0.0,1,49,0.0
140,i don  t get it  what about china ,czyklqy,imgoingtohellforthis,humor,1455381843.0,RemedyofNorway,17.0,0.0,62,5999,0.0
141,,45t759,imgoingtohellforthis,humor,1455486833.0,superstoreman,101.0,0.0,86467,90783,0.0
142,they spelt his last name wrong ,d0031ox,imgoingtohellforthis,humor,1455494305.0,daymanahaha,1.0,0.0,15128,14993,0.0
143,i m an asshole and i m ok with that ,d01iccl,imgoingtohellforthis,humor,1455594487.0,TheThinMan34,-1.0,0.0,6923,72029,0.0
144,,45pzpu,imgoingtohellforthis,humor,1455448766.0,T0ASTERS_ARE_COOL,340.0,0.0,1184,1,0.0
145,this guy fucks ,d02721r,imgoingtohellforthis,humor,1455648973.0,BallisticMidgets,11.0,0.0,868,2765,0.0
146,wtf is that,d01extd,imgoingtohellforthis,humor,1455589100.0,ShitNMuhGrits,2.0,0.0,151,802,0.0
147,always eat your beans kids ,d016wju,imgoingtohellforthis,humor,1455576372.0,BallisticMidgets,1.0,0.0,868,2765,0.0
148,it s retarded  not brain dead that s potato soup,d02p6xd,imgoingtohellforthis,humor,1455674896.0,TwitchyBitchy13,1.0,0.0,793,336,0.0
149,the hottest rape album of the year ,czyouut,imgoingtohellforthis,humor,1455389198.0,KingDoink,14.0,0.0,0,0,
150,,45vj9p,imgoingtohellforthis,humor,1455524686.0,CaptnBoots,268.0,0.0,0,0,
151,just drown it,d01e2uy,imgoingtohellforthis,humor,1455587760.0,jwfc,10.0,0.0,965,1378,0.0
153,animorphs  rohypnol  pudin  my dick where its should nt belong ,d00yt7m,imgoingtohellforthis,humor,1455564531.0,Professor_HollingsW,6.0,0.0,0,0,
154,oh god it moves,d02ipeh,imgoingtohellforthis,humor,1455664865.0,Hproff25,0.0,0.0,165,6978,0.0
155,oh god that is priceless thanks op ,d027v5l,imgoingtohellforthis,humor,1455650069.0,PaulYall,1.0,0.0,1,5194,0.0
156,meep meep,d01n14m,imgoingtohellforthis,humor,1455603666.0,Silez,3.0,0.0,1589,3043,0.0
157,hey kids come hide in my cellar,d02uh66,imgoingtohellforthis,humor,1455683594.0,Cycleboy675,2.0,0.0,0,0,
158,,466ibh,imgoingtohellforthis,humor,1455682730.0,tc123,11.0,0.0,0,0,
159,,45lxc1,imgoingtohellforthis,humor,1455388951.0,Armiinkek,156.0,0.0,0,0,
160,a sand nigger is still a nigger  kill the darkies ,d01f81a,imgoingtohellforthis,humor,1455589550.0,TooBadMyBallsItch,5.0,0.0,0,0,
161,,45uhez,imgoingtohellforthis,humor,1455505513.0,KristenKutThroat,255.0,0.0,0,0,
162,,4666u8,imgoingtohellforthis,humor,1455678272.0,Arjunvt,14.0,0.0,0,0,
163,this is great ,d01mlos,imgoingtohellforthis,humor,1455602648.0,TitaniumDragon,2.0,0.0,0,0,
164,we want free medicinal pot,d02ufw5,imgoingtohellforthis,humor,1455683530.0,A1original,2.0,0.0,0,0,
165,millions of people in america are working hard and ca nt take care of their kids i m here to change that ,d02vec6,imgoingtohellforthis,humor,1455685312.0,seesharpdotnet,2.0,0.0,0,0,
167,source ,d02rxz8,imgoingtohellforthis,humor,1455679245.0,samtheking25,4.0,0.0,0,0,
168,that s okay  i do nt want any ,czyr8t5,imgoingtohellforthis,humor,1455393409.0,sakamake,2.0,0.0,710,70986,0.0
169,new shoes are always appreciated ,d01kw6v,imgoingtohellforthis,humor,1455598985.0,quitnever,3.0,0.0,0,0,
170,zika virus ,d01fhep,imgoingtohellforthis,humor,1455589956.0,kerath27,2.0,0.0,1,5,0.0
171,i think he technically got more holes put in him ,d01m02r,imgoingtohellforthis,humor,1455601275.0,Murderous_Hobo,4.0,0.0,0,0,
172,,45yn0a,imgoingtohellforthis,humor,1455569299.0,dickhickied,470.0,0.0,0,0,
173,,45yzsy,imgoingtohellforthis,humor,1455573458.0,FishPenetrator,175.0,0.0,0,0,
174,pedophile  shit  that s just good business white children are worth way more than  75 hell  i d give you  100 for just the younger one ,d018qsg,imgoingtohellforthis,humor,1455579252.0,michaelvinters,1.0,0.0,0,0,
175,no  but i do ,d017jes,imgoingtohellforthis,humor,1455577347.0,madd74,5.0,0.0,0,0,
176,http  iimgurcombohi1jcjpg,czy0pap,imgoingtohellforthis,humor,1455326693.0,benjammin9292,24.0,0.0,38841,137100,0.0
177,john merrick,czylmif,imgoingtohellforthis,humor,1455383616.0,smookykins,2.0,0.0,136,17072,0.0
178,he was asking for it too ,d01y4qj,imgoingtohellforthis,humor,1455636276.0,biggmik,1.0,0.0,0,0,
179,should be on jokes,d01d6rf,imgoingtohellforthis,humor,1455586363.0,redsack420,-1.0,0.0,0,0,
180,the jews ,d01swiu,imgoingtohellforthis,humor,1455624394.0,Laxcc,2.0,0.0,0,0,
181,you ai nt going to hell you did nt have the balls to submit it ,d01ajy0,imgoingtohellforthis,humor,1455582160.0,jamesjosephjohn,-1.0,0.0,0,0,
182,what kind of bullshit translation is that  http  imgurcomira28ee,d015ymg,imgoingtohellforthis,humor,1455574937.0,FishPenetrator,23.0,0.0,0,0,
183,do it,d015dsr,imgoingtohellforthis,humor,1455574062.0,samwise800,1.0,0.0,0,0,
184,,460171,imgoingtohellforthis,humor,1455586247.0,chinchillas4fire,526.0,0.0,604,1372,0.0
185,grandpa  why does your cock smell of vinyl ,d020itq,imgoingtohellforthis,humor,1455639955.0,tetzy,7.0,0.0,171,31436,0.0
186,lmao fuck yes,d01ndcz,imgoingtohellforthis,humor,1455604508.0,Turdnugget619,3.0,0.0,199,181,0.0
187,holy fuck where can i buy something like this ,d01zawv,imgoingtohellforthis,humor,1455638138.0,CelestialWalrus,3.0,0.0,33824,27980,0.0
188,just glad that s not an air force sweatshirt,d020oaa,imgoingtohellforthis,humor,1455640174.0,Shooternick,2.0,0.0,218,748,1.0
189,wow  super realistic sex doll  did it come with the chair  or were they sold separately ,d024gr5,imgoingtohellforthis,humor,1455645464.0,positive_electron42,1.0,0.0,328,22405,1.0
190,,466n1a,imgoingtohellforthis,humor,1455684768.0,retardsmart,2.0,0.0,0,0,
191,putting a black dad in the picture is a good choice here ,d01ezh5,imgoingtohellforthis,humor,1455589173.0,whereismysafespace_,31.0,0.0,131,8079,0.0
192,dude  your kid s gon na ride horses and run track their whole lifeit s awesome   ,d01ohsb,imgoingtohellforthis,humor,1455607664.0,mab_dib,-1.0,0.0,1,330,0.0
193,i give this joke a 911 ,czz43dp,imgoingtohellforthis,humor,1455416483.0,casualredditor098,6.0,0.0,1,1662,0.0
194,just  religious  would have been just fine they are al the same,czy1whi,imgoingtohellforthis,humor,1455328947.0,WTINMRIH,-2.0,0.0,1,176,0.0
195,i thought it was because women are nt allowed to drive to the police station,czyzs8h,imgoingtohellforthis,humor,1455408673.0,johnfbw,12.0,0.0,0,0,
196,it was in 2012,d01ffrz,imgoingtohellforthis,humor,1455589885.0,diazblo,2.0,0.0,0,0,
197,hah get it ,d01osw1,imgoingtohellforthis,humor,1455608619.0,GUTS_ON_FLOOR_2,2.0,0.0,1,377,0.0
198,absolutely haram ,czyyf17,imgoingtohellforthis,humor,1455406269.0,le-click,3.0,0.0,0,0,
199,so fucking fake ,d00uize,imgoingtohellforthis,humor,1455558404.0,Tank_the_Tortoise,-1.0,0.0,0,0,
200,same applies to the welsh and new zealand too  except sheep ,czz2zvo,imgoingtohellforthis,humor,1455414485.0,NouberNou,2.0,0.0,0,0,
201,,45n8vp,imgoingtohellforthis,humor,1455404512.0,retrobuddha,213.0,0.0,0,0,
