,text,redditid,subreddit,metareddit,time,author,ups,downs,authorlinkkarma,authorkarma,authorisgold
440,i see the israeli army is taking some tips from hamas,d016mkt,imgoingtohellforthis,humor,1455575949.0,Leeder99,115.0,0.0,491,199,0.0
441,one of us one of us ,d00n09h,imgoingtohellforthis,humor,1455545933.0,DanFlyhight,2.0,0.0,12,3221,0.0
442,and that s why it s called bukkake ,d00ke69,imgoingtohellforthis,humor,1455538515.0,DrinkTheSun,1.0,0.0,40,1330,0.0
443,i read this as  aziz ansari   and just thought hmm a bit strange for him whatever  glad masters of none got a second season ,d00mrva,imgoingtohellforthis,humor,1455545422.0,drewjamesSB,2.0,0.0,1627,1879,1.0
444,i really do nt understand how people correlate wearing black with being suicidal and a  faggot   it s just what they re into it s like other fashion statement such as being a fuckboy or hipster i ve had gothic friends who are the happiest people in the world they just enjoy wearing black and having long hair while i was depressed as fuck and just fitted in with the crowd ,d01pbfm,imgoingtohellforthis,humor,1455610318.0,asylum117,-3.0,0.0,28189,18079,0.0
445,yall should check out her twitter page its pretty much full of these selfaware halfjokes ,d00hfvp,imgoingtohellforthis,humor,1455526252.0,ToastThing,28.0,0.0,3670,5927,0.0
446,is nt this the chick who said  when presented with the avn award for best anal   i d like to thank my butthole for putting up with my shenanigans   she should do a porno titled  fucking funny ,d00gilx,imgoingtohellforthis,humor,1455522964.0,Unconscience,466.0,0.0,88,1330,0.0
447,i  make a donation  to her regularly ,d014k42,imgoingtohellforthis,humor,1455572843.0,frawgballs,2.0,0.0,1,906,0.0
448,barack obama follows her on twitter edit   proof   http  iimgurcomnd49cprpng   i checked  it s his official verified account,d00ir1i,imgoingtohellforthis,humor,1455531669.0,Crabcaked,60.0,0.0,4318,1615,0.0
449, and i m damn good at it ,d00kmg2,imgoingtohellforthis,humor,1455539357.0,AustinsAirsoft,0.0,0.0,1128,93,0.0
450,i personally look at porn stars fucking  i do nt care if they re good people or not  just as long as they re attractive and takegive a good dickvagfistetc ,d00fzfk,imgoingtohellforthis,humor,1455521252.0,globaltourist,16.0,0.0,2701,25446,0.0
451,it reminds me of a little kid using swear words to sound cool ,d00kut8,imgoingtohellforthis,humor,1455540162.0,bayou_billy,4.0,0.0,11,20914,0.0
452,ironic shitty titles are still shitty titles,d01vnnc,imgoingtohellforthis,humor,1455631698.0,Wiinamex,1.0,0.0,738,8638,0.0
453,handjobs  anyone else down ,d01otx7,imgoingtohellforthis,humor,1455608711.0,GUTS_ON_FLOOR_2,1.0,0.0,1,377,0.0
454,raisin  hell ,d01siq7,imgoingtohellforthis,humor,1455623019.0,XAMOTA,1.0,0.0,6137,6662,0.0
455,hold the fuck up  girls actually want bitchy emo faggots ,d01khn4,imgoingtohellforthis,humor,1455598199.0,Shumardaso,498.0,0.0,61,1057,0.0
456,those are guys ,d01vxtp,imgoingtohellforthis,humor,1455632278.0,fuckjapshit,1.0,0.0,53,509,0.0
457,itt  white knight cucks,d012baf,imgoingtohellforthis,humor,1455569573.0,HitachinoBia,2.0,0.0,3086,7843,0.0
458,she also donates blood to the red cross except instead of blood it s cocks and instead on donating it  she takes it up the ass and instead of the red cross it s men with large dicks and poor acting skills ,d00bctd,imgoingtohellforthis,humor,1455509816.0,Ninjacobra5,1871.0,0.0,88,34563,0.0
459,lpt  liquid bandaid may not last very long for active young children for a longer lasting alternative  use a branding iron,d02phny,imgoingtohellforthis,humor,1455675362.0,Kip_karo,12.0,0.0,4589,24308,1.0
460,also  if you really wanted a sibling instead you can find them easier than ever now ,d02nh6e,imgoingtohellforthis,humor,1455672306.0,PabstyLoudmouth,3.0,0.0,106269,128314,1.0
461,because they dont like to hangout at school duh,d01uqq1,imgoingtohellforthis,humor,1455629634.0,MastuhShake574,1.0,0.0,1,256,0.0
463,how about having the kid memorize the number  or are we too dumb for that ,d02pn03,imgoingtohellforthis,humor,1455675591.0,ReformedMook,4.0,0.0,1,1,0.0
464,do nt you dare think that my princess is anything but perfect sonny,d00i0kv,imgoingtohellforthis,humor,1455528536.0,bullaro45,1.0,0.0,1,366,0.0
465,never heard of her before  i m gon na do some  research  ,d00ufd2,imgoingtohellforthis,humor,1455558261.0,jhorn1,1.0,0.0,10993,1131,0.0
466,that fog at the top makes it look like a tower in zelda or something lol,d01y6rz,imgoingtohellforthis,humor,1455636369.0,romeodiienno,1.0,0.0,41785,4373,0.0
467,no  this kid should not have a gun ,d01sx2i,imgoingtohellforthis,humor,1455624447.0,c2darizzle,1.0,0.0,27319,16334,0.0
468,gt  15 ago,d00ixha,imgoingtohellforthis,humor,1455532446.0,offenator,21.0,0.0,0,0,
469,cold water cleans off cum better than hot ,d00ly3u,imgoingtohellforthis,humor,1455543388.0,JcFerggy,0.0,0.0,0,0,
470,hey same  except instead of money it s for free  and instead of wanting to i just need a better train line ,d00ggv2,imgoingtohellforthis,humor,1455522811.0,housebrickstocking,28.0,0.0,0,0,
471,does nt take much to go to hell these days  apparently ,d00bop4,imgoingtohellforthis,humor,1455510499.0,Foodapoodas,1198.0,0.0,0,0,
472,well i mean what are you gon na do  call her a whore ,d00hveu,imgoingtohellforthis,humor,1455527958.0,Hebblewater,15.0,0.0,0,0,
473, 15 ago ,d015pax,imgoingtohellforthis,humor,1455574551.0,xsuitup,2.0,0.0,0,0,
474,dear women of tumblr  more people will pay to visit this woman s website than people who will visit your website for free maybe its because she is not a fat pig maybe because instead of having feminist bullshit spew out of her mouth  she has cocks spewing in her mouth  whatever it is  a woman who has men ejaculate on her for living is more likely to have a man take her seriously than you  warmest wishes  adolf hitler iii,d00fhf7,imgoingtohellforthis,humor,1455519722.0,hotpinkurinalmint,214.0,0.0,0,0,
475,got ta love how much pride all the whores who sell their body for money have ,d00lo66,imgoingtohellforthis,humor,1455542652.0,Vertchewal,-8.0,0.0,0,0,
476,classy as fuck,d01egvf,imgoingtohellforthis,humor,1455588361.0,zombierror,1.0,0.0,0,0,
477,als bucket challenge is just a mockery to people with als,d012h2d,imgoingtohellforthis,humor,1455569798.0,ewbf,1.0,0.0,0,0,
478,,45oqw5,imgoingtohellforthis,humor,1455427119.0,hs_recovery,130.0,0.0,136,846,0.0
479,make sure you guys check out the second one too  https  wwwyoutubecomwatch  v  wsvkktwrrgo,czzq432,imgoingtohellforthis,humor,1455472031.0,hs_recovery,7.0,0.0,136,846,0.0
480,how do you open a locker without noticing the word    nigger    spray painted on the outside ,d006tlq,imgoingtohellforthis,humor,1455501407.0,douchebag_investor,9.0,0.0,28919,23657,0.0
481, 0  50   when your dad s pounding you  ,d002yzc,imgoingtohellforthis,humor,1455494170.0,whereismysafespace_,2.0,0.0,131,8079,0.0
482, walker told me i have aids   after sex ,d0030kk,imgoingtohellforthis,humor,1455494247.0,whereismysafespace_,0.0,0.0,131,8079,0.0
483,wow i  uh shit that was supposed to be edited better ,czzf2fo,imgoingtohellforthis,humor,1455442266.0,KKraKHeD,-2.0,0.0,1,334,0.0
484,her ama is fucking amazing,d00j54r,imgoingtohellforthis,humor,1455533390.0,Accipehoc,5.0,0.0,0,0,
485,they did until they grew up ,d01u7i6,imgoingtohellforthis,humor,1455628310.0,tanoren,1.0,0.0,705,2314,0.0
486,it s like if the laugh track is set to jerry springer,czzf8ox,imgoingtohellforthis,humor,1455443019.0,TheScalopino,3.0,0.0,24,501,0.0
487,wait  so these clips are nt supposed to be funny ,d00bxho,imgoingtohellforthis,humor,1455511021.0,Hayb0ss,0.0,0.0,1,565,0.0
488,i love this thanks,czzce7f,imgoingtohellforthis,humor,1455432947.0,Bobsupman,8.0,0.0,139,19454,0.0
489,very original title,d01q9ca,imgoingtohellforthis,humor,1455613791.0,Pedigree_Dogfood,5.0,0.0,241,792,0.0
490,bwcause the cant suck ass in band  rather they just suck ass in life and cry a lot,d01roj4,imgoingtohellforthis,humor,1455619646.0,facial_montgomery,1.0,0.0,0,0,
491,i m 34 pushing 35  i still play local shows  for the fame and fortune of course  and trust me  they still exist they re no longer  emo  tho  they re  scene  kids  after they hit 21  however  they put on aviators and grow beards i think what happens is their hair slowly shrinks from their head and comes out their face  thus evolving in to  cool kid  territory  personally  i like dressing as a clown and talking to kids on the street trying to get them on to drugs you got ta start young  so i just hand them a condom full of coke outta my ass and make them rub it on their lips ,d01tio7,imgoingtohellforthis,humor,1455626353.0,NoTimeForPoopin,15.0,0.0,0,0,
492, and the ceiling cant hold us ,d01rzs3,imgoingtohellforthis,humor,1455620944.0,gafx3,2.0,0.0,0,0,
493,i do believe u get your ass whipped for shit like that but hey  flowers wilt and die  but cte is forever ,d00bksv,imgoingtohellforthis,humor,1455510274.0,KKraKHeD,3.0,0.0,1,334,0.0
494,no you would nt  they have no monetary value and you would lose money ,czzhps6,imgoingtohellforthis,humor,1455453798.0,the_unix,-6.0,0.0,5065,60577,0.0
495,what is this  is it an american thing ,d0076kh,imgoingtohellforthis,humor,1455502076.0,cheese-and-onion,2.0,0.0,6434,3169,0.0
496,sponsored by porsche ,d00bgvs,imgoingtohellforthis,humor,1455510044.0,KKraKHeD,2.0,0.0,1,334,0.0
497,this looks shopped i can tell from some of the pixels and from seeing quite a few shops in my time ,d01puzv,imgoingtohellforthis,humor,1455612271.0,Villaintine,1.0,0.0,12,9655,0.0
498,is it clean ,d01o6ha,imgoingtohellforthis,humor,1455606731.0,MooKids,1.0,0.0,1526,4271,0.0
499,americans are weird as fuck ,d01uakq,imgoingtohellforthis,humor,1455628537.0,ReallybadEnglish,-6.0,0.0,1,652,0.0
500,i like the stereotypical douchy hipster with large frame glasses  facial hair  and zero muscle mass nice touch,d007hv4,imgoingtohellforthis,humor,1455502663.0,Uphillporpoise,38.0,0.0,1,3324,0.0
501,say what you want about the food  but technically  the mother got rid of weight by going to subway ,d029nho,imgoingtohellforthis,humor,1455652459.0,predictingzepast,9.0,0.0,1,94196,1.0
502,women are naturally better caregivers that s why this shit happens   blahblahsomethingsomethingyou sexist shitlorde   ,d02cp31,imgoingtohellforthis,humor,1455656479.0,youhatetruth,2.0,0.0,50,6393,0.0
503,http  iimgurcomjuw7qkgjpg,czylfe4,imgoingtohellforthis,humor,1455383273.0,XavierSylvan,10.0,0.0,13951,3283,0.0
504,that mouth is so spot on ,czykc6v,imgoingtohellforthis,humor,1455381373.0,DonovanGypsy,5.0,0.0,2129,3290,0.0
505,oooh look at those cankles ,d02vlwu,imgoingtohellforthis,humor,1455685721.0,ChunkNormous,1.0,0.0,1,2280,0.0
506,the only tat i ve seen that rivals this one is the 911 it s raining men one ,d02a66h,imgoingtohellforthis,humor,1455653151.0,quaxon,22.0,0.0,33348,22942,0.0
507,i ca nt seem to find it anywhere was it deleted  does anyone know or have a link  thanks ,45mk9w,imgoingtohellforthis,humor,1455396814.0,nananan444,14.0,0.0,1,51,0.0
508,i have nt heard of this but if you find it please pm a link,czywk72,imgoingtohellforthis,humor,1455402969.0,FondSteam,0.0,0.0,43,954,0.0
509,not like you ll have a choice either way ,d01gar0,imgoingtohellforthis,humor,1455591237.0,heartjuice,4.0,0.0,667,14229,0.0
510,does nt really seem like rimgoingtohellforthis  it just seems like the sensible option,d01rfok,imgoingtohellforthis,humor,1455618634.0,SuckADickDumbShits,12.0,0.0,1,1454,0.0
511,based scalia for the re interpretation of the bill of rights rest in whorehouse,d001iai,imgoingtohellforthis,humor,1455491500.0,pastrie300,1.0,0.0,8040,10487,0.0
513,damn sick navy fucks do nt he know that he can get a real one in the philippines ,d02v4op,imgoingtohellforthis,humor,1455684809.0,AllThatJazz59,1.0,0.0,1,3210,0.0
514,i wish i had a sex doll in a wheelchair to hold my life sized barbies  that kid has it going for him ,d02olch,imgoingtohellforthis,humor,1455673989.0,AjPjSay,2.0,0.0,5071,6243,0.0
515,when i hear someone say  the average american   this is exactly my first thought ,d01vrr5,imgoingtohellforthis,humor,1455631931.0,Canine1,1.0,0.0,1,452,0.0
516,should nt the haji skeleton be in hundreds of pieces scattered across the neighborhood ,czyqqh9,imgoingtohellforthis,humor,1455392493.0,Irish_McJesus,4.0,0.0,1245,4229,0.0
517,what actually happened to him  jeeezus fuck,czz368q,imgoingtohellforthis,humor,1455414811.0,cornexplosion,15.0,0.0,24,135,0.0
518,t is shopped ,d01beil,imgoingtohellforthis,humor,1455583538.0,komstock,1.0,0.0,139,1295,0.0
519,even better if served in jail ,czyx8u7,imgoingtohellforthis,humor,1455404171.0,whereismysafespace_,7.0,0.0,131,8079,0.0
520,,45n0kh,imgoingtohellforthis,humor,1455401659.0,thembert,167.0,0.0,1086,4659,0.0
521,what s wrong with that chicken   it does nt even look like drumsticks  more like obese drumsticks they plump those damn chickens so full off shit not edible at all  ,czzi2zy,imgoingtohellforthis,humor,1455454992.0,unicorn420turds,3.0,0.0,5,1243,0.0
522,,466euu,imgoingtohellforthis,humor,1455681313.0,thedeeking,0.0,0.0,815,2187,0.0
523,not too soon  just not funny ,d02u379,imgoingtohellforthis,humor,1455682902.0,whereismysafespace_,4.0,0.0,131,8079,0.0
524,what are you lookin at smoothskin ,czyyqzd,imgoingtohellforthis,humor,1455406851.0,ukdal1,9.0,0.0,1,263,0.0
528, calm down skeletor   https  wwwyoutubecomwatch  v  n132jqqwhho ,czz2vu5,imgoingtohellforthis,humor,1455414277.0,Crimson-Jacket2,4.0,0.0,736,4993,0.0
529,now this is my kind of humor ,czz4mje,imgoingtohellforthis,humor,1455417383.0,CUNTstandinople,2.0,0.0,6014,31952,0.0
530,omg soooooo tru ,d003wq4,imgoingtohellforthis,humor,1455495936.0,XXX_ON1-CH9N_XXX,10.0,0.0,112,368,0.0
532,,45tk6c,imgoingtohellforthis,humor,1455491447.0,bjh182,100.0,0.0,126,55,0.0
533,what the fuck is et talking about ,czzzgfx,imgoingtohellforthis,humor,1455487944.0,JunkFriend2,1.0,0.0,174,2902,0.0
534,i immediately thought of this  https  myoutubecomwatch  v  ohu_u4rq1tg,d0021bh,imgoingtohellforthis,humor,1455492439.0,dfp430,0.0,0.0,1,308,0.0
537,ca nt leaving building 7 out of that love triangle,d00roc7,imgoingtohellforthis,humor,1455554165.0,cHEatsKYJelly,1.0,0.0,4355,1216,0.0
542,omg,d0180t5,imgoingtohellforthis,humor,1455578101.0,lilbugoy17,1.0,0.0,1,14,0.0
543,a prophet,45py6m,imgoingtohellforthis,humor,1455448030.0,malcomjordan,89.0,0.0,168,262,0.0
544,is it still child molestation if you re married ,d004wnf,imgoingtohellforthis,humor,1455497841.0,douchebag_investor,4.0,0.0,28919,23657,0.0
545,muhammed ,d00bing,imgoingtohellforthis,humor,1455510146.0,KKraKHeD,2.0,0.0,1,334,0.0
547,peace be upon him ,czzjjpj,imgoingtohellforthis,humor,1455459120.0,terjesin,13.0,0.0,7,1313,0.0
548,a muslim ,czzw2rl,imgoingtohellforthis,humor,1455482213.0,SuckMyNiblets,2.0,0.0,512,718,0.0
549,so you are nt down ,d01ojlw,imgoingtohellforthis,humor,1455607814.0,TheOriginalGregToo,9.0,0.0,2,8527,0.0
550,,45t1jy,imgoingtohellforthis,humor,1455484994.0,ipissinyourlemonade,172.0,0.0,1798,338,0.0
551,well  no matter where he is  he s in a better place    for us ,czz04w8,imgoingtohellforthis,humor,1455409304.0,trj820,2.0,0.0,24,806,0.0
552,,45hfe7,imgoingtohellforthis,humor,1455318341.0,SnackbarJihad,593.0,0.0,5188,3765,0.0
553,57 dankness,czxw8t3,imgoingtohellforthis,humor,1455318768.0,SykoEsquire,8.0,0.0,1,2644,0.0
554,oh yeah  it s allahu snackbar tomorrow let s hope  isis has something nice cooked up                                    ,czyd82v,imgoingtohellforthis,humor,1455361075.0,Mistoku,3.0,0.0,253,2821,0.0
555,35 dankness,czxyeo7,imgoingtohellforthis,humor,1455322515.0,Foccsmolder,6.0,0.0,1,49,0.0
556,well this is a new low ,czy443p,imgoingtohellforthis,humor,1455333338.0,FuckTedCruz,3.0,0.0,1179,2321,0.0
557,911 dankness,czxxh2e,imgoingtohellforthis,humor,1455320873.0,justusjj12,16.0,0.0,1,13,0.0
558,i like to think it was 72 virgin dudes ,czyai9g,imgoingtohellforthis,humor,1455349705.0,J_I_S_B,3.0,0.0,623,9585,0.0
559,dankness,czy173v,imgoingtohellforthis,humor,1455327622.0,Norzy1,4.0,0.0,112,1652,0.0
560,why the fuck you remove original credits and add cancer like memecenter ,czyebtr,imgoingtohellforthis,humor,1455366194.0,Laxcc,20.0,0.0,8353,21073,1.0
561,hey  at least he got the namesfigures paired correctly ,d02o3ey,imgoingtohellforthis,humor,1455673234.0,thtdharris1,3.0,0.0,3,639,0.0
563,shiiiiite,d00hkv5,imgoingtohellforthis,humor,1455526793.0,DonMichaelPaulsen,1.0,0.0,3651,4010,1.0
564,is there a sub with sexy picture of microcephalic little girls  i m asking for research purposes ,d02u415,imgoingtohellforthis,humor,1455682941.0,whereismysafespace_,1.0,0.0,131,8079,0.0
565, my precious      http  rs1353pbsrccomalbumsq671charispssmeagolmypreciousfunnyshoes_zpsc4702e58jpg  w  480amp  h  480amp  fit  clip ,d02f3tb,imgoingtohellforthis,humor,1455659677.0,Buttsex_and_Skittles,1.0,0.0,1,1008,0.0
566,is that in lima ,czyy0lj,imgoingtohellforthis,humor,1455405532.0,captaindazzlebug,1.0,0.0,915,35927,1.0
568,,45teig,imgoingtohellforthis,humor,1455489424.0,Cyb3rWire,170.0,0.0,8892,44,0.0
569,lovely  seriously though  i am resisting the urge to post it to facebook for my irritating holier than thou cousins ,czzstbq,imgoingtohellforthis,humor,1455476544.0,UndeadKitten,17.0,0.0,322,36655,0.0
570,,463xq4,imgoingtohellforthis,humor,1455648768.0,quaxon,265.0,0.0,33348,22942,0.0
571,i do nt even understand this christian language ,czznzzk,imgoingtohellforthis,humor,1455468349.0,btr154,543.0,0.0,8989,260397,1.0
572,loved ,czzy9wr,imgoingtohellforthis,humor,1455485948.0,Soupdaloop,3.0,0.0,1,613,0.0
573,godlike,czzxfm8,imgoingtohellforthis,humor,1455484497.0,GOTOSLEEPJAMIE,1.0,0.0,14,2328,0.0
574,,45n1q4,imgoingtohellforthis,humor,1455401971.0,Peragon888,2332.0,0.0,9500,4407,0.0
575,hardcore gamingon a mac ,czz2qgx,imgoingtohellforthis,humor,1455414009.0,micahshell,29.0,0.0,1107,49740,0.0
576,gt  cod bullshit gt  hardcore,d00p5sn,imgoingtohellforthis,humor,1455550096.0,GatherLogs,1.0,0.0,1,34,0.0
577,cod ,czzesp8,imgoingtohellforthis,humor,1455441133.0,KKraKHeD,-1.0,0.0,1,334,0.0
578,wow  you can read the onion too   it s cool that you do nt give credit to the guy who sent the tweet out either ,czzjiw8,imgoingtohellforthis,humor,1455459059.0,Iwritewordsformoney,525.0,0.0,1,14797,1.0
579,should he be buried facedown ,czzrwro,imgoingtohellforthis,humor,1455475024.0,ozzie510,9.0,0.0,1,1042,0.0
580,ooh  rarely do you see a liberal post on here dang the whities in here are saltyyy,czzvl73,imgoingtohellforthis,humor,1455481331.0,OneManGOONsquad,17.0,0.0,30262,161896,0.0
581,am i the only one in this sub that loves this post  and  the other racially offensive posts that are normally submitted here ,czzzqpa,imgoingtohellforthis,humor,1455488441.0,moeburn,7.0,0.0,56536,359913,1.0
583,needs more jpeg,czzmj2b,imgoingtohellforthis,humor,1455465654.0,TXRazorback,1.0,0.0,247,5570,0.0
584,i always ran out of ammo on this one ,czzcudl,imgoingtohellforthis,humor,1455434212.0,anticusII,3.0,0.0,26,14419,0.0
585,can you jpeg that a few more times ,czyy3es,imgoingtohellforthis,humor,1455405675.0,MajorRE,12.0,0.0,70,393,0.0
586,  rememver no russian ,czyw3nz,imgoingtohellforthis,humor,1455402170.0,RelativeMinors,88.0,0.0,118,3693,0.0
587,absolutely halal ,czyyijt,imgoingtohellforthis,humor,1455406443.0,le-click,17.0,0.0,24077,14455,0.0
588,why does this keep getting reposted on this sub  i have nt been browsing this sub for very long but this is already the 3rd time i ve seen someone post this ,d004pna,imgoingtohellforthis,humor,1455497469.0,wildcat2084,1.0,0.0,70,496,0.0
589,but russians did that,czz6iql,imgoingtohellforthis,humor,1455420557.0,plsrekt,5.0,0.0,116,993,0.0
590,why the fuck does it look like doom graphics ,czzfesu,imgoingtohellforthis,humor,1455443762.0,NickDipples827,0.0,0.0,1,412,0.0
591,what game is that,czywmrz,imgoingtohellforthis,humor,1455403096.0,javiercorre,4.0,0.0,1689,4631,0.0
592,,45qqg9,imgoingtohellforthis,humor,1455458108.0,AmericaNeedsBernie,3883.0,0.0,6690,1260,0.0
593,apparently there are people here who only like when the post confirms their own bias and people take this shit way to seriously,czztunt,imgoingtohellforthis,humor,1455478341.0,ParamoreFanClub,23.0,0.0,5,3213,0.0
594,i do nt get it ,czzlrqx,imgoingtohellforthis,humor,1455464180.0,yourpostisashitpost,66.0,0.0,405,3549,0.0
595,so it ll be 30 years until they decide ,czzo644,imgoingtohellforthis,humor,1455468657.0,preptopro,27.0,0.0,1943,13585,0.0
596,i agree  we should   definitely   cremate pregnant women ,czzuxrb,imgoingtohellforthis,humor,1455480198.0,apullin,11.0,0.0,1908,95947,0.0
597,great original content  op http  wwwtheonioncomgraphicjusticescaliadeadfollowing30yearbattlesocia52356 https  twittercomjusticeblainestatus698683413859962880,czzql8g,imgoingtohellforthis,humor,1455472837.0,antizen,-1.0,0.0,227,1571,0.0
598,everyone s bitching about op and i m just here to shit on scalia s grave because the other subs wo nt let me ,czzpqoj,imgoingtohellforthis,humor,1455471400.0,Wahsteve,287.0,0.0,1,20010,0.0
599,we facebook now,czzq81j,imgoingtohellforthis,humor,1455472219.0,ostrow19,26.0,0.0,742,3697,0.0
600,cause they re all targets,45rtzo,imgoingtohellforthis,humor,1455471063.0,Sabertooth2251,113.0,0.0,174,12176,0.0
605,this wall does nt need gates,czzruvw,imgoingtohellforthis,humor,1455474938.0,pastrie300,3.0,0.0,8040,10487,0.0
652,i love the fact that valentine s day was a pagan holiday that the christians took over  http  wwwnprorg20110214133693152thedarkoriginsofvalentinesday,czzwnk9,imgoingtohellforthis,humor,1455483208.0,Full-On,6.0,0.0,171,460,0.0
653,you ca nt spell valentines day without anal destiny,d003avw,imgoingtohellforthis,humor,1455494783.0,backdoorintruder,9.0,0.0,7027,8993,0.0
654,i was really hoping this would say hail satan hitler works too,d009j2k,imgoingtohellforthis,humor,1455506267.0,lazergator,3.0,0.0,374,8355,0.0
655,did you see this in a truckstop diner magazine  i did the same thing a few nights ago  except my rewrite was heroin ,czzvian,imgoingtohellforthis,humor,1455481187.0,heartshapedpox,1.0,0.0,752,7169,0.0
658,my 6 year old daughter got the top image at school i was nt thrilled,czzv2p5,imgoingtohellforthis,humor,1455480433.0,SayCiao,2.0,0.0,615,2649,0.0
659,there is no end to these religious nuts shoving their god down everyones throat ,czzxbsv,imgoingtohellforthis,humor,1455484323.0,phrost1982,7.0,0.0,49,1442,0.0
660,nsfw  why ,czzytbw,imgoingtohellforthis,humor,1455486884.0,404-shame-not-found,-3.0,0.0,347,61370,0.0
661,well  hitler and jehovah do have a lot in common ,d00e0f0,imgoingtohellforthis,humor,1455515737.0,diet_pepsi_bottle,1.0,0.0,4441,1311,0.0
663,gt  i ca nt seem to find it anywhere was it deleted  does anyone know or have a link  thanks  i can still see it sorry,czyupb0,imgoingtohellforthis,humor,1455399643.0,sarcastic_shart,1.0,0.0,1,92,0.0
666,that comma,czztuy5,imgoingtohellforthis,humor,1455478354.0,2nd_Variety,0.0,0.0,33,47,0.0
667,til christians are immortal,d0000wy,imgoingtohellforthis,humor,1455488944.0,wurmsrus,1.0,0.0,506,6365,1.0
680,i hated being with other races in high school ,d000xqi,imgoingtohellforthis,humor,1455490528.0,urPenguinsRbelong2us,9.0,0.0,6776,5815,0.0
683,10 minutes  why does she still have her pants on  it should be  30 seconds to remove the pants  30 seconds to finish  9 minutes to pour alcohol in her mouth and all over her to make her think she got blackout drunk protip  nobody believes a rape victim who stinks of vodka even on her clothes ,d02u19d,imgoingtohellforthis,humor,1455682806.0,whereismysafespace_,1.0,0.0,131,8079,0.0
684,everyone is not the same  even if you only look at bones different skull sizes  bone lengths   ,czy1gwi,imgoingtohellforthis,humor,1455328130.0,denart4,8.0,0.0,9718,13630,0.0
685, he   http  vignette4wikianocookienettmntimages444krang_androidjpgrevisionlatestscaletowidthdown180  cb  20100314150933amp  pathprefix  de  looks so different without the glasses ,d01psqr,imgoingtohellforthis,humor,1455612033.0,Villaintine,2.0,0.0,12,9655,0.0
686,u sir  are going places bravo  ,czzexyg,imgoingtohellforthis,humor,1455441738.0,KKraKHeD,1.0,0.0,1,334,0.0
687,oh god that s fucking brutal bravo ,czz9m77,imgoingtohellforthis,humor,1455426555.0,NickelBackThatAzzUp,1.0,0.0,1245,30412,1.0
688,the camera is that way smoothskin,d006i6v,imgoingtohellforthis,humor,1455500823.0,Foccsmolder,1.0,0.0,1,49,0.0
690,,45pu40,imgoingtohellforthis,humor,1455446427.0,TacoJuans,233.0,0.0,29697,2541,0.0
691,ive become desensitized to these imagesim oddly ok with it ,czzicyy,imgoingtohellforthis,humor,1455455882.0,Flexasaurus_94,14.0,0.0,1,55,0.0
692,why is it sideways ,czzlf46,imgoingtohellforthis,humor,1455463504.0,Fattapple,1.0,0.0,42,6672,0.0
693,,45t2qr,imgoingtohellforthis,humor,1455485368.0,SamoRonaldo7,139.0,0.0,130,691,0.0
694,jared s just stashing it for a little later ,d02d5mv,imgoingtohellforthis,humor,1455657097.0,ChamsRock,2.0,0.0,1,8510,0.0
695,i missed the step where a women goes into yuor house voluntarily,d02um9v,imgoingtohellforthis,humor,1455683852.0,Axis_of_Weasels,1.0,0.0,9066,98294,0.0
696,well done op,d002pri,imgoingtohellforthis,humor,1455493702.0,carbonat38,1.0,0.0,6974,6322,0.0
697,,45odqf,imgoingtohellforthis,humor,1455421196.0,mightybonk,28.0,0.0,5163,67196,1.0
711, deleted ,d01fdcs,imgoingtohellforthis,humor,1455589781.0,[deleted],1.0,0.0,0,0,
712,it can still get it ,d01gywc,imgoingtohellforthis,humor,1455592296.0,reptileseat,2.0,0.0,3659,2382,0.0
713,i lost it with this one  especially since thepiratebay always has ads for   lt  whatevergt  hates him  ,d02jw0z,imgoingtohellforthis,humor,1455666784.0,Kruniac,1.0,0.0,1102,356,0.0
714, this technique has already been perfected   http  iimgurcomjz1qmxlljpg ,d01kezw,imgoingtohellforthis,humor,1455598058.0,Freeman720,7.0,0.0,821,6210,0.0
715,two boys discover one simple trick to halt aging ,d02fijp,imgoingtohellforthis,humor,1455660238.0,DelphineDuBarre,7.0,0.0,29,19,0.0
