,text,redditid,subreddit,metareddit,time,author,ups,downs,authorlinkkarma,authorkarma,authorisgold
1299,,45uqri,imgoingtohellforthis,humor,1455509591.0,DiamondPuma,124.0,0.0,153,10,0.0
1300,hasidic ginger ,d01f63a,imgoingtohellforthis,humor,1455589464.0,standardprocdure,2.0,0.0,2911,8307,0.0
1301,more like nij ia,d01vgui,imgoingtohellforthis,humor,1455631290.0,high_lowz,1.0,0.0,1,1095,0.0
1305,i know that face that is the face of a man who is about to be covered in a babys body fluids,d01nhum,imgoingtohellforthis,humor,1455604832.0,supersonic-turtle,1.0,0.0,1,9048,0.0
1306,yeah  fire a gun while holding a baby  fucking idiot ,d01im52,imgoingtohellforthis,humor,1455594931.0,Damadawf,-3.0,0.0,6850,189440,1.0
1307,how does that protect him  its a ginger baby that would even make him a target for his allies,d0142mv,imgoingtohellforthis,humor,1455572140.0,Braincakez,62.0,0.0,0,0,
1308,the best looking peot i ve ever seen ,d01hqxr,imgoingtohellforthis,humor,1455593535.0,omgwadh,5.0,0.0,0,0,
1309,he s all like  wtf is this shit and how am i supposed to eat it  these rations get worse every year ,d01n37f,imgoingtohellforthis,humor,1455603803.0,zarthblackenstein,1.0,0.0,0,0,
1310,i want to know what s up with those boots high heel sneakers ,d01t7id,imgoingtohellforthis,humor,1455625402.0,Oldasdirt,1.0,0.0,0,0,
1311,shalom  i name kevlar ,d01lbrs,imgoingtohellforthis,humor,1455599859.0,Doddicus,1.0,0.0,0,0,
1312,it s reactive armor,d01fq4e,imgoingtohellforthis,humor,1455590340.0,Spigget6,1.0,0.0,0,0,
1313,jokes on you i believe in 30th trimester abortion,d01ebxw,imgoingtohellforthis,humor,1455588155.0,GodOfAtheism,7.0,0.0,0,0,
1314,hilarious headline  but actually quite a touching picture the guitar vs the rifle  man dat symbolism ,d01mi77,imgoingtohellforthis,humor,1455602422.0,TheJucheisLoose,2.0,0.0,0,0,
1316,why the hell does he look like a neanderthal ,d02gnju,imgoingtohellforthis,humor,1455661835.0,MarsellusWalace,1.0,0.0,0,0,
1317,shaggy s gone off the rails since he had a falling out with mystery incorporated,d01ndg9,imgoingtohellforthis,humor,1455604515.0,xCharlieScottx,1.0,0.0,0,0,
1319,i can feel myself slipping into hell,d02pvjr,imgoingtohellforthis,humor,1455675961.0,accessness,1.0,0.0,2062,705,0.0
1320,full house was the best one ,czzpyox,imgoingtohellforthis,humor,1455471782.0,DavidGuyon,6.0,0.0,4822,2611,0.0
1322,thanks for that link  i subbed ,d02tlm9,imgoingtohellforthis,humor,1455682043.0,JoeyJoJoPesci,1.0,0.0,18,1120,0.0
1324,we shoot each other in school  because we have class ,45hcu5,imgoingtohellforthis,humor,1455317381.0,BruceElMoose,4713.0,0.0,1,1833,1.0
1325,this guy over here with the pumped up kicks,czy5qkx,imgoingtohellforthis,humor,1455336802.0,NeverBenCurious,188.0,0.0,622,7260,0.0
1326,people continuously asked me to repost this here  so in case any of you miscreants missed it on the home page  here you go ,czxvgcb,imgoingtohellforthis,humor,1455317434.0,BruceElMoose,80.0,0.0,1,1833,1.0
1327,actually borderline true except at my old hs  random philadelphia public hs  they would   try   to shoot each other but could nt get their guns past security  2 metal detectors at every door   they would stab each other instead,czy8lu5,imgoingtohellforthis,humor,1455343691.0,jawnsinthrowaway,7.0,0.0,599,1771,0.0
1328,videos in this thread   watch playlist amp   9654    http  sbtltv_r45hcu5  feature  playlist  video  comment     pumped up kicksdubstep   https  youtubecomwatch  v  lxojkksqkm    4   https  redditcomrimgoingtohellforthiscomments45hcu5_czy6uas  context  10  czy6uas   catchy like my bullets   kingsman  the secret service church fight    https  youtubecomwatch  v  nxb6sljsbl4amp  t  38s    1   https  redditcomrimgoingtohellforthiscomments45hcu5_czy8kmj  context  10  czy8kmj   wonamp   39  t you flyyy highhh freee biirdd  youth of the nation  video shot to album version audio    https  youtubecomwatch  v  edkwcvd56kw    1   https  redditcomrimgoingtohellforthiscomments45hcu5_czy80ft  context  10  czy80ft   who are hangin with the rest of the youth of the nation  i m a bot working hard to help redditors find related videos to watch      info   https  npredditcomrsubtletvwikimentioned_videos    chrome extension   https  chromegooglecomwebstoredetailmentionedvideosforreddfiimkmdalmgffhibfdjnhljpnigcmohf ,czy8mo1,imgoingtohellforthis,humor,1455343757.0,Mentioned_Videos,1.0,0.0,1,45401,0.0
1329,take your upvote and begone ye cheeky bastard ,czyb1rf,imgoingtohellforthis,humor,1455351676.0,TinFoilWizardHat,1.0,0.0,3,44105,0.0
1330,right  we come to your house  knock on the door  hand u a pamphlet  then bid u a do  u open the pamphlet  and your fucking face melts off indiana jones style bitch ,czzevea,imgoingtohellforthis,humor,1455441446.0,KKraKHeD,1.0,0.0,1,334,0.0
1331,do nt forget black people never go to school ,czyiisw,imgoingtohellforthis,humor,1455377939.0,steveryans2,0.0,0.0,375,28609,0.0
1332, takes off sunglasses  omg  edit  off,czy63uo,imgoingtohellforthis,humor,1455337611.0,Zzombee,-2.0,0.0,530,7176,0.0
1333,am i the only one not laughing  i m hardly offended it just feels like a joke that s been done specially now that we had asians doing it too ,czy46wr,imgoingtohellforthis,humor,1455333497.0,Retarded_Swede,-22.0,0.0,1,5881,0.0
1335,oooooooooooohhhhh killed me  d,czzuz37,imgoingtohellforthis,humor,1455480258.0,IU_s_little_sister,5.0,0.0,1,18,0.0
1336,did nt ever want shoot everyone in the school i was at  just a few white guy here,czy5mkl,imgoingtohellforthis,humor,1455336556.0,squirmybobcat,25.0,0.0,1358,2453,0.0
1337,takes like 6 black people each with a gun and they have to empty their clips to kill 1 or 2 people and whites usually by themselves or sometimes 2 people get like a 10  1 kd ratio every time ,czy4gbv,imgoingtohellforthis,humor,1455334037.0,cuedva,-7.0,0.0,2785,17296,0.0
1387,democratic majority i ca nt wait for some sanity ,d00e6ru,imgoingtohellforthis,humor,1455516177.0,King_Khang,1.0,0.0,1,876,0.0
1388,,45jbhq,imgoingtohellforthis,humor,1455349609.0,hindumale,124.0,0.0,356,921,0.0
1390,yknow  i lean right and could type a whole paragraph on why that s not the same thing  but fuck it i laughed have an upvote ,d018xai,imgoingtohellforthis,humor,1455579535.0,DisavowedInAdvance,1.0,0.0,1,85,0.0
1391,did nt know i d go to hell for supporting women s rights ,czzxg0h,imgoingtohellforthis,humor,1455484515.0,stfurpolitics,6.0,0.0,48,4813,0.0
1393,the  quickest  some of us will ever get to heaven ,czzdek6,imgoingtohellforthis,humor,1455436033.0,Illuminographer,1.0,0.0,95,54,0.0
1394,lay off the pudding pops ,d02qc2l,imgoingtohellforthis,humor,1455676676.0,HallowedVileplume,1.0,0.0,637,7165,0.0
1395,that is so fucking wrong good job sir ,czzae1y,imgoingtohellforthis,humor,1455428248.0,leighcar,1.0,0.0,2302,453,0.0
1397,slow down there bill,d02qx7m,imgoingtohellforthis,humor,1455677585.0,Venom907,1.0,0.0,892,1891,0.0
1398,he looks like a giant dildo ,d02rjtx,imgoingtohellforthis,humor,1455678598.0,Zara02,1.0,0.0,120,714,0.0
1442,rhesgoingtohellforthat,d01g7am,imgoingtohellforthis,humor,1455591085.0,mingusdisciple,1.0,0.0,1,1190,0.0
1485,this sub sure does get salty when someone makes fun of white men  safespace,czzr0yq,imgoingtohellforthis,humor,1455473564.0,neutron1,142.0,0.0,462,16020,0.0
1486,with someone with such a literal interpretation of the constitution out of the court  does this mean clarence thomas s opinions will no longer count as three fifths ,czzs4va,imgoingtohellforthis,humor,1455475402.0,Lawant,12.0,0.0,41,1370,0.0
1487,so we re letting in rfunny content again ,czzrd4t,imgoingtohellforthis,humor,1455474116.0,Wh1te_Rabb1t,7.0,0.0,10,261,0.0
1489,my mother in law shared this on facebook today  i do nt think we re going to hell ,czzqjc7,imgoingtohellforthis,humor,1455472748.0,Kisangi,32.0,0.0,997,314,0.0
1493,jesus christ your username just that alone makes me fucking hate you ,czznkc7,imgoingtohellforthis,humor,1455467571.0,Divest1987,-94.0,0.0,6037,23074,0.0
1513,,465x9n,imgoingtohellforthis,humor,1455674662.0,Blinnnnkn,33.0,0.0,1328,2892,0.0
1521,,465up9,imgoingtohellforthis,humor,1455673686.0,EliusBukley,4.0,0.0,447,80,0.0
1522,pretty sure ol  joe is turning into uncle ruckus ,czyz75g,imgoingtohellforthis,humor,1455407638.0,TheFuckerUpperOfShit,2.0,0.0,109677,96611,0.0
1556,we salute you ,czyuai4,imgoingtohellforthis,humor,1455398900.0,datenshi99,20.0,0.0,1,293,0.0
1572,,45m7f6,imgoingtohellforthis,humor,1455392290.0,handley01,10.0,0.0,91,324,0.0
1574, according to this  he s jewish   https  enmwikipediaorgwikiraviv_ullman ,d000e2r,imgoingtohellforthis,humor,1455489602.0,DVentresca,4.0,0.0,3511,30922,1.0
1575,one of his tyres was probably off by a few psi,d01k37h,imgoingtohellforthis,humor,1455597441.0,copperbricks,1.0,0.0,3414,8761,0.0
1715,he could nt write  so it only makes sense,d02f4p8,imgoingtohellforthis,humor,1455659709.0,XxTHEDEVILxX,1.0,0.0,3371,7415,0.0
1742,but i thought love was an inside job ,czy2r7q,imgoingtohellforthis,humor,1455330617.0,ruin,2.0,0.0,6331,29367,0.0
1743,you re a fucking retard ,d02rfe6,imgoingtohellforthis,humor,1455678398.0,jamesjosephjohn,8.0,0.0,3573,1249,1.0
1744,what kind of beer will be at this party ,d02t320,imgoingtohellforthis,humor,1455681142.0,flycounter,1.0,0.0,4046,9390,0.0
1745,i have no idea on why i m saying this but honestly this joke is something jeff foxworthy would say ,czyebuh,imgoingtohellforthis,humor,1455366196.0,kereke12,1.0,0.0,70,1806,0.0
1746,daaaaamn i like your style ,czxx2xi,imgoingtohellforthis,humor,1455320195.0,OmarGuard,1190.0,0.0,7991,7109,0.0
1748,at least you waited a day to repost,czyamn2,imgoingtohellforthis,humor,1455350133.0,kingcoco001,6.0,0.0,1,554,0.0
1749,black people could shoot up schools too if they actually went to class ,czy9am2,imgoingtohellforthis,humor,1455345675.0,Chucktayz,128.0,0.0,58,12875,0.0
1750,something something  column a to columbine ,czxzc4t,imgoingtohellforthis,humor,1455324176.0,jupitergeorge,572.0,0.0,5040,9586,0.0
1756,darkness,czxgehr,imgoingtohellforthis,humor,1455295703.0,panman127,-2.0,0.0,1,508,0.0
1757,when everybody is offended nobody is offended,czyd3nk,imgoingtohellforthis,humor,1455360504.0,kravt3n,1.0,0.0,1,115,0.0
1758,you forgot churches ,czy1xvs,imgoingtohellforthis,humor,1455329025.0,bayside871,18.0,0.0,10,1432,0.0
1759,we are so civilized that the only way to kill each others is in schools ,czydsf9,imgoingtohellforthis,humor,1455363796.0,DiethylamideProphet,1.0,0.0,2646,5469,0.0
1760,we need a flair going for this guy,d02rpww,imgoingtohellforthis,humor,1455678880.0,blue_paperclip,2.0,0.0,66,1091,0.0
1761,were you on 5050 last night too ,czys0b5,imgoingtohellforthis,humor,1455394784.0,MHossa81,3.0,0.0,342,622,0.0
1765,,45jx55,imgoingtohellforthis,humor,1455363473.0,Lt_Dickballs,178.0,0.0,1111,4004,1.0
1766,check canada out  haha,czy7j9g,imgoingtohellforthis,humor,1455340896.0,replete,1.0,0.0,1049,1628,0.0
1767, i do nt feel no ways tired   https  wwwyoutubecomwatch  v  zknswibjqjk ,czxzpqa,imgoingtohellforthis,humor,1455324867.0,toolfanatic,64.0,0.0,5394,247,0.0
1769,stop giving her ideas ,czxvml5,imgoingtohellforthis,humor,1455317721.0,sockmonkey16,7.0,0.0,2692,59874,1.0
1772,they actually are nt leaving  just going to get some gasoline,czz4pdd,imgoingtohellforthis,humor,1455417504.0,Chucktayz,32.0,0.0,58,12875,0.0
1773,i m a bot   bleep    bloop   someone has linked to this thread from another place on reddit    rcirclebroke2   this was on the front page of r  all if there going to make stupid  offensive jokes they should at least make them somewhat funny and  original   https  npredditcomrcirclebroke2comments45nyobthis_was_on_the_front_page_of_rall_if_there_going      footer     if you follow any of the above links  please respect the rules of reddit and do nt vote in the other threads      info   rtotesmessenger      contact   messagecompose  to  rtotesmessenger        bot ,czz38c2,imgoingtohellforthis,humor,1455414917.0,TotesMessenger,31.0,0.0,1,301427,0.0
1774,put a chair in front of that door ,czz1o4u,imgoingtohellforthis,humor,1455412096.0,urPenguinsRbelong2us,15.0,0.0,6776,5815,0.0
1775,wow what a great meme if you re 12 years old    ,czz1l1y,imgoingtohellforthis,humor,1455411939.0,raggyboo,-49.0,0.0,125,786,0.0
1777,would nt it be nice ,czz47nu,imgoingtohellforthis,humor,1455416696.0,RapeHillary-USA-USA,1.0,0.0,1,557,0.0
1778, i lt  3 tumblr  haha,czzcqw8,imgoingtohellforthis,humor,1455433929.0,0verw8,1.0,0.0,1,292,0.0
1779,what did it say before it was replaced with  feminist  ,czyxclo,imgoingtohellforthis,humor,1455404352.0,GenY_vs_Millennials,523.0,0.0,392,894,0.0
1780, get ur hands off of me i can get out myself  ,czz3fu1,imgoingtohellforthis,humor,1455415306.0,Hut3Yam9vi,34.0,0.0,1171,972,1.0
1781,reminds me to still be pissed off that women have easier requirements into the armypolice etc the job does nt change because you re a woman  but the requirements do fuck that shit ,czz06i0,imgoingtohellforthis,humor,1455409386.0,Downvotesohoy,330.0,0.0,2310,30474,0.0
1782, there are no feminist in a house fire   bill burr,czz4mdm,imgoingtohellforthis,humor,1455417376.0,zaqwed,66.0,0.0,39,408,0.0
1783,could also be female firemen who did nt reach the standard level so they dropped the standards so more women would qualify  ie strength test ,czzgwe5,imgoingtohellforthis,humor,1455450495.0,Alagorn,1.0,0.0,21,6689,1.0
1784,nice shit post  you socialist jew ,czz1nmj,imgoingtohellforthis,humor,1455412071.0,pogopenis,-10.0,0.0,77781,47758,0.0
1786,so  they re all prophets ,czzrock,imgoingtohellforthis,humor,1455474637.0,Emerald_Triangle,5.0,0.0,14133,176222,1.0
1789,i am not think the heaven to work like that,czybeir,imgoingtohellforthis,humor,1455353032.0,emilskoda,2.0,0.0,4974,35929,0.0
1795,repost upon repost,czzt4ne,imgoingtohellforthis,humor,1455477089.0,holename,1.0,0.0,13,2155,0.0
1796,,45idy0,imgoingtohellforthis,humor,1455332414.0,samsas8792,295.0,0.0,917,958,0.0
1797,finally a quality post in this sub ,czyj2d0,imgoingtohellforthis,humor,1455379023.0,atheistness,1.0,0.0,23060,495,0.0
1798,nobody fucks with the jesus i mean mother nature,czzwn0b,imgoingtohellforthis,humor,1455483182.0,matrage,1.0,0.0,714,651,0.0
1802,wait  does he actually have no neck  is he not just  really  fat ,d002a4s,imgoingtohellforthis,humor,1455492890.0,Larry_Jenkins,1.0,0.0,136,1720,0.0
1803,anal probing ,czypw6m,imgoingtohellforthis,humor,1455391016.0,JustAPoorBoy42,31.0,0.0,3488,60632,0.0
1804,repost ,d016k0x,imgoingtohellforthis,humor,1455575839.0,XenithTheCompetent,1.0,0.0,1,2845,0.0
1807,this thread is being hardcore downvoted brigaded,czzr3vf,imgoingtohellforthis,humor,1455473696.0,Spidertech500,87.0,0.0,5645,19763,0.0
1808,if you re reading this  turn back there s nothing in the comments for you,czzntvk,imgoingtohellforthis,humor,1455468043.0,Jkizzle9,392.0,0.0,1629,38738,1.0
1810, hilary be like   https  uproxxfileswordpresscom201210deewhiteboys1gif ,czy91bk,imgoingtohellforthis,humor,1455344924.0,adamdevigili,23.0,0.0,3823,4603,0.0
1812,impossible,czzufu2,imgoingtohellforthis,humor,1455479354.0,Mjone77,3.0,0.0,11793,5230,0.0
1814,this would be considerably less dumb with a pic of him in the camo tux ,d01xmua,imgoingtohellforthis,humor,1455635440.0,BigMatteson,5.0,0.0,1,760,0.0
1822,   real   men   of   genius ,czz1x62,imgoingtohellforthis,humor,1455412562.0,TacoRedneck,2.0,0.0,6925,46490,1.0
1823,mw2  that was a great game ,czz2a0j,imgoingtohellforthis,humor,1455413198.0,felio_,66.0,0.0,4129,540,0.0
1826,if he s so  prolife  why did he fucking die  just another hypocrite ,d00elca,imgoingtohellforthis,humor,1455517233.0,SancZero,6.0,0.0,281,17732,0.0
1827,the thing that always confounds me is how come men amp  women ca nt use any drug they please  at anytime they please  since  it s my body  and i should be able to do with it whatever i want  ,czzrayn,imgoingtohellforthis,humor,1455474019.0,thetruthfl,9.0,0.0,293,496,0.0
1830,the definition of surreal  watching a 35 foot sea vessel float down the highway that just held daily commuters ,czyqus1,imgoingtohellforthis,humor,1455392706.0,Dexx2,5.0,0.0,93803,18962,1.0
1831,fucking op stole his headline from  the onion   http  wwwtheonioncomgraphicjusticescaliadeadfollowing30yearbattlesocia52356 ,czzpfrz,imgoingtohellforthis,humor,1455470875.0,MildlySuspiciousBlob,18.0,0.0,0,0,
1833,finally a post i feel shitty for laughing at in this sub  it s been a long time thank you op  now go fuck yourself ,czyjdy4,imgoingtohellforthis,humor,1455379640.0,xxsilence,1.0,0.0,168,25467,0.0
1834,error 404  chromosome not found,czy533f,imgoingtohellforthis,humor,1455335390.0,deathpunk970,10.0,0.0,6,28,0.0
1835,she looks so happy,czzhws1,imgoingtohellforthis,humor,1455454428.0,gunther1992,10.0,0.0,250,8841,1.0
1839,this is what big boss shoulda looked like ,czzb33i,imgoingtohellforthis,humor,1455429740.0,Lookaway2,-1.0,0.0,1,0,0.0
1841,but if you wanted to shoot a black guy  why would you go to a school ,czy8jd5,imgoingtohellforthis,humor,1455343498.0,snobord,6.0,0.0,12952,33288,0.0
1844,this is a repost,czygxn1,imgoingtohellforthis,humor,1455374431.0,Eliminateu94,0.0,0.0,1,215,0.0
1882,i just started watching these episodes again  and when i go to look it up on itunes  the description is just a lecture on how culture was back in the 40 s50 s ,czy400h,imgoingtohellforthis,humor,1455333109.0,kirbythad,7.0,0.0,188,8548,0.0
1887,jesus christ  look at his  life   https  enwikipediaorgwikityler_ziegel   that shit s depressing af gets fucking blown up in iraq  somehow survives and is an hospital for years later on he gets married and tries to live an normal life  but them gets fucked by the va he then dies by fucking slipping on ice you ca nt make this shit up ,czza2fu,imgoingtohellforthis,humor,1455427525.0,suave404,35.0,0.0,10,2896,0.0
1893,the man who took this picture later committed suicide  sad stories behind this picture,d013x4u,imgoingtohellforthis,humor,1455571909.0,l8night5,-3.0,0.0,1745,402,0.0
1894,there s like no meat left on those bones ,d00dykc,imgoingtohellforthis,humor,1455515612.0,religionisaparasite,7.0,0.0,345,13612,0.0
1903,op your post makes no sense,czywexm,imgoingtohellforthis,humor,1455402716.0,Clarke311,3.0,0.0,0,0,
1906,it s actually a typo  supposed to say  damn i m gook ,d00bde5,imgoingtohellforthis,humor,1455509847.0,Daguss,0.0,0.0,375,764,0.0
1914,is he not wearing pants ,d00czjo,imgoingtohellforthis,humor,1455513346.0,C1K3,1.0,0.0,704,4150,0.0
1931,more bang for your buck ,d0093h1,imgoingtohellforthis,humor,1455505470.0,furrowsmiter,1.0,0.0,1203,76922,0.0
1933,that baby is going full retard ,d02usxu,imgoingtohellforthis,humor,1455684198.0,Habs4thewin,1.0,0.0,1,3300,0.0
1948,the only nonwestern countries are islamic theocracies and authoritarian dictatorships and africa yeah fuck the west right ,czzdeou,imgoingtohellforthis,humor,1455436045.0,BopTheDrass,1.0,0.0,21575,21115,0.0
1952,,465iis,imgoingtohellforthis,humor,1455668896.0,skibbz,101.0,0.0,5624,10434,0.0
1953,i do nt usually mind anything on this sub but seeing a kid like that kinda sucks,d02s979,imgoingtohellforthis,humor,1455679755.0,Thenateo,2.0,0.0,626,20393,0.0
1954,is this real     does this confirm 911 was done by halmark trying to create another new holiday  ,czzoon1,imgoingtohellforthis,humor,1455469559.0,Daamus,386.0,0.0,3189,31332,0.0
1955,looks like miss piggy and kermit had a kid ,d02p3ug,imgoingtohellforthis,humor,1455674769.0,Megamanfre,6.0,0.0,45,7313,0.0
1956,albino pepe,d02oke4,imgoingtohellforthis,humor,1455673948.0,Penguinkeith,5.0,0.0,452,8435,0.0
1959,,464im4,imgoingtohellforthis,humor,1455655809.0,casualcollapse,103.0,0.0,687,3032,0.0
1960,she does nt look happy  i have no idea how he is feeling ,d02cc58,imgoingtohellforthis,humor,1455655994.0,JustAPoorBoy42,33.0,0.0,3488,60632,0.0
1961,no  what s really cold was her  omg  i m going to have to consummate this marriage eventually  expression in this photo ,d02d817,imgoingtohellforthis,humor,1455657188.0,Golden12345,12.0,0.0,10,10248,1.0
1962,no  that s krang ,d02c9p4,imgoingtohellforthis,humor,1455655904.0,YouBoreMeToDeath,4.0,0.0,46793,34597,0.0
1963,for the appetizer did they have turtle soup ,d02e1k5,imgoingtohellforthis,humor,1455658284.0,tiamdi,3.0,0.0,943,76938,0.0
1964,hey no ears though  so at least he does nt have to hear her nag  amirite fellas ,d02hx6i,imgoingtohellforthis,humor,1455663670.0,Ninjacobra5,4.0,0.0,88,34563,0.0
1965,,d02sro8,imgoingtohellforthis,humor,1455680617.0,Emerald_Triangle,1.0,0.0,14133,176222,1.0
1966,so i want to plan a party with a black sorority on campus and tell them that the theme is zoo animals but  all of us guys would show up as zookeepers instead the girls would show up as their respective animals  but we would insist that they re monkey s regardless of their outfit oh  you have whiskers and and tail and you say you re a cat  nah i m pretty sure you re a monkey  so far it s been received very poorly ,4665p7,imgoingtohellforthis,humor,1455677839.0,ragsy12,0.0,0.0,305,62,0.0
1968,so dumb,d02rnyq,imgoingtohellforthis,humor,1455678787.0,BigMatteson,4.0,0.0,1,760,0.0
1981,snagged himself a good looking smoothskin ,d02g3oi,imgoingtohellforthis,humor,1455661061.0,ediciusNJ,26.0,0.0,2217,14107,0.0
1983,that s a devoted woman ,d02em5k,imgoingtohellforthis,humor,1455659036.0,BMW_Driver,3.0,0.0,1,10,0.0
1984,mfw no face ,d02hykb,imgoingtohellforthis,humor,1455663725.0,SmokinScotsman,8.0,0.0,11086,7320,0.0
1986,but why ,d02s22q,imgoingtohellforthis,humor,1455679431.0,JarlDalekSec,2.0,0.0,3,577,0.0
1987,he ended up dying because he fell on ice  interesting way to go  https  enwikipediaorgwikityler_ziegel,d02m2ec,imgoingtohellforthis,humor,1455670125.0,Youhaveafriendinme01,3.0,0.0,482,798,0.0
2042,or at work  because we have jobs ,czy935l,imgoingtohellforthis,humor,1455345072.0,Curtygriff,4.0,0.0,1,608,0.0
2044,everywhere,45r632,imgoingtohellforthis,humor,1455463699.0,YoMomma94,1105.0,0.0,6152,171,0.0
2045,hog heaven ,d001u54,imgoingtohellforthis,humor,1455492075.0,WendyLRogers3,6.0,0.0,428,85673,0.0
2046,damn  son ,d00ywzv,imgoingtohellforthis,humor,1455564682.0,cptn_titty_sprinkles,1.0,0.0,590,2697,0.0
2047,stupid fucking repost garbage ,d0168sl,imgoingtohellforthis,humor,1455575367.0,XenithTheCompetent,1.0,0.0,1,2845,0.0
2048,reno  chicago  fargo  minnesota  buffalo  toronto  winslow  sarasota  wichita  tulsa  ottawa  oklahoma  tampa  panama  mattawa  la paloma  bangor  baltimore  salvador  amarillo  tocopilla  barranquilla and padilla ,d02ukra,imgoingtohellforthis,humor,1455683773.0,Cycleboy675,1.0,0.0,206,15,0.0
2049,uhh the morgue ,d0085n9,imgoingtohellforthis,humor,1455503840.0,KKraKHeD,0.0,0.0,1,334,0.0
2117,chaaaaaaa ,czy6ksb,imgoingtohellforthis,humor,1455338656.0,KazOondo,1.0,0.0,476,37887,0.0
2119,wheres our son  over there  overe there  and up there ,d01okal,imgoingtohellforthis,humor,1455607869.0,PM_ME_STDS,1.0,0.0,17,2704,0.0
2121,thanks dad ,d00eli7,imgoingtohellforthis,humor,1455517245.0,bdev04,3.0,0.0,1616,1313,0.0
2122,you re killing me this joke is the bomb,czzrl8q,imgoingtohellforthis,humor,1455474492.0,MaritimeLime,65.0,0.0,1,2381,0.0
2123,kek,czzmycw,imgoingtohellforthis,humor,1455466453.0,Arantuga,5.0,0.0,12,1180,0.0
2124,lmao i have nt heard this one before well done,czxxd94,imgoingtohellforthis,humor,1455320689.0,Mosly,0.0,0.0,4074,1560,0.0
2125,every where in a 50 yard radius,d001r4d,imgoingtohellforthis,humor,1455491927.0,irawoody1,1.0,0.0,1,38,0.0
2126,absolutely haram,czzonnt,imgoingtohellforthis,humor,1455469513.0,rapeasaurus_rex,108.0,0.0,2,1029,0.0
2127,hollow point  common core ,czyez2g,imgoingtohellforthis,humor,1455368677.0,monteqzuma,1.0,0.0,11406,11037,0.0
2131,this joke is going to blow up in karma,czzsmbw,imgoingtohellforthis,humor,1455476217.0,shadomoon,2.0,0.0,5134,4904,0.0
2147,have to go to the link and see what s there ,czxutvf,imgoingtohellforthis,humor,1455316421.0,kdryan,1.0,0.0,34372,8005,0.0
2148,rtrippinthroughtime,d00z91y,imgoingtohellforthis,humor,1455565162.0,Dancewithcats,3.0,0.0,0,0,
2180,gt  a lot of people are up in arms about halal slaughter  saying it s cruel to slit an animal s throat  they want their meat killed the american way but what are the odds of a calf enrolling in school to get shot by a classmate ,czyeqag,imgoingtohellforthis,humor,1455367798.0,JumboJellybean,6.0,0.0,1,1351,0.0
2182,i,czyhp6k,imgoingtohellforthis,humor,1455376199.0,ernest4355,1.0,0.0,1,335,0.0
2183,fuckin  brilliant ,czy5x4m,imgoingtohellforthis,humor,1455337197.0,the-h8ful-m8,0.0,0.0,11,412,0.0
2184, if non nra members would stop shooting people  we would nt have any gun violence at all  bernie sanders,czygqie,imgoingtohellforthis,humor,1455373952.0,shoognite,1.0,0.0,85,1846,0.0
2185,no  they shoot other people in other countries for their resources ,czy8j0j,imgoingtohellforthis,humor,1455343470.0,Pay-Me-No-Mind,1.0,0.0,141,2318,0.0
2186,i like the sneaky pun in it ,czy22zz,imgoingtohellforthis,humor,1455329302.0,Mental1ty,3.0,0.0,102,3384,0.0
2187,this joke was posted hours before it was here this sub is pathetic none of you re are going to hell  you re all unoriginal as fuck 4chan 20 ,czy7lvk,imgoingtohellforthis,humor,1455341074.0,rubenparks,-11.0,0.0,2712,7210,0.0
2200,we also shoot each other at workbecause we have jobs,czy9rjq,imgoingtohellforthis,humor,1455347153.0,zerothreefifty7,6.0,0.0,67,679,0.0
2201,holy shit that is gold i m stealing it and passing it off as my own you fucking faggot ,czyeffa,imgoingtohellforthis,humor,1455366611.0,Mitchelhc,9.0,0.0,562,924,0.0
2204,islam is a religion of peace there s a piece of you over there  there s a piece of you over there ,czzurqs,imgoingtohellforthis,humor,1455479917.0,cole19901,65.0,0.0,13,149,0.0
2211,nothing as funny as humiliating and causing stress to someone you supposedly care about ,czxecqm,imgoingtohellforthis,humor,1455292858.0,ads215,-44.0,0.0,120,19373,0.0
