1071,1072,,45kt1i,progresspics,lifestyle,1455376170,FiveLitersOfFury,397,0,678,905,0.0
1072,1073,congratulations  you re a handsome 24yearold guy  you lost 72 pounds  that s 138 pounds per week  your bmi is 283 a healthy bmi ranges between 185 and 249 keep up the good work    if it does nt challenge you  it does nt change you   unknown    faq   https  wwwredditcomrprogresspicsbotwikiindex      subreddit   https  wwwredditcomrprogresspicsbot      feedback   https  wwwredditcommessagecompose  to  rprogresspicsbotamp  subject  suggestions ,czyi31o,progresspics,lifestyle,1455377027,ProgressPicsBot,3,0,1,2642,0.0
1073,1074,great work man,czys6ad,progresspics,lifestyle,1455395076,master_dong,2,0,1063,55572,0.0
1074,1075,huzzah  you re starting to look a little like a young johnny depp in that after pic  ,czz0mf2,progresspics,lifestyle,1455410168,paradoximoron,2,0,195,680,0.0
1075,1076,your face has slimmed down so much  good job  keep it up  ,czz1msm,progresspics,lifestyle,1455412030,tin1bbi,2,0,93,4545,0.0
1076,1077,hopefully this make you feel better about another bad bills season  ,czz2iy9,progresspics,lifestyle,1455413632,TheGreenShepherd,2,0,8477,42195,0.0
1077,1078,i hope your weight loss does nt affect the fan perception of your comeback with smash mouth  on a serious note i appreciate your post a lot op as someone who has struggled with weight loss his entire life  posts like this are what encourages me and help me not lose hope and give up  thank you,czylycb,progresspics,lifestyle,1455384190,G_D_M,14,0,299,469,0.0
1078,1079,,45ssen,progresspics,lifestyle,1455481959,-BigGirlPants-,144,0,177,110,0.0
1079,1080,you look so much younger now ,d004p6y,progresspics,lifestyle,1455497445,Hamnesia,5,0,7,1465,0.0
1080,1081,nice work   that dress is cute ,d006q3p,progresspics,lifestyle,1455501226,Psychoplasm_,2,0,2365,3001,0.0
1081,1082,congratulations  you re a beautiful 29yearold woman  you lost 18 pounds  that s 106 pounds per week  your bmi is 363 a healthy bmi ranges between 185 and 249 keep up the good work    if it does nt challenge you  it does nt change you   unknown    faq   https  wwwredditcomrprogresspicsbotwikiindex      subreddit   https  wwwredditcomrprogresspicsbot      feedback   https  wwwredditcommessagecompose  to  rprogresspicsbotamp  subject  suggestions ,d00nmhf,progresspics,lifestyle,1455547220,ProgressPicsBot,2,0,1,2642,0.0
1082,1083,what a cutie  i love your hair  too ,d008v56,progresspics,lifestyle,1455505063,readysetderp,3,0,95,16766,0.0
1083,1084,big improvement keep it up,d013fax,progresspics,lifestyle,1455571178,jDUKE_,1,0,10148,4470,0.0
1084,1085,great progress man  im envying you  keep up,d02iv6v,progresspics,lifestyle,1455665115,fzacha,1,0,1,24,0.0
1085,1086,good job on the weight loss but also props for your new hair style looks great ,d01fedc,progresspics,lifestyle,1455589824,clevvvergirl,1,0,355,2035,0.0
1268,1269,i m semijoking when i say that i refuse to believe those are the same two people if you  indeed  are as you say you arewow kudos ,czy21ah,progresspics,lifestyle,1455329210,TheGreenShepherd,8,0,8477,42195,0.0
1593,1594,a month  great job man how d you do it ,d01p6gv,progresspics,lifestyle,1455609855,rushilo,1,0,6081,9043,0.0
1610,1611,,45p05m,progresspics,lifestyle,1455431615,throwaway012516,101,0,269,14,0.0
1611,1612,nice gains and sweet ink  keep it up ,czze3s7,progresspics,lifestyle,1455438432,GenericCerealBox,2,0,21,3882,0.0
1612,1613,back is coming good work ,czze57g,progresspics,lifestyle,1455438576,SE7ENSIX,2,0,310,387,0.0
1613,1614,hello kitty indeed ,czznen1,progresspics,lifestyle,1455467282,horrorfuxx,2,0,7,-100,0.0
1614,1615,i would love to know what kind of daily workout regimen and diet you did i have been trying to build muscle for the last 2 months to no avail ,d00als8,progresspics,lifestyle,1455508340,azumeowbitch,1,0,142,30,0.0
1615,1616,you look amazing  i d also love to know a little about the training regimen you use  or just some suggestions on how i can get my back to look like that ,d024u7h,progresspics,lifestyle,1455645975,barfsnot1000,1,0,1,214,0.0
1705,1706,i d definitely take you home  to mom i meant home to mom  ,czzav2z,progresspics,lifestyle,1455429254,yeahdudes,-1,0,1,8,0.0
1706,1707,you are my height  starting weight  and goal weight i m stagnating right now at 153 after 6ish months or so  and this is extremely motivating ,czyywk7,progresspics,lifestyle,1455407131,pithuskerlover,6,0,188,8030,0.0
1714,1715,great job  hope you re feeling as great as you look  ps i love your hair,czz1jlz,progresspics,lifestyle,1455411865,jordiehp,2,0,2239,6919,0.0
1715,1716,looking great ,czz09by,progresspics,lifestyle,1455409526,onthenextad,2,0,1,66,0.0
1716,1717,you did nt see it ,czytj08,progresspics,lifestyle,1455397513,RepostFrom4chan,63,0,107721,36129,0.0
1720,1721,,45mdrx,progresspics,lifestyle,1455394485,WoahJumanji,1518,0,0,0,
1721,1722,this is really motivating  thank you  ,czz0gqx,progresspics,lifestyle,1455409889,Kung-Fu-Rwanda,3,0,0,0,
1722,1723,1 that dress  2 that cardigan where did you get them  btw you look amazing ,czz84d8,progresspics,lifestyle,1455423454,sweetcreamycream,3,0,0,0,
1723,1724,omg  gorgeous  get it girl ,czz1vfj,progresspics,lifestyle,1455412476,Elizeast,2,0,0,0,
1724,1725,i would smash if you need a ego boost,czz6jht,progresspics,lifestyle,1455420589,niggernocker,-5,0,0,0,
1725,1726,awesome progress  progress pictures definitely help with objectivity no one notices their weight loss until they look at a picture of when they started   that cardigan looks gorgeous btw  do you remember where you got it ,czz20od,progresspics,lifestyle,1455412735,loumi02,3,0,0,0,
1726,1727,great progress  and cute dress    blue one ,czysi0j,progresspics,lifestyle,1455395666,bibleseatbabies,7,0,0,0,
1727,1728,i read all these people saying its easy to not notice a weight loss of 50 pounds because brain  society  good ol tumblr  and ish  my question is  how can you not notice the pants you used to wear could probably be used to make 3 new pants you could wear now ,czz6nw0,progresspics,lifestyle,1455420788,lecyniquealunettes,4,0,0,0,
1728,1729,i could be wrong but was the first picture at a birthday party of a girl called robyn ,czzedfe,progresspics,lifestyle,1455439437,missangel1994,1,0,0,0,
1729,1730,yeah you look hot now  source  am a guy,czz9jmw,progresspics,lifestyle,1455426413,tabletname,1,0,862,50,0.0
1793,1794,wow  you look fantastic   great work ,czyio85,progresspics,lifestyle,1455378248,meco3,2,0,4,7595,0.0
1794,1795,awesome man also thanks for picking pictures that used similar angles and lighting throughout your progress always annoys me when people pick their worst picture for the  before  and their best picture for  after  ,czykois,progresspics,lifestyle,1455381977,Gobblygook1234,8,0,0,0,
1795,1796,slowly turning into kripparian  d,d02kdhj,progresspics,lifestyle,1455667543,BionicFrog,1,0,6037,2000,0.0
1796,1797,fantastic job,czysg5h,progresspics,lifestyle,1455395571,quanstrom,2,0,0,0,
1797,1798,awesome job  what was your diet like ,czykw8n,progresspics,lifestyle,1455382350,D0399,6,0,0,0,
1798,1799,go bills  baby,czyn17z,progresspics,lifestyle,1455386038,conaughtyco,8,0,0,0,
1839,1840,shit  you lost 31lbs and 20 years ,d01goie,progresspics,lifestyle,1455591836,roosterleft,2,0,0,0,
1840,1841,good job my favorite thing is the smile getting bigger ,d00chk9,progresspics,lifestyle,1455512224,sup__bruh,2,0,0,0,
1841,1842,way to go  that s awesome  ,d009u19,progresspics,lifestyle,1455506835,snowflakesthatstay,1,0,0,0,
1843,1844,what d you do ,d019vfy,progresspics,lifestyle,1455581052,adamentelephant,2,0,21,408,0.0
1844,1845,hello  jawline  great work  keep it up ,czyvg13,progresspics,lifestyle,1455400998,ahhh_zombies,2,0,0,0,
1847,1848,,45y23i,progresspics,lifestyle,1455562989,MrJok3r14,94,0,183,560,0.0
2965,2966, before amp  after   http  mimgurcomaigytu  i posted in rloseit but i thought i would come here and share my story because i love hearing and seeing everyone s stories about being healthy and losing weight  mine basically started with the fact that i have depression which is something that i ve always had to deal with and always will but around the end of 2014 i had just turned 21 and i realized that i ca nt change the way that i feel but a lot of the reasons that i feel so shitty is because i m overweight  i hated how i could nt fit into any stylish clothes  just sweats and 2xl tshirts from walmart i know that that sounds vain and conceited but i literally have a closet full of shit that i could nt fit into anymore i hated how i could nt go outside one of those pics i m in is when i was in hawaii and i was miserable the whole time and barely left the hotel room i hated how food was my only comfort and realized that that s not a very healthy way to live life  around christmans time i decide to change with baby steps i cut out things in my diet that were unhealthy but i know i would nt miss for instance i never had had much of a sweet tooth so sugar was the first thing to go and then i cut out alcohol within the first month i lost 2530 pounds right there then i cut out red meat  which did wonders for my energy i also started walking everywhere workschoolshopping  and after i stereo losing weigh those walks turned into power walks which turned into jogs which turned into slow runs  you get the picture after about half way through the year i started taking up a ton of combat sports such as boxing  kick boxing and jiu jitsu i ve always loved mma and it s amazing what all of those  boxing especially  did for my muscle and weight loss really toned up my shoulders as well  i started to use my nutribullet and adding kale to my diet i hated it at first but when you blend it with fruit and other things you do nt notice it and it s so good for you  just baby steps losing weight got really fun towards the end and it was nice to go outside with out a shirt on   these are all pics of me throughout 2014 when i was at my heaviest  302 lbs    http  imgurcomanoeop   this is me as of last weekend   http  imgurcomamloql ,460os0,progresspics,lifestyle,1455595523,JMueller2012,74,0,23973,38032,0.0
3027,3028,  show off all that hard work    this is the reddit to post those awesome beforeafter pictures of yours  __________________________________________________  we are trying an experiment  and respectfully ask your understanding and patience as we put it into use automoderator will be enforcing the title format rule the title format rule has always been required  but this is the first time it has been automatically enforced  this is necessary in order to create searches to help readers find your inspiring progress pic posts using searchable criteria if a poster s sex  age  height  and progress are nt properly formatted  the posts can not be found in a proper search  if your post title format is okay  then you should have no problems  unless we made some kind of coding bug   individual customizations of the rule probably wo nt work out  and we ask you to please repost using the required format    title format rule   gt  use this format when posting pictures to help everyone understand the transformation and journey you have been on  gt    genderageheight  weight before gt  weight after  total amount lost   time period in months  personal title   gt   example  f2355   189lbs gt  169lbs  20lbs   4 months  been lurking for a while  if your post is rejected  please be patient if your post title had an error  please kindly repost using the correct format however  if your removed post appears correct  please notify the moderator team to verify the format and we can approve your post and improve the formatting code that we re using with automoderator  please do nt become discouraged  you ve worked hard and deserve some admiration of your work  and people are out there looking for the inspiration that your pictures might provide  if we re doing this wrong  we can adjust it if this does nt work  we can stop it if this works out mostly okay  we can improve it if it works well  then rprogresspics can become even a more powerful place for showing off our hard work and inspiring others toward personal growth  in your service  the moderators of rprogresspics __________________________________________________   posting rules and guidelines     use this format when posting pictures to help everyone understand the transformation and journey you have been on    genderageheight  weight before gt  weight after  total amount lost   time period in months  personal title    example  f2355   189lbs gt  169lbs  20lbs   4 months  been lurking for a while   link only to a progresspic image or a collection of progresspic images  not your entire socialmedia profile exception  the top stickied post may be used for appropriate subreddit postsdiscussion   all pictures must be original content and posted with the consent of the subject reposts or images found elsewhere on the internet will be removed if you see content that has been posted elsewhere before  please  message the moderators   https  wwwredditcommessagecompose  to   2fr  2fprogresspics  with a link to the original  ________________  be polite   https  wwwredditcomwikireddiquette   follow  the rules   https  wwwredditcomhelpcontentpolicy   mark posts nsfw when appropriate      gt   related subreddits  gt   rloseit  lose fat gt   rfitness  gain strength gt   rxxfitness  fit women gt   rgainit  lean weight gt   r1200isplenty  small bodies gt   r1200isplentyketo  lowcal keto gt   rketo  keto gt   reatcheapandhealthy  low cost gt   rmealprepsunday  meal prep gt   rintermittentfasting  healthy fasting gt   rmyfitnesspal  mfp gt   rbodyweightfitness  no gym gt  amp  nbsp    ,462dxs,progresspics,lifestyle,1455628627,funchords,12,0,2405,41229,1.0
3033,3034,,464ey2,progresspics,lifestyle,1455654574,fitnesswitness15,190,0,138,1,0.0
3041,3042,,462kle,progresspics,lifestyle,1455631541,Suit_dota,141,0,456,61,0.0
3042,3043,you re not single digit bodyfat lol more like 1214   but nice job ,d0234ha,progresspics,lifestyle,1455643633,xXxpssyfker69xXx,42,0,1,-46,0.0
3043,3044,congratulations  you re a sexy 25yearold guy  you gained 0 pounds  that s 0 pounds per week  what a handsome fella    every champion was once a contender that refused to give up   rocky balboa    faq   https  wwwredditcomrprogresspicsbotwikiindex      subreddit   https  wwwredditcomrprogresspicsbot      feedback   https  wwwredditcommessagecompose  to  rprogresspicsbotamp  subject  suggestions ,d01wkxw,progresspics,lifestyle,1455633547,ProgressPicsBot,30,0,1,2642,0.0
3044,3045,no way you are 9  mate sorry to break it to you   at least 12  at the very lowest i would guess maybe 14 ,d02bpjg,progresspics,lifestyle,1455655174,RogerPM27,7,0,1,28,0.0
3045,3046,wanted to share my transformation today because it s been exactly 11 months between these 2 photos and my body weight is exactly the same this way it is very easy to see the transformation  last spring i bulked up to 183lbs and last fall dieted back to 170lbs no cardio was done only 5x5 at the gym ,d01vnwi,progresspics,lifestyle,1455631712,Suit_dota,4,0,456,61,0.0
3049,3050,so when i first made the commitment to lose weight and change my body i took some pictures so i could have before and after pics well i completely forgot about them until i opened up my old computer to be honest seeing the difference really blew my mind i still have a lot of work to do on toning up  but i have to say i m really happy with my progress so far  warning   shirtless guy pictures   http  imgurcomay6nl5 ,45umap,progresspics,lifestyle,1455507646,weightloss77,131,0,1,11,0.0
3050,3051,holy shit  amazing  break it down for us  if you will what did you do  congrats on the new you ,d00bf22,progresspics,lifestyle,1455509939,guyfierihc,5,0,1,399,0.0
3062,3063,great job  girl  i hope this does nt come off the wrong way  but from the way you re standing  you look like you may have a bit of an anterior pelvic tilt going on i had the same issue and ended up correcting it not only do i look better  but any back pain i had is completely relieved now ,czyont5,progresspics,lifestyle,1455388858,chief_kweef,3,0,492,6314,0.0
3078,3079,,45g3mx,progresspics,lifestyle,1455301866,cwschimpff,29,0,51,3310,0.0
3079,3080,how did you calculate bf  ,czxrukp,progresspics,lifestyle,1455311805,Thoroughaway1337,4,0,1,10,0.0
3081,3082, imgur   https  imgurcomactajn  the first picture is on my wedding day  in august 2014 i m not sure how much i weighed then  but i think i was probably hovering between 240lbs and 245lbs i had nt stepped on a scale in who knows how long  and was pretty deep in denial about my weight i do remember that it was a struggle to get the dress done up  i had to suck in to get the zipper up  and most of that day was pretty physically uncomfortable having professional pictures done on the beach for over an hour while slogging through sand was a  nightmare   the second picture was taken a few days ago  i decided to try my dress on again to see if there was a difference well there s now a sizeable gap in the bust  and when i lifted my arms up  the dress fell right down  i was shocked  haha  i decided to start losing weight in august 2015  and my official sw is 236lbs it s been slow going  i have nt been as strict with counting calories as i should be  but i ve started keeping a closer eye on my intake again  i m aiming for my first goal of 180lbs by june    it  has  been coming off though  27lbs since september  it s not a huge amount of progress yet  and i still have a long way to go   but i m slowly getting there i ve been having issues seeing any difference in the mirror  but the dress really helped reaffirm that i m headed in the right direction i ca nt wait to see the end results ,461jh0,progresspics,lifestyle,1455610609,YouCussingWithMe_,67,0,1,40,0.0
3134,3135,,466afl,progresspics,lifestyle,1455679620,Jandc33,14,0,8,0,0.0
3273,3274,,460vgk,progresspics,lifestyle,1455598327,semma333,120,0,27458,7449,0.0
3282,3283,,45zp9k,progresspics,lifestyle,1455581796,NikohlRose,255,0,2420,3388,0.0
3283,3284,wow  you held 270 very well really great work btw ,d01j6e6,progresspics,lifestyle,1455595867,Rumplesforeskins,6,0,1,140,0.0
3287,3288,,45rl4q,progresspics,lifestyle,1455468371,robot_cheetahs,159,0,6287,433,0.0
3288,3289,nice you ve got it figured out  just have to be patient every pound you lose will show more as you get smaller ,czzqn41,progresspics,lifestyle,1455472922,Coffee_Crisis,5,0,1,3435,0.0
3289,3290,awesome work  ,czzry0k,progresspics,lifestyle,1455475081,Lauraar,5,0,65,986,0.0
3295,3296,,45s5za,progresspics,lifestyle,1455474488,Callix,405,0,1527,8570,0.0
3296,3297,sorry for the water marks  i hate to do it  but i d be super cranky if someone stole my photo and used my hard work to advertise their magic weight loss potion  i have a fitbit hr that i set at a 1000 calorie deficit  although it s been driving me crazy lately and i m selling the damn thing getting my garmin vivosmart hr in the mail today   i eat a lot of fish  shrimp  and chicken  and vegetables in stir fry i m also a grad student though  so i eat quest bars and lean cuisine more often than i should  the first month i did nt exercise at all  the second i did all of the couch to 5k program at double speed  and this month i got back to my brazilian jiu jitsu  which burns between 500900 calories per class  i m down from a size 14 to a size 4  which i m sure is vanity sized  but the two were from the same stores   my waist 33  gt  28   bra 34ff gt  30g i am starting to feel loose skin under my arms and on my underboob  which is not surprising considering i did this in a short time i m hoping it goes away and i m trying to drink tons more water ,czzrz0i,progresspics,lifestyle,1455475128,Callix,12,0,1527,8570,0.0
3297,3298,wow  goodbye back rolls  what did you use to put the watermark on your photos  i would want to do the same if i posted here ,d008htf,progresspics,lifestyle,1455504428,guerre-eclair,4,0,4377,6193,0.0
3298,3299,you ve got a fantastic butt ,d00iy59,progresspics,lifestyle,1455532531,WishfulTraveler,6,0,4,3102,0.0
3307,3308,,463uft,progresspics,lifestyle,1455647683,progressorama111,699,0,602,75,0.0
3310,3311,not sure what some others are talking about in this thread  your pictures clearly show your amazing progress i think some people just want pics of you in your underwear  lol great job and congrats ,d029p2b,progresspics,lifestyle,1455652519,Raging_Asian_Man,48,0,524,9749,0.0
3311,3312,i think you re a little too harsh on yourself at 130 you carried that weight just finemaybe even better than fine  but you certainly look great now  congrats on the progress amp  on feeling happier and healthier ,d029azv,progresspics,lifestyle,1455651998,Kycb,72,0,7209,5321,0.0
3314,3315,these are awesome  congratulations  workout routine  or just diet ,d0273d5,progresspics,lifestyle,1455649021,PM-ME-UR-NIPS-GIRL,4,0,3825,22017,1.0
3324,3325,oh my god you look amazing i m shorter than you but currently at your starting weight you re also my goal weight  so basically i hope to be you in six months what kind of foods did you eat  and how did you curb cravings and not over eat like before  that s my biggest issue so far ,d02i938,progresspics,lifestyle,1455664167,uglybarnacle94,4,0,226,461,0.0
3326,3327,you really could nt take better pictures to show progress ,d028uyv,progresspics,lifestyle,1455651406,fjnobre,-51,0,3,591,0.0
3327,3328,you do look good  but those pictures shows us nothing at all ,d029fhv,progresspics,lifestyle,1455652165,mardh,-44,0,21,10586,0.0
3328,3329,dat gap  mmmmm ,d02ibht,progresspics,lifestyle,1455664267,CosmicSurfFarmer,-30,0,54,1954,0.0
3329,3330,,45lfts,progresspics,lifestyle,1455382961,meganlizzie,634,0,20476,8119,0.0
3330,3331,you look so awesome ,czyoefg,progresspics,lifestyle,1455388404,theslowwhatever,11,0,1,467,0.0
3348,3349,,45ocrr,progresspics,lifestyle,1455420805,MalkavianMoxxi,235,0,6730,882,0.0
3349,3350,wow you look amazing  and in such short time what is your daily routine  calories  macros  excersses ect ,czz7jmx,progresspics,lifestyle,1455422315,yaak_yaak,3,0,1,709,0.0
3350,3351,is that a typo  there s no way you re 233lbs  54  133  also  wicked progress you look awesome ,czzdui1,progresspics,lifestyle,1455437508,feathergnomes,4,0,296,3961,0.0
3354,3355,you look so good ,czz85u7,progresspics,lifestyle,1455423534,Sithaari,2,0,1,186,0.0
3360,3361,,461p95,progresspics,lifestyle,1455614469,SiliconWallflower,327,0,3814,172,0.0
3361,3362,well done  amazing change so far what changes did you make in your life to get there ,d01qjnc,progresspics,lifestyle,1455614920,catchthisfade,6,0,1541,18335,0.0
3362,3363,you wore 202 really well  not that you do nt look great now you do but  just saying  you wore the extra weight really well ,d0291uz,progresspics,lifestyle,1455651661,Ratscallion,5,0,2566,3686,0.0
3379,3380,hi everyone  i started at around 17 and a half stone maybe even 18 stone  i use to eat mcdonald s for breakfast  kfc for lunch and burger king or pizza hut for dinner  i would also snack on chocolate  crisps  and drunk a lot of fizzy drinks  when i first started exercising i would run for about 20 seconds then be sick   i would even get our of breath going up stairs  now i can run for about an hour  okay not run but a good jog  while exercising definitely helped changing my diet was the major factor in helping me loose weight  i now eat around 1500 calories a day then if i want pig out a little at the weekend  i still have about a stone to loose but i am so happy with the progress i have made  before pic  12 june 2013  http  iimgurcomvbrqw0ljpg after picture 12 feb 2016  http  iimgurcomxtyejoujpg http  iimgurcomozimvvpjpg be lucky ,45fut9,progresspics,lifestyle,1455298934,andy912,55,0,1,6,0.0
3380,3381,holy shit dude  nice progress  keep it up ,czxjdcp,progresspics,lifestyle,1455299784,Stecenellowe,7,0,1,22,0.0
3382,3383,,45xyr9,progresspics,lifestyle,1455561896,hazardousdank,180,0,184,19,0.0
3383,3384,looks like some face gains as well  ,d00xl1d,progresspics,lifestyle,1455562790,ScrubbyMcScroob,5,0,1,283,0.0
3392,3393,,45hncv,progresspics,lifestyle,1455321375,sleepeyhead81,354,0,1920,568,0.0
3402,3403,,45fclz,progresspics,lifestyle,1455292621,unicorntears27,182,0,188,23,0.0
3411,3412,,45qrfh,progresspics,lifestyle,1455458623,MrsC7906,216,0,4167,2585,0.0
3416,3417,a couple  two or a few source  american heritage dictionary  so she lost 39 pounds in 24  maybe 5 weeks rightsee my username for my true feelings about this post ,czzujpu,progresspics,lifestyle,1455479539,fuckthisshit6669,-4,0,1,-2,0.0
