,0,1,2,3,4,5,6,7,8,9,10,11
0,1,looks great  way to go ,d01we1r,progresspics,lifestyle,1455633183,funchords,2,0,2405,41229,1.0
1,2,great work  what s your program ,d02exc0,progresspics,lifestyle,1455659440,Heirsandgraces,1,0,97,2959,0.0
2,3,this is awesome  especially when your trying to search for someone your height ,d02adn2,progresspics,lifestyle,1455653429,bnew12,3,0,856,1779,0.0
3,4,i agree with the change it saves having to ask the person,d01y0qq,progresspics,lifestyle,1455636095,Jezamiah,3,0,167343,130934,1.0
4,5,,466n2r,progresspics,lifestyle,1455684791,Youkevinteh,2,0,1,0,0.0
5,6,looking good dude  congratulations on the weight loss keep it up ,d00ltv0,progresspics,lifestyle,1455543077,Stecenellowe,2,0,1,22,0.0
6,7,hi guys  at my lowest in the summer i was around 155 lbs since then i m bulking using leangains dieting approach right now i m around 756 kg at almost the same level of bodyfat  slightly over   how do you rate my progress  weak sports  bodyfat  guesstimate atm  may 2015  maintained weight till september   https  wwwdropboxcomscrrvpgaoq8yc1bdxaacm9sfccc47yop9ol94goola https  wwwdropboxcomscyvlb42xgbd9ti4qaaa5d7fl3ytkddaxwiipeftra 1 week ago  https  scontentfrt31xxfbcdnnethphotosxft1vt10912733599_1243645658983768_865014018116207264_njpg  oh  ffd5930e322520434e13f52e6af9ec22amp  oe  576a0584 https  scontentfrt31xxfbcdnnethphotosxta1vt10912715538_1243789215636079_6018635010214569049_njpg  oh  356a7a1965e41e81904bf5037376c78damp  oe  57676687 https  scontentfrt31xxfbcdnnethphotosxaf1vt10912410527_1225120284169639_371120451438470162_njpg  oh  1fdaa85c643e0ede87d9b67ce1922eecamp  oe  57330215,45nn0d,progresspics,lifestyle,1455409847,wannabealpha,14,0,1,0,0.0
7,8, before amp  after   http  mimgurcomaigytu  i posted in rloseit but i thought i would come here and share my story because i love hearing and seeing everyone s stories about being healthy and losing weight  mine basically started with the fact that i have depression which is something that i ve always had to deal with and always will but around the end of 2014 i had just turned 21 and i realized that i ca nt change the way that i feel but a lot of the reasons that i feel so shitty is because i m overweight  i hated how i could nt fit into any stylish clothes  just sweats and 2xl tshirts from walmart i know that that sounds vain and conceited but i literally have a closet full of shit that i could nt fit into anymore i hated how i could nt go outside one of those pics i m in is when i was in hawaii and i was miserable the whole time and barely left the hotel room i hated how food was my only comfort and realized that that s not a very healthy way to live life  around christmans time i decide to change with baby steps i cut out things in my diet that were unhealthy but i know i would nt miss for instance i never had had much of a sweet tooth so sugar was the first thing to go and then i cut out alcohol within the first month i lost 2530 pounds right there then i cut out red meat  which did wonders for my energy i also started walking everywhere workschoolshopping  and after i stereo losing weigh those walks turned into power walks which turned into jogs which turned into slow runs  you get the picture after about half way through the year i started taking up a ton of combat sports such as boxing  kick boxing and jiu jitsu i ve always loved mma and it s amazing what all of those  boxing especially  did for my muscle and weight loss really toned up my shoulders as well  i started to use my nutribullet and adding kale to my diet i hated it at first but when you blend it with fruit and other things you do nt notice it and it s so good for you  just baby steps losing weight got really fun towards the end and it was nice to go outside with out a shirt on   these are all pics of me throughout 2014 when i was at my heaviest  302 lbs    http  imgurcomanoeop   this is me as of last weekend   http  imgurcomamloql ,460os0,progresspics,lifestyle,1455595523,JMueller2012,75,0,23973,38032,0.0
8,9,you look great  and have a very favourable fat distribution good work ,d02elz6,progresspics,lifestyle,1455659029,Mooperboops,4,0,1,2301,0.0
9,10,,45y30v,progresspics,lifestyle,1455563282,norrec123,86,0,97,1539,0.0
10,11,almost 10 lbs per month  keep it up ,czys8kh,progresspics,lifestyle,1455395193,MightAsswell,2,0,912,7964,0.0
11,12,other additions in the update   automoderator will now automatically assign flair to each post   drop down menus have been added to the sidebar to aid in searching for people of particular heights ,d01xbyg,progresspics,lifestyle,1455634911,Beef_Enchilada,1,0,105,6295,0.0
12,13,congrats on the weight loss  you look so much better keep it up ,d02ggna,progresspics,lifestyle,1455661564,Stecenellowe,2,0,1,22,0.0
13,14,great job usuit_dota  ,d01vuxw,progresspics,lifestyle,1455632115,funchords,1,0,2405,41229,1.0
14,15,this is wonderful ,d02dgf3,progresspics,lifestyle,1455657502,foodisthelaw,3,0,1,5,0.0
15,16,damn  that s awesome progress man  i myself need to lose 100lbs ,d00p77l,progresspics,lifestyle,1455550161,TechnologyIsAmazing,1,0,1,77,0.0
16,17,have been on a slow weight loss  hence the little change in number  plus a muscle building quest hoping i ve got a good base started and would love some feedback and any advice on where to go from here  http  imgurcomah9wm0,45uz7i,progresspics,lifestyle,1455513633,Morhion02,39,0,1,1,0.0
17,18,,45lryl,progresspics,lifestyle,1455387138,Redheadgeekgirl,100,0,55,1,0.0
18,19,,45rcoo,progresspics,lifestyle,1455465443,Narcolepticstoner,91,0,60,0,0.0
19,20,you look great i wish i looked that good at 210 ,d013tzr,progresspics,lifestyle,1455571781,slicerd,2,0,31,557,0.0
20,21,congratulations  you re a handsome 32yearold guy  you lost 10 pounds  that s 023 pounds per week  your bmi is 277 a healthy bmi ranges between 185 and 249 keep up the good work    think about why you started   unknown    faq   https  wwwredditcomrprogresspicsbotwikiindex      subreddit   https  wwwredditcomrprogresspicsbot      feedback   https  wwwredditcommessagecompose  to  rprogresspicsbotamp  subject  suggestions ,d00nmgr,progresspics,lifestyle,1455547219,ProgressPicsBot,1,0,1,2642,0.0
21,22,wowgreat job ,d0040cq,progresspics,lifestyle,1455496126,Crash_Gordon,1,0,51,1089,0.0
22,23,congratulations  you re a sexy 22yearold guy  you lost an impressive 126 pounds that s 242 pounds per week  you must be working hard  your bmi is 209 a healthy bmi ranges between 185 and 249 what a handsome fella    do nt wish for it  work for it   unknown    faq   https  wwwredditcomrprogresspicsbotwikiindex      subreddit   https  wwwredditcomrprogresspicsbot      feedback   https  wwwredditcommessagecompose  to  rprogresspicsbotamp  subject  suggestions ,d01wkxz,progresspics,lifestyle,1455633547,ProgressPicsBot,1,0,1,2642,0.0
23,24,try a 2 month cut starting in march get ready for beach season ,d00ld59,progresspics,lifestyle,1455541768,eshasta,2,0,51,9750,0.0
24,25,nice from 410 to 6510 or 710 idk why  but i just like seeing these as i m starting my own diet i m cycling for an hour each day which is about 8441012 calories lost a day i m cutting back on food and mostly eating just twice a day and drinking lots of water ,d02jsbo,progresspics,lifestyle,1455666596,XxXZeusKillerXx,1,0,1,15,0.0
25,26,oh  i ca nt title  i m 54  ,czzok9s,progresspics,lifestyle,1455469351,beatorice,3,0,84,2,0.0
26,27,jeez you look great i am taller and similar weight but do nt look near as good as you do i am working on building muscle thou ,d024tab,progresspics,lifestyle,1455645938,slicerd,1,0,31,557,0.0
27,28,dude thats amazing  keep it up,d00f7ze,progresspics,lifestyle,1455518960,SKTLZ,3,0,1630,116,0.0
28,29,damn  you look great  do you have lots of excess skin  see  my body type is not like your before i was always the jiggly type of fat  not the firm fat  if that makes sense  which is obvious  by the picture  that your skin is bouncing back just fine  but i m afraid when i lose 30lbs that my skin will sag and look wild  did you do anything for the skin or did you ignore it  ps i m 230 511  ,d00wfzr,progresspics,lifestyle,1455561176,Superman135,1,0,1,11,0.0
29,30,great job  girl  i hope this does nt come off the wrong way  but from the way you re standing  you look like you may have a bit of an anterior pelvic tilt going on i had the same issue and ended up correcting it not only do i look better  but any back pain i had is completely relieved now ,czyont5,progresspics,lifestyle,1455388858,chief_kweef,4,0,492,6314,0.0
30,31,wanted to share my transformation today because it s been exactly 11 months between these 2 photos and my body weight is exactly the same this way it is very easy to see the transformation  last spring i bulked up to 183lbs and last fall dieted back to 170lbs no cardio was done only 5x5 at the gym ,d01vnwi,progresspics,lifestyle,1455631712,Suit_dota,3,0,456,61,0.0
31,32,amazing great work ,d029ggp,progresspics,lifestyle,1455652200,testytester2,1,0,1,106,0.0
32,33,how much has your waistline decreased  you look like you ll need a new wardrobe with all of the weight you ve lost around your hips and abdomen ,d02lbqq,progresspics,lifestyle,1455669018,Ebonyks,1,0,355,14886,0.0
33,34,,462kle,progresspics,lifestyle,1455631541,Suit_dota,143,0,456,61,0.0
34,35,lookin  good  keep it up,d00dux4,progresspics,lifestyle,1455515367,shrinkinginchicago,3,0,1,6,0.0
35,36,,45rnvv,progresspics,lifestyle,1455469327,beatorice,129,0,84,2,0.0
36,37,wow you look terrific what did you do to lose the weight ,d02rwhe,progresspics,lifestyle,1455679175,mycroft009,2,0,1,201,0.0
37,38,dude  this is freaking impressive excellent work  i had a similar realization  though a little bit later in life  just turned 30  and am hoping to some day be able to buy something fashionable i do pretty well for my size  but man it would be nice to walk in somewhere like hm or uniqlo and buy something off the rack  what kept you focused  do you think ,d026idj,progresspics,lifestyle,1455648239,thatjoshmiller,1,0,1,0,0.0
38,39,you re not single digit bodyfat lol more like 1214   but nice job ,d0234ha,progresspics,lifestyle,1455643633,xXxpssyfker69xXx,41,0,1,-46,0.0
39,40,congratulations on the 41 lbs weight loss  you look a lot healthier too keep up the great work man ,d00xgi7,progresspics,lifestyle,1455562613,Stecenellowe,1,0,1,22,0.0
40,41,congratulations  you re a handsome 19yearold guy  you lost 41 pounds  that s 073 pounds per week  your bmi is 25 a healthy bmi ranges between 185 and 249 what a handsome fella    do nt wish for it  work for it   unknown    faq   https  wwwredditcomrprogresspicsbotwikiindex      subreddit   https  wwwredditcomrprogresspicsbot      feedback   https  wwwredditcommessagecompose  to  rprogresspicsbotamp  subject  suggestions ,d01wkix,progresspics,lifestyle,1455633526,ProgressPicsBot,1,0,1,2642,0.0
41,42,looking great do nt know if i like your stinky face in the last pic   keep kicking ass  ,czzy0mt,progresspics,lifestyle,1455485488,Warr1979,1,0,55,197,0.0
42,43,how long did this take you  and congrats,d00eu2c,progresspics,lifestyle,1455517898,jubeanieowns,1,0,5514,5452,0.0
43,44,what s the time difference between the two pictures ,d00cp0v,progresspics,lifestyle,1455512684,Princess_Ava,5,0,8964,1713,1.0
44,45,this is amazing  what did you do specifically ,d00a7s6,progresspics,lifestyle,1455507574,piratebones,6,0,1,5344,0.0
45,46,great work man  what s your exercisediet like  any tips ,d012ev2,progresspics,lifestyle,1455569711,gmtd2015,3,0,1,2,0.0
46,47,,45u0in,progresspics,lifestyle,1455498152,meganlizzie,638,0,20476,8119,0.0
47,48,you look great  i m your height and stuck at 136 for over a year now  just learned i was eating too low  10001100  and am now upping my calories to 1350 or so i hope i see progress you give me hope it s possible ,d00gscb,progresspics,lifestyle,1455523858,gladiolas,1,0,155,1363,0.0
48,49,you were current me and are now the me i want to be what have you done  ,d00a7wm,progresspics,lifestyle,1455507581,elegantkitty,1,0,10899,2977,0.0
49,50,dude those eyebrows are on point  congrats  you look great   ,d01h02r,progresspics,lifestyle,1455592351,pwrji,1,0,1,201,0.0
50,51,,45xyr9,progresspics,lifestyle,1455561896,hazardousdank,183,0,184,19,0.0
51,52,nice  your before is pretty much me right now ,d01p5vc,progresspics,lifestyle,1455609801,cheekylittleduck,1,0,4153,5093,0.0
52,53,looking great   ,d006x5v,progresspics,lifestyle,1455501593,BpsychedVR,2,0,525,6130,0.0
53,54,nice one man,d00xhle,progresspics,lifestyle,1455562656,MangoManOKAY,1,0,32,3,0.0
54,55,great job     go    phils   ,czzlw6l,progresspics,lifestyle,1455464424,huphelmeyer,2,0,220125,218877,1.0
55,56,congratulations  you re a beautiful 23yearold woman  you lost an impressive 75 pounds that s 214 pounds per week  you must be working hard  your bmi is 354 a healthy bmi ranges between 185 and 249 keep up the good work    winners never quit and quitters never win   vince lombardi    faq   https  wwwredditcomrprogresspicsbotwikiindex      subreddit   https  wwwredditcomrprogresspicsbot      feedback   https  wwwredditcommessagecompose  to  rprogresspicsbotamp  subject  suggestions ,d00nmde,progresspics,lifestyle,1455547214,ProgressPicsBot,2,0,1,2642,0.0
56,57,serious questionare you getting more attention from the boys ,d000ckf,progresspics,lifestyle,1455489528,mhall812,1,0,5,7886,0.0
57,58,wonderful  very motivating to me ,czzhxih,progresspics,lifestyle,1455454494,Chachabooom,2,0,8,971,0.0
58,59,looking good   and you ll be sure to lose more rooting for the phillies,czzougr,progresspics,lifestyle,1455469844,pike1868,2,0,3859,2278,0.0
59,60,nice smile there  you look great  keep going,d000deo,progresspics,lifestyle,1455489570,afff7,1,0,9,74,0.0
60,61,it is always so cool to see the gorgeous person underneath  obligatory   you were beautiful the way you were   but healthy looks awesome on you  congratulations ,czzmgvn,progresspics,lifestyle,1455465537,Jonny_RockandFit,11,0,1,6581,0.0
61,62,wow so gorgeous,czzyxo1,progresspics,lifestyle,1455487066,Avb-creator,2,0,15,239,0.0
62,63,congratulations  you re a beautiful 25yearold woman  you lost 20 pounds  that s 038 pounds per week  your bmi is 387 a healthy bmi ranges between 185 and 249 keep up the good work    you want me to do something tell me i ca nt do it   maya angelou    faq   https  wwwredditcomrprogresspicsbotwikiindex      subreddit   https  wwwredditcomrprogresspicsbot      feedback   https  wwwredditcommessagecompose  to  rprogresspicsbotamp  subject  suggestions ,d01wkqu,progresspics,lifestyle,1455633538,ProgressPicsBot,3,0,1,2642,0.0
63,64,doing great  keep it up you look wonderful ,d01ygkd,progresspics,lifestyle,1455636810,shrinkinginchicago,2,0,1,6,0.0
64,65,,45zz9u,progresspics,lifestyle,1455585547,chriosania,0,0,26,11,0.0
65,66,,466afl,progresspics,lifestyle,1455679620,Jandc33,16,0,8,0,0.0
66,67,wow  you can tell all over your body  but i think it s incredible how much more angular your face has become  keep up the amazing work ,d02tupr,progresspics,lifestyle,1455682487,BarbellPenguin,2,0,1,3,0.0
67,68,wow  you held 270 very well really great work btw ,d01j6e6,progresspics,lifestyle,1455595867,Rumplesforeskins,7,0,1,140,0.0
68,69,you look amazballs    ,czzz5kt,progresspics,lifestyle,1455487429,saraarass,2,0,466,740,0.0
69,70,you look awesome  what clothing sizes are you currently wearing  what sizes did you start at ,czzsly2,progresspics,lifestyle,1455476200,the_sandra,2,0,7,833,0.0
70,71,congratulations  you re a handsome 24yearold guy  you lost 48 pounds  that s 185 pounds per week  your bmi is 27 a healthy bmi ranges between 185 and 249 keep up the good work    energy and persistence conquer all things   benjamin franklin    faq   https  wwwredditcomrprogresspicsbotwikiindex      subreddit   https  wwwredditcomrprogresspicsbot      feedback   https  wwwredditcommessagecompose  to  rprogresspicsbotamp  subject  suggestions ,d01wkqv,progresspics,lifestyle,1455633538,ProgressPicsBot,1,0,1,2642,0.0
71,72,fantastic ,d01mo2i,progresspics,lifestyle,1455602800,sterlingdancer,1,0,1,265,0.0
72,73,congrats man  that s some amazing progress right there,d00mxun,progresspics,lifestyle,1455545784,philsach,2,0,1258,102,0.0
73,74, deleted ,czzp4kj,progresspics,lifestyle,1455470332,[deleted],1,0,0,0,
74,75,great work ,d003x3j,progresspics,lifestyle,1455495955,Crash_Gordon,2,0,51,1089,0.0
75,76,,45rl4q,progresspics,lifestyle,1455468371,robot_cheetahs,160,0,6287,433,0.0
76,77,man  63  of course we can see  that s awesome dude  ,czzu5rh,progresspics,lifestyle,1455478866,scandiumflight,4,0,444,15537,0.0
77,78,we can definitely tell   keep doing what you re doing and the fat will continue to melt off excellent work  ,d002pp7,progresspics,lifestyle,1455493698,StylusX,2,0,2556,4876,0.0
78,79,wow ,d01jtx2,progresspics,lifestyle,1455596984,AsteroidShark,1,0,2418,35071,0.0
79,80,totally can tell and you are doing awesome ,d00cyi5,progresspics,lifestyle,1455513282,simplyatomic,1,0,724,7360,1.0
80,81,great job ,czzwpga,progresspics,lifestyle,1455483298,funchords,4,0,2405,41229,1.0
81,82,wow great job you look great  i m a good bit older but we have the same build  height  coloring  etc hope you do nt mind if i shoop my face onto these for inspiration ,d0098m6,progresspics,lifestyle,1455505731,testytester2,2,0,1,106,0.0
82,83,awesome work  ,czzry0k,progresspics,lifestyle,1455475081,Lauraar,3,0,65,986,0.0
83,84,buuuddddy great job  what did you do to lose the weight ,d005zpa,progresspics,lifestyle,1455499850,mynutees,3,0,1,59,0.0
84,85,you look great  what sort of regimen did you follow  edit  spelling,czzdb84,progresspics,lifestyle,1455435735,kribear,1,0,1,2,0.0
85,86,congratulations  you re a handsome 25yearold guy  you lost 35 pounds  that s 067 pounds per week  your bmi is 258 a healthy bmi ranges between 185 and 249 keep up the good work    think about why you started   unknown    faq   https  wwwredditcomrprogresspicsbotwikiindex      subreddit   https  wwwredditcomrprogresspicsbot      feedback   https  wwwredditcommessagecompose  to  rprogresspicsbotamp  subject  suggestions ,d00nmew,progresspics,lifestyle,1455547216,ProgressPicsBot,1,0,1,2642,0.0
86,87,where did your tattoos go in the after picture   ,czzefc6,progresspics,lifestyle,1455439634,DonKnaus,4,0,1,68,0.0
87,88,were you exerting the same pressure in your abdominal region in both pics  it looks like you re pushing your stomach out in the left  but flexing it and holding it in on the right  which really is nt a very accurate beforeafter comparison  great progress regardless ,czzbxcj,progresspics,lifestyle,1455431732,emx620,38,0,1016,548,0.0
88,89,congratulations  you re a beautiful 29yearold woman  you lost 96 pounds  that s 062 pounds per week  your bmi is 301 a healthy bmi ranges between 185 and 249 keep up the good work    every champion was once a contender that refused to give up   rocky balboa    faq   https  wwwredditcomrprogresspicsbotwikiindex      subreddit   https  wwwredditcomrprogresspicsbot      feedback   https  wwwredditcommessagecompose  to  rprogresspicsbotamp  subject  suggestions ,czyi2wt,progresspics,lifestyle,1455377019,ProgressPicsBot,1,0,1,2642,0.0
89,90,you re literally my exact stats and body type   i m not even joking 25f  58 sw 157  cw 151 gw 135  wan na be accountabilibuddies  i know it sounds lame but it s very rare you find someone in the exact same situationexact same stats it d be nice to have someone along for the journey ,d007lsi,progresspics,lifestyle,1455502868,bornruffian,1,0,107,1675,0.0
90,91,100m and 200m track runner here even if you re young and start puberty late  like me  you can still gain hella massive gains if you put extreme effort into it i hope this inspires someone   status  age  14 height  56 weight  150lbs bodyfat   8  vertical jump  30 inches first pic is me at 13 years old http  forumbodybuildingcomattachmentphp  attachmentid  8177971amp  d  1455672264 second pic is me  taken today http  forumbodybuildingcomattachmentphp  attachmentid  8177961amp  d  1455672033,465vot,progresspics,lifestyle,1455674069,throwawaycusyeah,1,0,6,363,1.0
91,92,you re not pregnant anymore ,czz9lg1,progresspics,lifestyle,1455426512,euphorica79,26,0,140,447,0.0
92,93,awesome progress  keep it up  your teeth even look whiter ,czxltkr,progresspics,lifestyle,1455303149,nolgraphic,1,0,5,14,0.0
93,94,2 months http  imgurcomsabxdi4 i changed my diet completley  except my creamsugar in my coffee because well it s my favorite no more fastfood  candy  regular soda  chips  or red meat i feel great ,45exfx,progresspics,lifestyle,1455287038,LzBaby,81,0,1,63,0.0
94,95,,45o9fv,progresspics,lifestyle,1455419338,lemonpossum,119,0,82,0,0.0
95,96,your whole shape is different ,czywamq,progresspics,lifestyle,1455402510,mandykat24,1,0,2416,12062,0.0
96,97,i might be wrong  but is the tattoo  not the birdcage  the other one  the eating disorder recovery symbol  if yes  that s super badass  balancing healthy weight loss with the urge to slip into problematic past behaviours can be super tricky ,czxobzc,progresspics,lifestyle,1455306666,Kycb,2,0,7209,5321,0.0
97,98,congratulations  you re a beautiful 19yearold woman  you lost an impressive 53 pounds that s 204 pounds per week  you must be working hard  your bmi is 328 a healthy bmi ranges between 185 and 249 keep up the good work    a winner never stops trying   tom landry    faq   https  wwwredditcomrprogresspicsbotwikiindex      subreddit   https  wwwredditcomrprogresspicsbot      feedback   https  wwwredditcommessagecompose  to  rprogresspicsbotamp  subject  suggestions ,czyi2wm,progresspics,lifestyle,1455377019,ProgressPicsBot,1,0,1,2642,0.0
98,99,,45pxph,progresspics,lifestyle,1455447728,lyssammm86,1729,0,1335,71,0.0
99,100,you look amazing  and you re a phillies fan   love it ,czzlayo,progresspics,lifestyle,1455463266,Imissmybear,3,0,1819,1601,0.0
100,101,congratulations  you re a sexy 29yearold woman  you lost 25 pounds  that s 114 pounds per week  your bmi is 25 a healthy bmi ranges between 185 and 249 you look lovely    do something today that your future self will thank you for   unknown    faq   https  wwwredditcomrprogresspicsbotwikiindex      subreddit   https  wwwredditcomrprogresspicsbot      feedback   https  wwwredditcommessagecompose  to  rprogresspicsbotamp  subject  suggestions ,czyi2ys,progresspics,lifestyle,1455377023,ProgressPicsBot,1,0,1,2642,0.0
101,102,you got this girl  ,czzmfkc,progresspics,lifestyle,1455465468,TuMeConoces,2,0,110,149,0.0
102,103,awesome work  you look stunning ,czxgzx5,progresspics,lifestyle,1455296521,soapyfeet,1,0,1,0,0.0
103,104,pretty in both  keep up the good work    ,czxlbrq,progresspics,lifestyle,1455302463,HelloGodItsMeHerpes,1,0,120,223,0.0
104,105,went from super cute to super hot great job ,czxkruf,progresspics,lifestyle,1455301690,sncooftxt,2,0,105,2833,0.0
105,106,,45f5q9,progresspics,lifestyle,1455290137,honeynut-queerios,154,0,1910,11715,0.0
106,107,congrats  and you look so happy ,czyjoc5,progresspics,lifestyle,1455380178,clearcoffeemug,1,0,506,337,0.0
107,108,soo pretty,czzuyj8,progresspics,lifestyle,1455480233,glitteratibarbie,1,0,182,35,0.0
