462,463,you look so awesome ,czyoefg,progresspics,lifestyle,1455388404,theslowwhatever,12,0,1,467,0.0
463,464,you look great   please please share how you did it i have been stuck at 136 for an entire year raising and lowering calories has nt worked i do 10m of kettlebell a day now and hoping it will work i have upped my calories a bit but i m basically confused how to get er done please share your exercise level  if any  and your calorie count ,czywtwv,progresspics,lifestyle,1455403444,gladiolas,2,0,155,1363,0.0
464,465,that swimsuit is really cute  and you should be proud of your achievement ,czyxb1q,progresspics,lifestyle,1455404276,zegafregaomega,1,0,614,9396,0.0
465,466,i am your before pic  what did you do   you look amazing ,czyvnbq,progresspics,lifestyle,1455401357,Suz73,6,0,316,5698,0.0
466,467,hey guys  long time lurker  i promised myself as a newyears resolution to have a more healthy life style from now on  today i had a phyiscal evaluation  the same that i had 40 days ago  turns out i lost 6kg  12pounds  of body fat  and got amazing 25kg  5pounds  of muscles  im feeling proud and want to share to spread the feeling that everyone can do it  you just have to start    http  imgurcomavcgc8 i ll be updating my album whenever i think its time feel free to ask me any questions  and sorry for the bad english  seeya,464bi2,progresspics,lifestyle,1455653371,fzacha,11,0,1,24,0.0
467,468,amazing progress  do you mind sharing how you got here  kudos   ,czywkvd,progresspics,lifestyle,1455403003,phoebixx,1,0,3,1131,0.0
468,469,you look great   my stomach is also my worst enemy i m right in the middle of healthy bmi for my height but grrr my stomach   everyone suggests doing weightsresistance training  have you thought about doing that ,czyulcw,progresspics,lifestyle,1455399447,tin1bbi,3,0,93,4545,0.0
469,470,fantastic progress  how long did it take you ,czyrps3,progresspics,lifestyle,1455394259,tocamix90,4,0,12230,13487,0.0
470,471,great progress  you do nt need to lose anything more  your stomach is ok  you just need to tone up a bit squat  deadlift  lunge will take care of the rest ,czzibtd,progresspics,lifestyle,1455455778,befocus,1,0,1,88,0.0
471,472,hello hot stuff i ll bet not only do you feel better about yourself but i bet your energy level has gone through the roof  look fabulous congrats on the great work it s totally paying off ,czytgji,progresspics,lifestyle,1455397389,Krisjhn,1,0,44,484,0.0
472,473,killing it ,d02g12s,progresspics,lifestyle,1455660957,Loraura,1,0,1,20,0.0
473,474,you wore 202 really well  not that you do nt look great now you do but  just saying  you wore the extra weight really well ,d0291uz,progresspics,lifestyle,1455651661,Ratscallion,6,0,2566,3686,0.0
474,475,you look great  you seem like you ve gotten younger even though we ca nt see your face ,d01bp4f,progresspics,lifestyle,1455584014,lurchlurks,2,0,1403,3916,0.0
475,476,thats awesome  i m 53125 did you stick to 1200 a day or lower  did it get easier to eat reduced calories the longer you did it  i seem to hold 1200 for about 45 weeks  get down to 120  and then i go crazy and start eating what i used to eat  20002500  and go back to 125 ,d028xoq,progresspics,lifestyle,1455651506,UmRaja86,15,0,1,363,0.0
476,477,wow grats  that must of been a few pant sizes  a little goes a long way when you are as short as us  ,d02fsdt,progresspics,lifestyle,1455660623,ElRxBandita,2,0,1472,1090,0.0
477,478,nice work ,d02i69y,progresspics,lifestyle,1455664052,SE7ENSIX,1,0,310,387,0.0
478,479,damn   looked good then  look even better  and stronger  now there s not much more to say,d02nelu,progresspics,lifestyle,1455672199,insertkarma2theleft,2,0,19717,5786,0.0
479,480,great progress  and love the artwork  ,d02uoit,progresspics,lifestyle,1455683976,kccolden,1,0,51,566,0.0
480,481,,464n54,progresspics,lifestyle,1455657396,Kellyshmo,56,0,8268,1511,0.0
481,482,that smile makes me happy ,czy115v,progresspics,lifestyle,1455327306,Hamnesia,2,0,7,1465,0.0
482,483,i liked you better here  http  imgurcomxgamm2q,d02ss56,progresspics,lifestyle,1455680639,BushwickPhil,1,0,1,132,0.0
483,484,that soon after surgery picture looks eerily like a cadaver picture i m glad the 4 weeks after is looking significantly better  amazing job losing the weight and also really interesting to see how well the surgery worked best of luck with the continued efforts ,d02ulxb,progresspics,lifestyle,1455683833,Kcinic,1,0,141,11633,0.0
484,485,well done i need to get off my ass and do the same ,czzs7di,progresspics,lifestyle,1455475520,hankholetsgo,3,0,34,120,1.0
485,486,whoa awesome job and nice butt ,d02qzp4,progresspics,lifestyle,1455677697,smonger,2,0,1,40,0.0
486,487,you look great  you look like you lost 15 years  too ,czyxgy2,progresspics,lifestyle,1455404561,stinkyhat,2,0,1960,20326,0.0
487,488,  minor back story    i m a 21 year old guy would basically put on way more than i should of during my last relationship i went from rather skinny to quite large in about 2 years since i broke up with my ex in about jan of 2015 i have have been on and off dieting i went through 2 large periods of plateuing with my weight after losing motivation well i am more determined than ever to get into a healthy but not necessarily ripped physique this is mainly so i feel a lot better and more comfortable in my own skin    before i put on weight  3 12 years ago      http  imgurcomgre1fsz   http  imgurcomgre1fsz   weight  190 lbs  ish      height  510   at my largest  12 months ago      http  imgurcomoquxw8x   http  imgurcomoquxw8x   weight  273 lbs  height 510   current     http  imgurcomt4l3mxr   http  imgurcomt4l3mxr   weight  231 lbs  height 510 if you guys have any questions about anything about me  let me know and i ll be sure to answer ,45lbwe,progresspics,lifestyle,1455381955,beecho01,30,0,1,4,0.0
488,489,congratulations  you re a handsome 21yearold guy  you lost 42 pounds  that s 081 pounds per week  your bmi is 331 a healthy bmi ranges between 185 and 249 keep up the good work    a journey of a thousand miles begins with a single step   confucius    faq   https  wwwredditcomrprogresspicsbotwikiindex      subreddit   https  wwwredditcomrprogresspicsbot      feedback   https  wwwredditcommessagecompose  to  rprogresspicsbotamp  subject  suggestions ,d00nm7q,progresspics,lifestyle,1455547206,ProgressPicsBot,1,0,1,2642,0.0
489,490,i like that new hair ,czyldy1,progresspics,lifestyle,1455383206,Amerikaner83,2,0,815,6562,0.0
490,491,,45qrfh,progresspics,lifestyle,1455458623,MrsC7906,215,0,4167,2585,0.0
491,492,nice work  you made amazing progress ,czzkpp1,progresspics,lifestyle,1455461943,lanceman002,2,0,1,36,0.0
492,493,good job ,d00awki,progresspics,lifestyle,1455508934,tytwin,2,0,284,1462,0.0
493,494,a couple  two or a few source  american heritage dictionary  so she lost 39 pounds in 24  maybe 5 weeks rightsee my username for my true feelings about this post ,czzujpu,progresspics,lifestyle,1455479539,fuckthisshit6669,-3,0,1,-2,0.0
494,495,nice job   how did you get started and stay motivated with running  do you run every day ,czzn712,progresspics,lifestyle,1455466898,sasquatchvillage,2,0,49,30,0.0
495,496,congratulations  you re a beautiful 42yearold woman  you lost an impressive 140 pounds that s 269 pounds per week  you must be working hard  your bmi is 47 a healthy bmi ranges between 185 and 249 keep up the good work    the finish line is just the beginning of a whole new race   unknown    faq   https  wwwredditcomrprogresspicsbotwikiindex      subreddit   https  wwwredditcomrprogresspicsbot      feedback   https  wwwredditcommessagecompose  to  rprogresspicsbotamp  subject  suggestions ,d00nmi3,progresspics,lifestyle,1455547221,ProgressPicsBot,44,0,1,2642,0.0
496,497,crazy motivating  you look like a new person ,d00gmcg,progresspics,lifestyle,1455523299,Thatseemskindaweird,6,0,3,203,0.0
497,498,amazing     great job    ,d00jc49,progresspics,lifestyle,1455534223,abjennifleur,3,0,1022,3504,0.0
498,499,totally inspiring ,d00k70b,progresspics,lifestyle,1455537748,testytester2,3,0,1,106,0.0
499,500,congratulations next february  walking a half marathon ,d00kdwx,progresspics,lifestyle,1455538488,Ratscallion,3,0,2566,3686,0.0
500,501,damn  nice ,d00oxxt,progresspics,lifestyle,1455549721,whatwhynope,2,0,152,7537,0.0
501,502,nice job   ,d011b0m,progresspics,lifestyle,1455568144,dbhus21,1,0,31,206,0.0
502,503,respect  keep on  comrade ,d00gpw5,progresspics,lifestyle,1455523622,ProfessorXjavier,5,0,1,570,0.0
503,504,i had bariatric surgery in august  1  my 40th birthday   http  iimgurcomuhdsswojpg   i weighed 441 pounds  1 in january 2014 i told myself that if i could give up diet pepsi  i d look into the surgery my last soda was 1114  2 in january 2015  i made an appointment with my primary care doctor before he had  rightly  refused to recommend me to the bariatric surgery program because he did nt think i was ready mentally i told him of my efforts to stop drinking soda  and we talked for a while he gave me the recommendation  4 29  the before  image on this post was taken at my body analysis  one of the requirements for the surgery  5 march  july   12 weeks of classes  once per week  5 august  surgery 6 august  now  continue to eat healthy  log everything i eat and drink exercise 4 days per week  lots of protein  7 21416  walk my 5k 8 the future  keep moving and working towards a healthy weight  my original goal was to get under 200 pounds however  i have revised that goal instead i will get to my recommended weight  125  135 pounds   i forecast it will take me another year  but i am determined to succeed   the health plan i have has one of the best programs in the country the main reason is the prep work you ca nt just walk in and get cut on you have to qualify  1 a referral from your doctor 2 complete a body analysis 3 take 12 classes that cover everything from what to expect from the surgery  how to eat before and after  how to exercise  mental health issues  interpersonal relationships  vitamins very comprehensive 4 complete lab work  including some gross stuff  5 complete and submit a weekly food journal 6 see a mental health professional 8 exercise 30 minutes a day 3  4 days per week 7 lose 10  of your weight  i lost 17  before  i took the program very seriously i ve tried every diet under the sun i felt like this was my last chance i did everything they wanted of me  i know some people will see i had surgery and think i took a short cut  the easy way out those people are wrong the surgery is a tool a very painful and exhausting tool it is not a cureall i did and am still doing the work i will have to keep it up for the rest of my life my life  that i can now see for the first time in a long time  exceeding 50 ,d00p8r8,progresspics,lifestyle,1455550234,trekbette,115,0,11138,56137,0.0
504,505,wow  good job,d00ktbq,progresspics,lifestyle,1455540022,alyahya8,3,0,1,29,0.0
505,506,you lost a whole  me  in one year that is impressive  keep up the good work ,d00k8hj,progresspics,lifestyle,1455537907,probably_normal,3,0,286,3255,0.0
506,507,woah  you re an inspiration  you re absolutely incredible looking amazing i wish i had more words for you  but i m so stunned i really having nothing else to say ,d00o37q,progresspics,lifestyle,1455548129,throwawayieruhyjvime,5,0,1524,4228,0.0
507,508,you go girl  i m going to start walking to work and you are my example keep up the good work ,d00mai8,progresspics,lifestyle,1455544275,Mrscmh48,3,0,96,303,0.0
508,509,amazing work     great job on the 5k   ,d00l2q8,progresspics,lifestyle,1455540875,kamid1217,5,0,496,28,0.0
509,510,you ve done so well and you look great keep it up girl ,d00maqu,progresspics,lifestyle,1455544291,areichelt,3,0,18,2,0.0
510,511,awesome  your hard work is paying off and you are looking great keep up the good work ,d00elp4,progresspics,lifestyle,1455517258,Youjustgotread,77,0,1,1161,0.0
511,512,congratulations ,d00riw9,progresspics,lifestyle,1455553928,BeautifulFall,2,0,1,50,0.0
512,513,impressive keep going ,d00mb4m,progresspics,lifestyle,1455544317,jjmitchell,3,0,61,1724,0.0
513,514,that s awesome   keep up the hard work ,d00lyr3,progresspics,lifestyle,1455543437,JnR2492,5,0,121,15,0.0
514,515,one year older and you look 5 to 10 years younger ,d00mrap,progresspics,lifestyle,1455545385,germinik,4,0,13307,72594,0.0
515,516,you go girl smash it ,d00kwvv,progresspics,lifestyle,1455540351,DMBM,3,0,1,34,0.0
516,517,wow  that s great progress for six months you re really kicking butt ,d00f8tq,progresspics,lifestyle,1455519027,tarso_carina,20,0,1,103,0.0
517,518,wow  great work  keep it up    ,d00na67,progresspics,lifestyle,1455546514,Bill-Evans,3,0,1,534,0.0
518,519,you re great    ,d01ak0p,progresspics,lifestyle,1455582163,Amehoela,1,0,1,16,0.0
519,520,you go girl,d00mnhz,progresspics,lifestyle,1455545147,1leggeddog,3,0,72203,79800,0.0
520,521,that s incredible keep it up ,d00jgm6,progresspics,lifestyle,1455534777,Skeeball_Fanatic,3,0,2248,52230,0.0
521,522,nice  when workouts get hard and your unmotivated  just remember all the people you re inspiring  edit  unnoticed to unmotivated,d012ffy,progresspics,lifestyle,1455569735,lilywilliamsburg,1,0,8,1029,0.0
522,523,that s amazing  that s over ten pounds a month  basically three a week  do you know how impressive that is     good for you ,d00on4w,progresspics,lifestyle,1455549178,serrakat,3,0,205,11422,0.0
523,524,great work  wow keep it up ,d00r9fq,progresspics,lifestyle,1455553516,kittysly,2,0,6,5529,0.0
524,525,great work  ,d00nwzy,progresspics,lifestyle,1455547800,DeliciousJamsNJellys,3,0,5,2818,0.0
525,526,fuck yeah  good job ,d01hwo9,progresspics,lifestyle,1455593799,MarxistMallard,2,0,274,265,0.0
526,527,inspirational thanks for sharing ,d00p8rq,progresspics,lifestyle,1455550235,awsmwsm,2,0,655,2623,0.0
527,528,you look awesome  love your eyesbrows ,czzuc2g,progresspics,lifestyle,1455479173,milkmade,2,0,25,470,0.0
528,529,great job  keep it up you look great ,d0110sk,progresspics,lifestyle,1455567734,BroodjeHaring,1,0,1,701,0.0
529,530,amazing progress  what do you think has been most crucial to your success  what has been the hardest part ,d00hua8,progresspics,lifestyle,1455527831,anomalya,3,0,1124,1018,0.0
530,531,this is really great  congratulations  keep up the good work ,d010ks7,progresspics,lifestyle,1455567091,talljim,1,0,1816,69,0.0
531,532,great job  keep up the hard work and always remember that you did that  acknowledging your own hard work is a great way to keep up your motivation i m so proud of you ,d00u8hy,progresspics,lifestyle,1455557990,Lucy05,1,0,134,2004,0.0
532,533,great job it is really hard as you get older and especially being as short as you are to lose the weight you have keep up the good work and take care of your joints,d01a6kd,progresspics,lifestyle,1455581559,1345,1,0,416,3876,0.0
533,534,congratulations  you went back in time ,czxow6b,progresspics,lifestyle,1455307486,saltporksuit,3,0,2827,8411,1.0
534,535,great progress dude  i ve just started my journey this week and i m very similar to your starting stats  m23510  221   your after pic is a huge  wow  to me and is definitely going to help me stay focused and motivated  do you have any tips on your routine or diet tipstricks that you did during this ,d02twgx,progresspics,lifestyle,1455682571,kccolden,2,0,51,566,0.0
535,536,huge difference  awesome job ,czwvtzk,progresspics,lifestyle,1455247150,MaryJane801,2,0,0,0,
536,537,you look great ,d01mudq,progresspics,lifestyle,1455603214,Stormhammer,3,0,1666,17548,0.0
537,538,get on a scale    helps noone,d01ttmh,progresspics,lifestyle,1455627234,elarson4,0,0,1909,629,0.0
538,539,impressive change and only in 6 months  congrats man  obligatory  how did you do it  ,czzgye6,progresspics,lifestyle,1455450743,gimp2er,1,0,1,16,0.0
539,540,amazing work bro  can you please tell us what you did to reach this result,d02dvdm,progresspics,lifestyle,1455658054,medoban,1,0,56,47,0.0
540,541,you should nt hide your face  i bet it s cute  ,czz2f5g,progresspics,lifestyle,1455413445,masterdebater117,-6,0,0,0,
541,542,great work  what s funny is that i ve begun to notice how weight  s can be so arbitrary bc i m 54  and at 135lb i looked like your second pic weird how diff people carry the weight differently numbers do nt matter but more how you look and feel ,czz2hwb,progresspics,lifestyle,1455413579,reddituser1158,2,0,1,1098,0.0
542,543,great progress  i really miss having those stomach lines your abs are gon na look awesome i can already see it also off topic but that side table is so cute ,d02iuy4,progresspics,lifestyle,1455665104,__seripha__,1,0,1714,19968,0.0
543,544,beautiful ,d02uybv,progresspics,lifestyle,1455684480,worth-less,1,0,1,70,0.0
544,545,you should be proud you look great thanks for sharing your progress ,d01jaql,progresspics,lifestyle,1455596073,tytwin,2,0,284,1462,0.0
545,546,well done girl  well done ,d02v5xm,progresspics,lifestyle,1455684873,Splatterh0use,1,0,13361,40619,0.0
546,547,well done  amazing change so far what changes did you make in your life to get there ,d01qjnc,progresspics,lifestyle,1455614920,catchthisfade,5,0,1541,18335,0.0
547,548,oh my god you look amazing i m shorter than you but currently at your starting weight you re also my goal weight  so basically i hope to be you in six months what kind of foods did you eat  and how did you curb cravings and not over eat like before  that s my biggest issue so far ,d02i938,progresspics,lifestyle,1455664167,uglybarnacle94,3,0,0,0,
548,549,,45yo9c,progresspics,lifestyle,1455569625,Poemiest,496,0,502,84,0.0
549,550,congratulations  you re a sexy 24yearold guy  you lost 91 pounds  that s 175 pounds per week  your bmi is 224 a healthy bmi ranges between 185 and 249 what a handsome fella    a winner never stops trying   tom landry    faq   https  wwwredditcomrprogresspicsbotwikiindex      subreddit   https  wwwredditcomrprogresspicsbot      feedback   https  wwwredditcommessagecompose  to  rprogresspicsbotamp  subject  suggestions ,d01wkog,progresspics,lifestyle,1455633534,ProgressPicsBot,3,0,1,2642,0.0
550,551,amazing progress ,d01kyj9,progresspics,lifestyle,1455599118,Princess_Ava,2,0,8964,1713,1.0
551,552,looks awesome and the dmc tshirt is pretty epic too ,czzdn30,progresspics,lifestyle,1455436802,Citystarrz,2,0,14,659,0.0
552,553,it s not even march yet,d02uz02,progresspics,lifestyle,1455684515,CannonEyes,1,0,1008,2862,0.0
553,554,you look great   rockin that bikini girl  good for you ,czypr5f,progresspics,lifestyle,1455390777,azumeowbitch,3,0,142,30,0.0
554,555,wow  amazing progress mate  i m sure you hear this a lot  but you really look like a different person stay strong ,d014b09,progresspics,lifestyle,1455572478,Firefair,7,0,1,34,0.0
555,556,impressive  out of curiosity  what was your daily calorie goal  did you monitor sodium  fat or cholesterol intake  as well  did you give yourself cheat days ,d01lve0,progresspics,lifestyle,1455600990,ndaprophet,1,0,137,5515,0.0
556,557,way to do man you rock ,d0167v0,progresspics,lifestyle,1455575327,Parzival_Player_1,1,0,175,204,0.0
557,558,great job  i started at a higher weight and am down 16 pounds too looking for 8  10 more i want to wear a 2 piece this summer myself    anyway  you look great  kudos,czyyl2s,progresspics,lifestyle,1455406566,Serenity-,1,0,3418,3895,0.0
558,559,are you planning on bulking up  i m 65  215lbs and about 17  body fat and i feel skinny fat  with way less musculature than my frame requires ,d01e0lo,progresspics,lifestyle,1455587661,Rebel_Stylee,12,0,1,1128,0.0
559,560,they look great  good work well done ,czztnco,progresspics,lifestyle,1455477989,1200calslimdown,2,0,391,303,0.0
560,561,yep  aids ll do that,d01t57s,progresspics,lifestyle,1455625205,aurtherdigbysellars,-7,0,198,2269,0.0
561,562,awesome dude  what are your before and after waist measurements ,d01km1v,progresspics,lifestyle,1455598432,itsallgood212,1,0,286,202,0.0
562,563,i m sure everyone has said this already but you look like elijah wood ,d01js1y,progresspics,lifestyle,1455596893,iluvtheinternets,1,0,2332,3048,0.0
563,564,collar bonesand the butt is starting to look good congrats and keep it up  ,d00neu1,progresspics,lifestyle,1455546790,gentenone,1,0,1,201,0.0
564,565,,4604xy,progresspics,lifestyle,1455587622,Bendova1998,136,0,436,84,0.0
565,566,i was told i should post this here i started at 360 a little less than a year ago after years of gaining weight and not recognizing myself in mirrors i wore size 5x shirts and 52waist  i now wear large shirts and 34 waist i joined a healthy lifestyle program at my local hospital i did nt have much hope for it but i thought if i was going to do i would be the best i lost 16lb the first two weeks i looked at if like beating a highs ore i wanted to have lost more each meeting than the last i was losing about 5 pounds a week  20 a month   i did so well my doctors want to use me as the poster child for their program i have given a couple speeches at medical conferences and i am currently working with a group of kids that are still in the program i just started a weight loss program at my school with the help of my doctors i want to show that anyone can lose weight and you do nt need to take pills or get surgery  unless absolutely necessary of coarse  to lose weight i remember seeing the p90x type commercials thinking that it was impossible for me to do i want to show people that anyone can change  i got so socially uncomfortable i pulled out of public school for two years i would go weeks without talking to anyone and it ruined my social skills but now i give speeches to groups of doctors and other kids in programs similar to my  one thing i try and tell people who ask me how i did is that you do nt have to work yourself to death everyday of coarse it wo nt be easy i started of just eating right and walking i then moved to working on my bowflex and now i focus are cardio which is my favorite i only eat fruits meats and vegetables i lowered my carb intake but that can be dangerous because your body needs carbs so i stick with rice i eat fruits whenever i get a sweet tooth sense they are natural sweeteners i have very little dairy intake my diet is very important because of my medical issues at my largest i was at the threat of getting thyroid cancer a swell as gynecomastia  which is very painful   the leg pain i was referring to was osgood shlaters  the tendon in the knee pulls apart after to much running now i have no signs of cancer and only take one pill for the gynecomastia  i took 4 for 6 months   the photo on the right is a month old about 15 pounds  i do nt like taking photos  sorry for typing so much feel free to ask any questions   ps i ve thrown those shoes out along with three trash bags of old clothes  i have love for fashion now that i can wear nice clothes ,d01eprh,progresspics,lifestyle,1455588739,Bendova1998,8,0,436,84,0.0
566,567,http  imgurcomafa68v,d01f9r3,progresspics,lifestyle,1455589626,Bendova1998,2,0,436,84,0.0
567,568,http  imgurcomas3rpx,d01fp08,progresspics,lifestyle,1455590289,Bendova1998,2,0,436,84,0.0
568,569,thats awesome dude  how did you manage to do it so fast  were you taking any sort of vitamins or shakes ,d01ihkg,progresspics,lifestyle,1455594725,lameeshalani,2,0,27,2,0.0
569,570,holy shit inspiring as fuck  keep it up ,d02rlpe,progresspics,lifestyle,1455678684,Gothams__Reckoning,2,0,9,2917,0.0
570,571,badass ,d02t8h8,progresspics,lifestyle,1455681403,scurius,2,0,85,5044,1.0
571,572,fucking awesome dude  how many calories were you doing a day ,d01ftet,progresspics,lifestyle,1455590481,i_hunt_elk,2,0,2133,6574,0.0
572,573,wow  you have definitely had great progress there lots of hard work and it s paying off  you look great   ,d00gqb8,progresspics,lifestyle,1455523665,mb_mb_mb,7,0,48,385,0.0
573,574,congrats  that s amazing  it looks like you re moving backward through time too  you look 510 years younger to me now ,d00kycc,progresspics,lifestyle,1455540481,Nurse_Hatchet,18,0,386,1103,0.0
574,575,great job   ,d00l7fj,progresspics,lifestyle,1455541289,Throwyourtoothbrush,7,0,5192,12814,1.0
575,576,now we just need to buy you a new shirt haha so awesome  proud of you ,d00o4nu,progresspics,lifestyle,1455548206,RajaBadMime,5,0,12,100,0.0
576,577,you look great  fantastic work  i hope you are super proud of this ,czxktjw,progresspics,lifestyle,1455301757,h4xdaplanet,4,0,2106,2196,0.0
577,578,great job  you are an inspiration,d00ftwh,progresspics,lifestyle,1455520776,iKnoMyCalculus,8,0,1,743,0.0
578,579,proud of you stranger  on top of looking younger you ll also be healthier ,d00mv0u,progresspics,lifestyle,1455545614,RosheRunning,4,0,2194,81,0.0
579,580,keep going  the improvement is so noticeable ,d00n8xc,progresspics,lifestyle,1455546442,JoshuMertens,4,0,9061,63621,0.0
580,581,you are so pretty  i love the picture from january  where you re standing in front of the orchids i had to look at it for a sec though because at first i thought you were standing in front of giant popcorn kernels ,czxjqke,progresspics,lifestyle,1455300277,travelinglemon,8,0,2,1947,0.0
581,582,what did you do calorie and exercise wise ,czy16gs,progresspics,lifestyle,1455327587,annievict,2,0,45,135,0.0
582,583,you look absolutely amazing  congrats on the loss and keep up the good work ,d00mpaz,progresspics,lifestyle,1455545263,captainchloe,3,0,343,19,0.0
583,584,you ve literally lost the weight if an entire human being congrats  feels good do nt it ,d00ojhl,progresspics,lifestyle,1455548993,NiceFormBro,2,0,9336,52583,0.0
584,585,congratulations  there is definitely nothing short cutesque about the path you are on your hard work has gotten you amazing results thanks for sharing and good luck going forward ,d013899,progresspics,lifestyle,1455570895,trajeder5,1,0,1,107,0.0
585,586,very impressive lady ,d00na87,progresspics,lifestyle,1455546519,pgamastermike,3,0,1671,482,0.0
586,587,,45v58p,progresspics,lifestyle,1455516684,trekbette,3933,0,11138,56137,0.0
